Authors,Title,Year,Source title,Link,Document Type,Source
"Yin R.K.",[No title available],1994,"Case Study Research: Design and Methods",,,Scopus
"Hair J.F., Anderson R.E., Tatham R.L., Black W.C.",[No title available],1995,"Multivariate Data Analysis",,,Scopus
"Nunnally J.C.",[No title available],1978,"Psychometric Theory",,,Scopus
"Strauss A., Corbin J.",[No title available],1998,"Basics of Qualitative Research: Techniques and Procedures for Developing Grounded Theory",,,Scopus
"Glaser B.G., Strauss A.L.",[No title available],1967,"The Discovery of Grounded Theory: Strategies for Qualitative Research",,,Scopus
"Baron R.M., Kenny D.A.","The Moderator-Mediator Variable Distinction in Social Psychological Research. Conceptual, Strategic, and Statistical Considerations",1986,"Journal of Personality and Social Psychology","https://www.scopus.com/inward/record.uri?eid=2-s2.0-0023020183&doi=10.1037%2f0022-3514.51.6.1173&partnerID=40&md5=f7a213e1cb3840999e3c803ebed94263",Article,Scopus
"Fornell C., Larcker D.F.","Evaluating structural equation models with unobservable variables and measurement error",1981,"Journal of Marketing Research",,,Scopus
"Rogers E.M.",[No title available],1995,"Diffusion of Innovations",,,Scopus
"Holland J.H.",[No title available],1975,"Adaptation in Natural and Artificial Systems",,,Scopus
"Podsakoff P.M., MacKenzie S.B., Lee J.-Y., Podsakoff N.P.","Common Method Biases in Behavioral Research: A Critical Review of the Literature and Recommended Remedies",2003,"Journal of Applied Psychology","https://www.scopus.com/inward/record.uri?eid=2-s2.0-0141907688&doi=10.1037%2f0021-9010.88.5.879&partnerID=40&md5=b94b2abc9bf1d6dbdafe9184dcf66441",Review,Scopus
"Greene W.H.",[No title available],1993,"Econometric Analysis",,,Scopus
"Cohen J., Cohen P.",[No title available],1983,"Applied Multiple Regression/Correlation Analysis for the Behavioral Sciences",,,Scopus
"Schön D.A.","The reflective practitioner: How professionals think in action",1983,"The Reflective Practitioner: How Professionals Think in Action",,,Scopus
"Creswell J.W.",[No title available],2003,"Research Design: Qualitative, Quantitative, and Mixed Methods Approaches",,,Scopus
"Barney J.","Firm Resources and Sustained Competitive Advantage",1991,"Journal of Management","https://www.scopus.com/inward/record.uri?eid=2-s2.0-84896930624&doi=10.1177%2f014920639101700108&partnerID=40&md5=ad9be229af0563c55c4fb54a2eff01f5",Article,Scopus
"Jensen M.C., Meckling W.H.","Theory of the firm: Managerial behavior, agency costs and ownership structure",1976,"Journal of Financial Economics","https://www.scopus.com/inward/record.uri?eid=2-s2.0-44649197264&doi=10.1016%2f0304-405X%2876%2990026-X&partnerID=40&md5=624ec43a6705d2ba23a641da56abc8a6",Article,Scopus
"Feller W.",[No title available],1971,"An Introduction to Probability Theory and Its Applications",,,Scopus
"Charmaz K.",[No title available],2006,"Constructing Grounded Theory: A Practical Guide Through Qualitative Analysis",,,Scopus
"Wooldridge J.M.",[No title available],2002,"Econometric Analysis of Cross Section and Panel Data",,,Scopus
"Wasserman S., Faust K.",[No title available],1994,"Social Network Analysis: Methods and Applications",,,Scopus
"Nelson R.R., Winter S.G.",[No title available],1982,"An Evolutionary Theory of Economic Change",,,Scopus
"Schumpeter J.A.",[No title available],1934,"The Theory of Economic Development",,,Scopus
"Venkatesh V., Morris M.G., Davis G.B., Davis F.D.","User acceptance of information technology: Toward a unified view",2003,"MIS Quarterly: Management Information Systems","https://www.scopus.com/inward/record.uri?eid=2-s2.0-1542382496&doi=10.2307%2f30036540&partnerID=40&md5=0145eeee9ddb1678e81b29817475e16c",Article,Scopus
"Cohen W.M., Levinthal D.A.","Absorptive capacity: A new perspective on learning and innovation",1990,"Administrative Science Quarterly",,,Scopus
"Schumpeter J.A.",[No title available],1942,"Capitalism, Socialism and Democracy",,,Scopus
"Granovetter M.","Economic action and social structure: The problem of embeddedness",1985,"American Journal of Sociology",,,Scopus
"Teece D.J., Pisano G., Shuen A.","Dynamic capabilities and strategic management",1997,"Strategic Management Journal","https://www.scopus.com/inward/record.uri?eid=2-s2.0-0342775775&doi=10.1002%2f%28SICI%291097-0266%28199708%2918%3a7%3c509%3a%3aAID-SMJ882%3e3.0.CO%3b2-Z&partnerID=40&md5=f0f0ecabb48fd21f159bcc245759ded2",Article,Scopus
"Castells M.",[No title available],1996,"The Rise of the Network Society",,,Scopus
"Albert R., Barabási A.-L.","Statistical mechanics of complex networks",2002,"Reviews of Modern Physics","https://www.scopus.com/inward/record.uri?eid=2-s2.0-0036013593&doi=10.1103%2fRevModPhys.74.47&partnerID=40&md5=7849e23292c3d114c7641cbe602dba40",Article,Scopus
"Gamma E., Helm R., Johnson R., Vlissides J.",[No title available],1995,"Design Patterns: Elements of Reusable Object-Oriented Software",,,Scopus
"Heckman J.J.","Sample selection bias as a specification error",1979,"Econometrica",,,Scopus
"Saldana J.","The coding manual for qualitative researchers",2009,"The Coding Manual for Qualitative Researchers",,,Scopus
"Porter M.E.",[No title available],1985,"Competitive Advantage: Creating and Sustaining Superior Performance",,,Scopus
"Williamson O.E.",[No title available],1975,"Markets and Hierarchies: Analysis and Antitrust Implications",,,Scopus
"Schein E.H.",[No title available],1985,"Organizational Culture and Leadership",,,Scopus
"Popper K.R.",[No title available],1959,"The Logic of Scientific Discovery",,,Scopus
"Wernerfelt B.","A resource‐based view of the firm",1984,"Strategic Management Journal","https://www.scopus.com/inward/record.uri?eid=2-s2.0-84989133012&doi=10.1002%2fsmj.4250050207&partnerID=40&md5=48dd0c77f4bbb0a1268dd284161aefb7",Article,Scopus
"Coase R.H.","The Nature of the Firm",1937,"Economica","https://www.scopus.com/inward/record.uri?eid=2-s2.0-84979188687&doi=10.1111%2fj.1468-0335.1937.tb00002.x&partnerID=40&md5=7b460c24145494399415c5e678353734",Article,Scopus
"Penrose E.",[No title available],1959,"The Theory of the Growth of the Firm",,,Scopus
"Porter M.E.",[No title available],1980,"Competitive Strategy",,,Scopus
"March J.G.","Exploration and exploitation in organizational learning",1991,"Organization Science",,,Scopus
"Armstrong J.S., Overton T.S.","Estimating nonresponse bias in mail surveys",1977,"Journal of Marketing Research",,,Scopus
"Chin W.W.","The partial least squares approach to structural equation modeling",1998,"Modern Methods for Business Research",,,Scopus
"Podsakoff P.M., Organ D.W.","Self-Reports in Organizational Research: Problems and Prospects",1986,"Journal of Management","https://www.scopus.com/inward/record.uri?eid=2-s2.0-84970235764&doi=10.1177%2f014920638601200408&partnerID=40&md5=6461ea40742d6b42fa1de62430d00ddb",Article,Scopus
"Thompson J.D.",[No title available],1967,"Organizations in Action: Social Science Bases of Administrative Theory",,,Scopus
"Nonaka I.","A dynamic theory of organizational knowledge creation",1994,"Organization Science",,,Scopus
"Burt R.S.",[No title available],1992,"Structural Holes: The Social Structure of Competition",,,Scopus
"Dillman D.A.",[No title available],2000,"Mail and Internet Surveys: The Tailored Design Method",,,Scopus
"Churchill G.A.","A paradigm for developing better measures of marketing constructs",1979,"Journal of Marketing Research",,,Scopus
"Sobel M.E.","Asymptotic confidence intervals for indirect effects in structural equation models",1982,"Sociological Methodology",,,Scopus
"Grant R.M.","Toward a knowledge-based theory of the firm",1996,"Strategic Management Journal","https://www.scopus.com/inward/record.uri?eid=2-s2.0-2942649403&doi=10.1002%2fsmj.4250171110&partnerID=40&md5=1fc9f3b5316656621fcce04dae1bd589",Article,Scopus
"Chesbrough H.",[No title available],2003,"Open Innovation: The New Imperative for Creating and Profiting from Technology",,,Scopus
"Eisenhardt K.M., Graebner M.E.","Theory building from cases: Opportunities and challenges",2007,"Academy of Management Journal","https://www.scopus.com/inward/record.uri?eid=2-s2.0-34047207566&doi=10.5465%2fAMJ.2007.24160888&partnerID=40&md5=4aa8493e96afccf9db60080af535710e",Article,Scopus
"Maddala G.S.",[No title available],1983,"Limited-Dependent and Qualitative Variables in Econometrics",,,Scopus
"Hevner A.R., March S.T., Park J., Ram S.","Design science in information systems research",2004,"MIS Quarterly: Management Information Systems","https://www.scopus.com/inward/record.uri?eid=2-s2.0-0242652022&doi=10.2307%2f25148625&partnerID=40&md5=fb1dde6271e2c2d4d646405dcddea0d1",Article,Scopus
"Eisenhardt K.M., Martin J.A.","Dynamic capabilities: What are they?",2000,"Strategic Management Journal","https://www.scopus.com/inward/record.uri?eid=2-s2.0-0000877903&doi=10.1002%2f1097-0266%28200010%2f11%2921%3a10%2f11%3c1105%3a%3aAID-SMJ133%3e3.0.CO%3b2-E&partnerID=40&md5=b6cf547bfcd95f6b2ac31570f93e62f3",Article,Scopus
"Fudenberg D., Tirole J.",[No title available],1991,"Game Theory",,,Scopus
"Harman H.H.",[No title available],1976,"Modern Factor Analysis",,,Scopus
"Kaplan R.S., Norton D.P.","The balanced scorecard--measures that drive performance.",1992,"Harvard business review","https://www.scopus.com/inward/record.uri?eid=2-s2.0-0026494564&partnerID=40&md5=0eb367a57bc0f2e41d4571d425b2b36c",Article,Scopus
"Silverman D.",[No title available],1993,"Interpreting Qualitative Data: Methods for Analysing Talk, Text and Interaction",,,Scopus
"Mell P., Grance T.",[No title available],2009,"The NIST Definition of Cloud Computing",,,Scopus
"Kogut B., Zander U.","Knowledge of the firm, combinative capabilities, and the replication of technology",1992,"Organization Science",,,Scopus
"Porter M.E.",[No title available],1980,"Competitive Strategy: Techniques for Analyzing Industries and Competitors",,,Scopus
"Armbrust M., Fox A., Griffith R., Joseph A.D., Katz R., Konwinski A., Lee G., Patterson D., Rabkin A., Stoica I., Zaharia M.","A view of cloud computing",2010,"Communications of the ACM","https://www.scopus.com/inward/record.uri?eid=2-s2.0-77950347409&doi=10.1145%2f1721654.1721672&partnerID=40&md5=6164f58679f057d5164d1f8f31d3f125",Review,Scopus
"Shane S., Venkataraman S.","The promise of entrepreneurship as a field of research",2000,"Academy of Management Review","https://www.scopus.com/inward/record.uri?eid=2-s2.0-0034341743&doi=10.5465%2fAMR.2000.2791611&partnerID=40&md5=595eb11c0f2795c8bd714d2f114c9bf0",Article,Scopus
"Dixit A.K., Pindyck R.S.","Investment under uncertainty",2012,"Investment under Uncertainty","https://www.scopus.com/inward/record.uri?eid=2-s2.0-84891010016&partnerID=40&md5=3f59d244e4be90c32e73c79036dc3218",Book,Scopus
"Burns T., Stalker G.M.",[No title available],1961,"The Management of Innovation",,,Scopus
"DeLone W.H., McLean E.R.","The DeLone and McLean model of information systems success: A ten-year update",2003,"Journal of Management Information Systems","https://www.scopus.com/inward/record.uri?eid=2-s2.0-0037368865&doi=10.1080%2f07421222.2003.11045748&partnerID=40&md5=3c08f96c96a1b5d5be9cb589ea4ac464",Conference Paper,Scopus
"DeLone W.H., McLean E.R.","Information systems success: The quest for the dependent variable",1992,"Information Systems Research","https://www.scopus.com/inward/record.uri?eid=2-s2.0-72249114849&doi=10.1287%2fisre.3.1.60&partnerID=40&md5=648fb88a25e8c62b24d9e517028c9b5b",Article,Scopus
"Kauffman S.A.",[No title available],1993,"The Origins of Order: Self-Organization and Selection in Evolution",,,Scopus
"Alavi M., Leidner D.E.","Review: Knowledge management and knowledge management systems: Conceptual foundations and research issues",2001,"MIS Quarterly: Management Information Systems","https://www.scopus.com/inward/record.uri?eid=2-s2.0-9744248703&doi=10.2307%2f3250961&partnerID=40&md5=ec1d3a291d7329ac1ccc48c58fb28952",Article,Scopus
"Albert R., Jeong H., Barabási A.-L.","Error and attack tolerance of complex networks",2000,"Nature","https://www.scopus.com/inward/record.uri?eid=2-s2.0-0034721164&doi=10.1038%2f35019019&partnerID=40&md5=547ac14cb5d64895133ec6e58abe9ee1",Article,Scopus
"Eisenhardt K.M.","Agency theory: An assessment and review",1989,"Academy of Management Review",,,Scopus
"Tirole J.",[No title available],1988,"The Theory of Industrial Organization",,,Scopus
"Wright S.","Evolution in Mendelian populations",1931,"Genetics",,,Scopus
"Zahra S.A., George G.","Absorptive capacity: A review, reconceptualization, and extension",2002,"Academy of Management Review","https://www.scopus.com/inward/record.uri?eid=2-s2.0-0036011963&doi=10.5465%2fAMR.2002.6587995&partnerID=40&md5=6931689a224f2ee221af2f3bfd9a3e53",Review,Scopus
"Barnard C.I.",[No title available],1938,"The Functions of the Executive",,,Scopus
"Teece D.J.","Profiting from technological innovation: Implications for integration, collaboration, licensing and public policy",1986,"Research Policy","https://www.scopus.com/inward/record.uri?eid=2-s2.0-38549086633&doi=10.1016%2f0048-7333%2886%2990027-2&partnerID=40&md5=6b6b21beec0ddfb1c07c83ee716d5975",Article,Scopus
"Peteraf M.A.","The cornerstones of competitive advantage: A resource‐based view",1993,"Strategic Management Journal","https://www.scopus.com/inward/record.uri?eid=2-s2.0-84989113324&doi=10.1002%2fsmj.4250140303&partnerID=40&md5=283e254be544798927bc68e5c3ae1917",Article,Scopus
"Schumacker R.E., Lomax R.G.",[No title available],1996,"A Beginner's Guide to Structural Equation Modeling",,,Scopus
"Alchian A.A., Demsetz H.","Production, information costs, and economic organization",1972,"American Economic Review",,,Scopus
"Chandler A.D.",[No title available],1962,"Strategy and Structure: Chapters in the History of the American Industrial Enterprise",,,Scopus
"Janis I.L.",[No title available],1982,"Groupthink: Psychological Studies of Policy Decisions and Fiascoes",,,Scopus
"Moore G.C., Benbasat I.","Development of an instrument to measure the perceptions of adopting an information technology innovation",1991,"Information Systems Research","https://www.scopus.com/inward/record.uri?eid=2-s2.0-73449149291&doi=10.1287%2fisre.2.3.192&partnerID=40&md5=a37a9fd47cd98e8dcde3ac1e8df7e009",Article,Scopus
"Carmines E.G., Zeller R.A.","Reliability and validity assessment",1979,"Reliability and Validity Assessment",,,Scopus
"Powell W.W., Koput K.W., Smith-Doerr L.","Interorganizational collaboration and the locus of innovation: Networks of learning in biotechnology",1996,"Administrative Science Quarterly","https://www.scopus.com/inward/record.uri?eid=2-s2.0-0030306449&doi=10.2307%2f2393988&partnerID=40&md5=6ed741c2907c08af7aee405cb0fcec5b",Article,Scopus
"Lindblom C.E.","The science of muddling through",1959,"Public Administration Review",,,Scopus
"Williamson O.E.","Transaction-cost economics: The governance of contractual relations",1979,"Journal of Law and Economics",,,Scopus
"Grant R.M.","The Resource-Based Theory of Competitive Advantage: Implications for Strategy Formulation",1991,"California Management Review","https://www.scopus.com/inward/record.uri?eid=2-s2.0-84968099966&doi=10.2307%2f41166664&partnerID=40&md5=3be7669cd2c4d948d7f0348d6c7e4abf",Article,Scopus
"Levitt B., March J.G.","Organizational learning",1988,"Annual Review of Sociology",,,Scopus
"Henderson R.M., Clark K.B.","Architectural innovation: The reconfiguration of existing product technologies and the failure of established firms",1990,"Administrative Science Quarterly",,,Scopus
"Dierickx I., Cool K.","Asset stock accumulation and sustainability of competitive advantage",1989,"Management Science",,,Scopus
"Jaworski B.J., Kohli A.K.","Market orientation: Antecedents and consequences",1993,"Journal of Marketing",,,Scopus
"Miles R.E., Snow C.C.",[No title available],1978,"Organizational Strategy, Structure, and Process",,,Scopus
"Amit R., Schoemaker P.J.H.","Strategic assets and organizational rent",1993,"Strategic Management Journal","https://www.scopus.com/inward/record.uri?eid=2-s2.0-84989092230&doi=10.1002%2fsmj.4250140105&partnerID=40&md5=dba5f49823eb63caa0b1c69d43af8bf4",Article,Scopus
"Osterwalder A., Pigneur Y.",[No title available],2010,"Business Model Generation",,,Scopus
"Porter M.E.",[No title available],1985,"Competitive Advantage",,,Scopus
"Levinthal D.A., March J.G.","The myopia of learning",1993,"Strategic Management Journal","https://www.scopus.com/inward/record.uri?eid=2-s2.0-84989063836&doi=10.1002%2fsmj.4250141009&partnerID=40&md5=b5d123a1b797d30bf5934c6b29e8c273",Article,Scopus
"Ricardo D.",[No title available],1817,"The Principles of Political Economy and Taxation",,,Scopus
"Ashby W.R.",[No title available],1956,"An Introduction to Cybernetics",,,Scopus
"Lindell M.K., Whitney D.J.","Accounting for common method variance in cross-sectional research designs",2001,"Journal of Applied Psychology","https://www.scopus.com/inward/record.uri?eid=2-s2.0-84991904404&doi=10.1037%2f0021-9010.86.1.114&partnerID=40&md5=6a3895898ebf8494d78b2e0be61339ae",Article,Scopus
"Gefen D., Straub D., Boudreau M.","Structural equation modeling and regression: Guidelines for research practice",2000,"Communications of the Association for Information Systems",,,Scopus
"Schumpeter J.A.",[No title available],1954,"History of Economic Analysis",,,Scopus
"Pawson R., Tilley N.",[No title available],1997,"Realistic Evaluation",,,Scopus
"Buyya R., Yeo C.S., Venugopal S., Broberg J., Brandic I.","Cloud computing and emerging IT platforms: Vision, hype, and reality for delivering computing as the 5th utility",2009,"Future Generation Computer Systems","https://www.scopus.com/inward/record.uri?eid=2-s2.0-63649117166&doi=10.1016%2fj.future.2008.12.001&partnerID=40&md5=cc44cba36b6a2a7c08abac904f351544",Article,Scopus
"Mintzberg H.","The structuring of organizations",1979,"The Structuring of Organizations",,,Scopus
"Bhattacherjee A.","Understanding information systems continuance: An expectation-confirmation model",2001,"MIS Quarterly: Management Information Systems","https://www.scopus.com/inward/record.uri?eid=2-s2.0-0000998647&doi=10.2307%2f3250921&partnerID=40&md5=bcd1ddf8c0b536aaddf30bdc30748fcd",Article,Scopus
"Surowiecki J.",[No title available],2004,"The Wisdom of Crowds",,,Scopus
"Amabile T.M.",[No title available],1996,"Creativity in Context",,,Scopus
"Gerbing D.W., Anderson J.C.","An updated paradigm for scale development incorporating unidimensionality and its assessment",1988,"Journal of Marketing Research",,,Scopus
"Staiger D., Stock J.H.","Instrumental variables regression with weak instruments",1997,"Econometrica","https://www.scopus.com/inward/record.uri?eid=2-s2.0-0346307687&doi=10.2307%2f2171753&partnerID=40&md5=391855336b8537888ae084c96bf4a16d",Article,Scopus
"Taleb N.N.",[No title available],2007,"The Black Swan: The Impact of the Highly Improbable",,,Scopus
"Chin W.W.","Issues and opinion on structural equation modeling",1998,"MIS Quarterly: Management Information Systems","https://www.scopus.com/inward/record.uri?eid=2-s2.0-0002042337&partnerID=40&md5=4385da2ebfbe717f06324e00e6ab9a99",Review,Scopus
"Hulland J.","Use of partial least squares (PLS) in strategic management research: A review of four recent studies",1999,"Strategic Management Journal","https://www.scopus.com/inward/record.uri?eid=2-s2.0-0000230521&doi=10.1002%2f%28sici%291097-0266%28199902%2920%3a2%3c195%3a%3aaid-smj13%3e3.0.co%3b2-7&partnerID=40&md5=4b77841347590623614cf057cb417f79",Article,Scopus
"Ringle C.M., Wende S., Becker J.-M.","SmartPLS 3",2015,"SmartPLS 3",,,Scopus
"Leonard‐Barton D.","Core capabilities and core rigidities: A paradox in managing new product development",1992,"Strategic Management Journal","https://www.scopus.com/inward/record.uri?eid=2-s2.0-84938687906&doi=10.1002%2fsmj.4250131009&partnerID=40&md5=74613b0261ed64b524f0c4edf4d9947e",Article,Scopus
"Chin W.W., Marcelin B.L., Newsted P.R.","A partial least squares latent variable modeling approach for measuring interaction effects: Results from a Monte Carlo simulation study and an electronic-mail emotion/adoption study",2003,"Information Systems Research","https://www.scopus.com/inward/record.uri?eid=2-s2.0-0042242856&doi=10.1287%2fisre.14.2.189.16018&partnerID=40&md5=9fc1325b8e655f3042bd210792b074fe",Article,Scopus
"Zollo M., Winter S.G.","Deliberate learning and the evolution of dynamic capabilities",2002,"Organization Science","https://www.scopus.com/inward/record.uri?eid=2-s2.0-0036014175&doi=10.1287%2forsc.13.3.339.2780&partnerID=40&md5=072655de03420a36e7ffc73e72936ea7",Article,Scopus
"Strauss A., Corbin J.","Grounded theory methodology: An overview",1994,"Handbook of Qualitative Research",,,Scopus
"Grant R.M.","Prospering in Dynamically-competitive Environments: Organizational Capability as Knowledge Integration",1996,"Organization Science","https://www.scopus.com/inward/record.uri?eid=2-s2.0-0030505108&doi=10.1287%2forsc.7.4.375&partnerID=40&md5=e1c48fb720cc935bada309222d0c88c1",Article,Scopus
"Teece D.J.","Business models, business strategy and innovation",2010,"Long Range Planning","https://www.scopus.com/inward/record.uri?eid=2-s2.0-77952581340&doi=10.1016%2fj.lrp.2009.07.003&partnerID=40&md5=43554b9b1cdb63f678b19488a41d2766",Article,Scopus
"Shapiro C., Varian H.R.","Information rules: A strategic guide to the network economy",1999,"Information Rules: A Strategic Guide to the Network Economy",,,Scopus
"Peffers K., Tuunanen T., Rothenberger M.A., Chatterjee S.","A design science research methodology for information systems research",2007,"Journal of Management Information Systems","https://www.scopus.com/inward/record.uri?eid=2-s2.0-39749104751&doi=10.2753%2fMIS0742-1222240302&partnerID=40&md5=7197b8ba5d16cb8db9717e8cd7d9072b",Article,Scopus
"Jarvis C.B., Mackenzie S.B., Podsakoff P.M., Giliatt N., Mee J.F.","A Critical Review of Construct Indicators and Measurement Model Misspecification in Marketing and Consumer Research",2003,"Journal of Consumer Research","https://www.scopus.com/inward/record.uri?eid=2-s2.0-0242424963&doi=10.1086%2f376806&partnerID=40&md5=8005b733484cad52126aa3710b9e00e1",Review,Scopus
"Alexander C., Ishikawa S., Silverstein M.",[No title available],1977,"A Pattern Language: Towns, Buildings, Construction",,,Scopus
"Williamson O.E.","The economics of organization: The transaction cost approach",1981,"American Journal of Sociology",,,Scopus
"Janis I.L., Mann L.",[No title available],1977,"Decision Making: A Psychological Analysis of Conflict, Choice, and Commitment",,,Scopus
"Klein H.K., Myers M.D.","A set of principles for conducting and evaluating interpretive field studies in information systems",1999,"MIS Quarterly: Management Information Systems","https://www.scopus.com/inward/record.uri?eid=2-s2.0-0001946339&doi=10.2307%2f249410&partnerID=40&md5=18a010339a901019fab06052a5bd0304",Article,Scopus
"Porter M.E.","What is strategy?",1996,"Harvard Business Review",,,Scopus
"Zeithaml V.A., Bitner M.J.",[No title available],2000,"Services Marketing: Integrating Customer Focus Across the Firm",,,Scopus
"Tenenhaus M., Vinzi V.E., Chatelin Y.-M., Lauro C.","PLS path modeling",2005,"Computational Statistics and Data Analysis","https://www.scopus.com/inward/record.uri?eid=2-s2.0-10144243373&doi=10.1016%2fj.csda.2004.03.005&partnerID=40&md5=8dafcc176c9e2c2d8c1fc5ee266c0bf0",Article,Scopus
"Van Maanen J.",[No title available],1988,"Tales of the Field: On Writing Ethnography",,,Scopus
"Child J.","Organizational Structure, Environment and Performance: The Role of Strategic Choice",1972,"Sociology","https://www.scopus.com/inward/record.uri?eid=2-s2.0-33744870364&doi=10.1177%2f003803857200600101&partnerID=40&md5=bffd001d84df913c45aaa4e8ec9471dc",Article,Scopus
"Amabile T.M., Conti R., Coon H., Lazenby J., Herron M.","Assessing the work environment for creativity",1996,"Academy of Management Journal","https://www.scopus.com/inward/record.uri?eid=2-s2.0-0030305351&doi=10.2307%2f256995&partnerID=40&md5=7c683f585bb6f2569e9b6392fdce8eb0",Article,Scopus
"Davenport T.H.",[No title available],1993,"Process Innovation: Reengineering Work Through Information Technology",,,Scopus
"Mintzberg H.","The rise and fall of strategic planning",1994,"The Rise and Fall of Strategic Planning",,,Scopus
"Ahuja G.","Collaboration networks, structural holes, and innovation: A longitudinal study",2000,"Administrative Science Quarterly","https://www.scopus.com/inward/record.uri?eid=2-s2.0-0034336937&doi=10.2307%2f2667105&partnerID=40&md5=94655ed9af7f1bc5f048c364c0a2bdef",Article,Scopus
"Bharadwaj A.S.","A resource-based perspective on information technology capability and firm performance: An empirical investigation",2000,"MIS Quarterly: Management Information Systems","https://www.scopus.com/inward/record.uri?eid=2-s2.0-9744285772&doi=10.2307%2f3250983&partnerID=40&md5=0300f008ef53b7414fe7f91697e9d826",Article,Scopus
"Barney J.B.","Strategic factor markets: Expectations, luck, and business strategy",1986,"Management Science",,,Scopus
"Drucker P.F.","The practice of management",1954,"The Practice of Management",,,Scopus
"Benbasat I., Goldstein D.K., Mead M.","The case research strategy in studies of information systems",1987,"MIS Quarterly: Management Information Systems","https://www.scopus.com/inward/record.uri?eid=2-s2.0-55249084997&doi=10.2307%2f248684&partnerID=40&md5=3f8c543931b9a67b0b86da050bc87e9d",Article,Scopus
"Diamantopoulos A., Winklhofer H.M.","Index construction with formative indicators: An alternative to scale development",2001,"Journal of Marketing Research","https://www.scopus.com/inward/record.uri?eid=2-s2.0-0035534144&doi=10.1509%2fjmkr.38.2.269.18845&partnerID=40&md5=d980ef5558574770b096a3510be455a5",Article,Scopus
"Gold A.H., Malhotra A., Segars A.H.","Knowledge management: An organizational capabilities perspective",2001,"Journal of Management Information Systems","https://www.scopus.com/inward/record.uri?eid=2-s2.0-0034906005&doi=10.1080%2f07421222.2001.11045669&partnerID=40&md5=8928585cbc0aeab43666f49271c2a0e3",Article,Scopus
