Authors,Title,Year,Source title,Link,Document Type,Source
"Tallon P.P.","Inside the adaptive enterprise: An information technology capabilities perspective on business process agility",2008,"Information Technology and Management","https://www.scopus.com/inward/record.uri?eid=2-s2.0-38949151847&doi=10.1007%2fs10799-007-0024-8&partnerID=40&md5=bcbcee0a8f3f664989f47093b7a6d8ad",Article,Scopus
"Kearns G.S., Lederer A.L.","The effect of strategic alignment on the use of IS-based resources for competitive advantage",2000,"Journal of Strategic Information Systems","https://www.scopus.com/inward/record.uri?eid=2-s2.0-0034448315&doi=10.1016%2fS0963-8687%2800%2900049-4&partnerID=40&md5=e7b4670390ecb480aee26474fe792933",Article,Scopus
"Premkumar G., King W.R.","Organizational characteristics and information systems planning: An empirical study",1994,"Information Systems Research","https://www.scopus.com/inward/record.uri?eid=2-s2.0-0002904380&doi=10.1287%2fisre.5.2.75&partnerID=40&md5=d4b976d43571620c657453a0dafd3929",Article,Scopus
"Jelinek M., Schoonhoven C.B.",[No title available],1990,"The Innovation Marathon: Lessons from High Technology Firms",,,Scopus
"Benbya H., McKelvey B.","Using coevolutionary and complexity theories to improve IS alignment: A multi-level approach",2006,"Journal of Information Technology","https://www.scopus.com/inward/record.uri?eid=2-s2.0-33751501771&doi=10.1057%2fpalgrave.jit.2000080&partnerID=40&md5=4b5de5b4530a408978a847836408976e",Article,Scopus
"Marchand D.A., Kettinger W.J., Rollins J.D.","Information orientation: People, technology and the bottom line",2000,"Sloan Management Review",,,Scopus
"Salop S.","Practices that (credibly) facilitate oligopoly coordination",1986,"New Developments in the Analysis of Market Structure",,,Scopus
"Hitt L.M.","Information Technology and Firm Boundaries: Evidence from Panel Data",1999,"Information Systems Research","https://www.scopus.com/inward/record.uri?eid=2-s2.0-0033420384&doi=10.1287%2fisre.10.2.134&partnerID=40&md5=78140ddf50f26247603eae27ad48296e",Article,Scopus
"King J.L., Kraemer K.L.","Evolution and Organizational Information Systems: An Assessment of Nolan's Stage Model",1984,"Communications of the ACM","https://www.scopus.com/inward/record.uri?eid=2-s2.0-0021436264&doi=10.1145%2f358189.358074&partnerID=40&md5=5cf672a432cb3c1956cd5054a2b88119",Article,Scopus
"Hayton J.C.","Competing in the new economy: The effect of intellectual capital on corporate entrepreneurship in high-technology new ventures",2005,"R and D Management","https://www.scopus.com/inward/record.uri?eid=2-s2.0-15944406449&doi=10.1111%2fj.1467-9310.2005.00379.x&partnerID=40&md5=ad79ae69257ff8a65b3c1be471f47eeb",Article,Scopus
"Poon P., Wagner C.","Critical success factors revisited: Success and failure cases of information systems for senior executives",2001,"Decision Support Systems","https://www.scopus.com/inward/record.uri?eid=2-s2.0-0035283456&doi=10.1016%2fS0167-9236%2800%2900069-5&partnerID=40&md5=cf450d9f8ed20065937af4676d24440f",Article,Scopus
"Allen B.R., Boynton A.C.","Information architecture: In search of efficient flexibility",1991,"MIS Quarterly: Management Information Systems","https://www.scopus.com/inward/record.uri?eid=2-s2.0-0000081345&doi=10.2307%2f249447&partnerID=40&md5=6712fb03fc27f28d8ebe9a022ad75da4",Article,Scopus
"Martin J.",[No title available],1982,"Strategic Data Planning Methodologies",,,Scopus
"Levy M., Powell P., Yetton P.","SMEs: Aligning IS and the strategic context",2001,"Journal of Information Technology","https://www.scopus.com/inward/record.uri?eid=2-s2.0-0035539315&doi=10.1080%2f02683960110063672&partnerID=40&md5=dc10a4f01a909d3aed515c3e9a98e7e6",Article,Scopus
"Mitchell J.R., Shepherd D.A.","To thine own self be true: Images of self, images of opportunity, and entrepreneurial action",2010,"Journal of Business Venturing","https://www.scopus.com/inward/record.uri?eid=2-s2.0-70449640972&doi=10.1016%2fj.jbusvent.2008.08.001&partnerID=40&md5=89e6026c29ad57fe997f54ed1af65560",Article,Scopus
"Walker R.M.","Innovation type and diffusion: An empirical analysis of local government",2006,"Public Administration","https://www.scopus.com/inward/record.uri?eid=2-s2.0-33744496086&doi=10.1111%2fj.1467-9299.2006.00004.x&partnerID=40&md5=6c100cdbbe3a82266d9ca6b8716de7b7",Article,Scopus
"Zahra S.A., George G.","The net-enabled business innovation cycle and the evolution of dynamic capabilities",2002,"Information Systems Research","https://www.scopus.com/inward/record.uri?eid=2-s2.0-0036015963&doi=10.1287%2fisre.13.2.147.90&partnerID=40&md5=457774bdd09f42c1bb8eba4283cc3165",Article,Scopus
"Watson R.T., Pitt L.F., Kavan C.B.","Measuring information systems service quality: Lessons from two longitudinal case studies",1998,"MIS Quarterly: Management Information Systems","https://www.scopus.com/inward/record.uri?eid=2-s2.0-0002024292&doi=10.2307%2f249678&partnerID=40&md5=a5ca6ee2d72a3dc92ef9011d6ff313e8",Article,Scopus
"Jarvenpaa S.L., Ives B.","The global network organization of the future: Information management opportunities and challenges",1993,"Journal of Management Information Systems","https://www.scopus.com/inward/record.uri?eid=2-s2.0-70449816069&doi=10.1080%2f07421222.1994.11518019&partnerID=40&md5=48daaae86b6aea5b4a8f90bb78b10163",Article,Scopus
"Pentland B.T.","Organizing moves in software support hot lines",1992,"Administrative Science Quarterly",,,Scopus
"Garson G.D.","Statnotes: Topics in Multivariate Analysis",2009,"Statnotes: Topics in Multivariate Analysis",,,Scopus
"Sethi R., Iqbal Z.","Stage-gate controls, learning failure, and adverse effect on novel new products",2008,"Journal of Marketing","https://www.scopus.com/inward/record.uri?eid=2-s2.0-39749142764&doi=10.1509%2fjmkg.72.1.118&partnerID=40&md5=e24023025ba498fbd3ff287ef85e18f8",Article,Scopus
"Henderson J.C., Venkatraman N.","Strategic alignment: A model for organizational transformation through information technology",1992,"Transforming Organizations",,,Scopus
"Lee S., Park Y.","Customization of technology roadmaps according to roadmapping purposes: Overall process and detailed modules",2005,"Technological Forecasting and Social Change","https://www.scopus.com/inward/record.uri?eid=2-s2.0-17544365513&doi=10.1016%2fj.techfore.2004.11.006&partnerID=40&md5=55418e8750094007221a1f2ff04c6871",Article,Scopus
"Bakos J.Y.","Information links and electronic marketplaces: The role of interorganizational information systems in vertical markets",1991,"Journal of Management Information Systems","https://www.scopus.com/inward/record.uri?eid=2-s2.0-3543127610&doi=10.1080%2f07421222.1991.11517920&partnerID=40&md5=cbc59d9549ffb6f6c4084f25c07229fe",Article,Scopus
"Pyburn P.J.","Linking the MIS plan with corporate strategy: An exploratory study",1983,"MIS Quarterly: Management Information Systems","https://www.scopus.com/inward/record.uri?eid=2-s2.0-55249118032&doi=10.2307%2f248909&partnerID=40&md5=c46b096f3c83d804f9fcb9b59c31dcfa",Article,Scopus
"Carmines E.G., Zeller R.A.","Reliability and validity assessment",1979,"Quantitative Applications in the Social Sciences",,,Scopus
"Clark Jr. T.D., Jones M.C., Armstrong C.P.","The dynamic structure of management support systems: Theory development, research focus, and direction",2007,"MIS Quarterly: Management Information Systems","https://www.scopus.com/inward/record.uri?eid=2-s2.0-34548417961&doi=10.2307%2f25148808&partnerID=40&md5=17b4caf5d89e3d311f762b1804da5171",Conference Paper,Scopus
"Montealegre R.","A process model of capability development: Lessons from the electronic commerce strategy at Bolsa de Valores de Guayaquil",2002,"Organization Science","https://www.scopus.com/inward/record.uri?eid=2-s2.0-0036746409&doi=10.1287%2forsc.13.5.514.7808&partnerID=40&md5=e5358ddf1e43b4f811925a77be9595e1",Article,Scopus
"Al-Mudimigh A., Zairi M., Al-Mashari M.","ERP software implementation: An integrative framework",2001,"European Journal of Information Systems","https://www.scopus.com/inward/record.uri?eid=2-s2.0-23044530867&doi=10.1057%2fpalgrave.ejis.3000406&partnerID=40&md5=f7423a37ca5989bff17288b18af71923",Article,Scopus
"Gollier C., Jullien B., Treich N.","Scientific progress and irreversibility: An economic interpretation of the 'Precautionary Principle'",2000,"Journal of Public Economics","https://www.scopus.com/inward/record.uri?eid=2-s2.0-0000984760&doi=10.1016%2fS0047-2727%2899%2900052-3&partnerID=40&md5=b26678ce0b66c3cdc3911341f0ea71dd",Article,Scopus
"Watson R.T., Kelly G.G., Galliers R.D., Brancheau J.C.","Key issues in information systems management: An international perspective",1997,"Journal of Management Information Systems","https://www.scopus.com/inward/record.uri?eid=2-s2.0-0031288392&doi=10.1080%2f07421222.1997.11518144&partnerID=40&md5=1f98c82e0c534b0d69d074ddce720ab3",Review,Scopus
"Rivkin J.W., Siggelkow N.","Patterned interactions in complex systems: Implications for exploration",2007,"Management Science","https://www.scopus.com/inward/record.uri?eid=2-s2.0-36849080236&doi=10.1287%2fmnsc.1060.0626&partnerID=40&md5=8f9f03eb496f71550f40f699a0a766f7",Article,Scopus
"Hirschheim R., Sabherwal R.","Detours in the path toward strategic information systems alignment",2001,"California Management Review","https://www.scopus.com/inward/record.uri?eid=2-s2.0-0035730261&doi=10.2307%2f41166112&partnerID=40&md5=e2c45b5ee042a78b22dbd430390bdc6b",Article,Scopus
"Bakos J.Y., Brynjolfsson E.","From vendors to partners: Information technology and incomplete contracts in buyer-supplier relationships",1993,"Journal of Organizational Computing",,,Scopus
"Tavakolian H.","Linking the information technology structure with organizational competitive strategy: A survey",1989,"MIS Quarterly: Management Information Systems","https://www.scopus.com/inward/record.uri?eid=2-s2.0-0000716970&doi=10.2307%2f249006&partnerID=40&md5=55e1b6e03428ce710d46983a7ce8282e",Review,Scopus
"Bacon C.J.","The use of decision criteria in selecting information systems/technology investments",1992,"MIS Quarterly: Management Information Systems","https://www.scopus.com/inward/record.uri?eid=2-s2.0-53349174733&doi=10.2307%2f249532&partnerID=40&md5=ae282c4564c83985692757c164431f8c",Article,Scopus
"Drnevich P.L., Croson D.C.","Information technology and business-level strategy: Toward an integrated theoretical perspective",2013,"MIS Quarterly: Management Information Systems","https://www.scopus.com/inward/record.uri?eid=2-s2.0-84876868001&doi=10.25300%2fMISQ%2f2013%2f37.2.08&partnerID=40&md5=cdd0c1e9862c02a5f11a9ff579ff95b9",Article,Scopus
"Helm S., Eggert A., Garnefeld I.","Modeling the impact of corporate reputation on customer satisfaction and loyalty using partial least squares",2010,"Handbook of Partial Least Squares",,,Scopus
"Bergeron F., Raymond L., Rivard S.","Fit in strategic information technology management research: An empirical comparison of perspectives",2001,"Omega","https://www.scopus.com/inward/record.uri?eid=2-s2.0-0010098726&doi=10.1016%2fS0305-0483%2800%2900034-7&partnerID=40&md5=bf71009b8750e6bc41f6226d54ecf409",Article,Scopus
"Lederer A.L., Sethi V.","Key Prescriptions for Strategic Information Systems Planning",1996,"Journal of Management Information Systems","https://www.scopus.com/inward/record.uri?eid=2-s2.0-0030307368&doi=10.1080%2f07421222.1996.11518111&partnerID=40&md5=e219338f085d04acb9d1ecdb6f21f77b",Article,Scopus
"Levy M., Powell P.","Information systems strategy for small and medium sized enterprises: An organisational perspective",2000,"Journal of Strategic Information Systems","https://www.scopus.com/inward/record.uri?eid=2-s2.0-0002639575&doi=10.1016%2fS0963-8687%2800%2900028-7&partnerID=40&md5=3a71517efc25eb74786b837b30b739fd",Article,Scopus
"Henderson R., Mitchell W.","The interactions of organizational and competitive influences on strategy and performance",1997,"Strategic Management Journal","https://www.scopus.com/inward/record.uri?eid=2-s2.0-0002473401&doi=10.1002%2f%28sici%291097-0266%28199707%2918%3a1%2b%3c5%3a%3aaid-smj930%3e3.3.co%3b2-9&partnerID=40&md5=af2e142fae3a5b2a3f1a8241cb630d4b",Article,Scopus
"Scott Morton M.",[No title available],1991,"The Corporation of the 1990s",,,Scopus
"Banker R.D., Hu N., Pavlou P.A., Luftman J.","CIO reporting structure, strategic positioning, and firm performance",2011,"MIS Quarterly: Management Information Systems","https://www.scopus.com/inward/record.uri?eid=2-s2.0-80051731490&doi=10.2307%2f23044053&partnerID=40&md5=65bab45660f7f646271caafd12e6de45",Article,Scopus
"Teo T.S.H., Ang J.S.K.","Critical success factors in the alignment of IS plans with business plans",1999,"International Journal of Information Management","https://www.scopus.com/inward/record.uri?eid=2-s2.0-0033115568&doi=10.1016%2fS0268-4012%2899%2900007-9&partnerID=40&md5=9234bc97ee1af12eb2284d60ac4adb2e",Article,Scopus
"Goold M., Quinn J.J.","The paradox of strategic controls",1990,"Strategic Management Journal","https://www.scopus.com/inward/record.uri?eid=2-s2.0-84989060457&doi=10.1002%2fsmj.4250110104&partnerID=40&md5=a7fb306edd808b869ec78bc1a645eb42",Article,Scopus
"Segars A.H., Grover V.","Profiles of Strategic Information Systems Planning",1999,"Information Systems Research","https://www.scopus.com/inward/record.uri?eid=2-s2.0-0006528240&doi=10.1287%2fisre.10.3.199&partnerID=40&md5=58fe0d1fa44941171db189804c9b3d03",Article,Scopus
"Crocker K.J., Masten S.E.","Mitigating contractual hazards: Unilateral options and contract length",1988,"RAND Journal of Economics",,,Scopus
"McLean E.R., Soden J.V.",[No title available],1977,"Strategic Planning for MIS",,,Scopus
"Fiol C.M.","Revisiting an identity-based view of sustainable competitive advantage",2001,"Journal of Management","https://www.scopus.com/inward/record.uri?eid=2-s2.0-0012341874&doi=10.1016%2fS0149-2063%2801%2900119-2&partnerID=40&md5=b02e8df3abf73d49d18f342f0d6b6991",Article,Scopus
"Ahituv N., Neumann S.",[No title available],1990,"Principles of Information Systems for Management",,,Scopus
"Ringle C.M., Wende S., Will A.",[No title available],2005,"SmartPLS 2.0 (Beta)",,,Scopus
"Reich B.H., Benbasat I.","An empirical investigation of factors influencing the success of customer-oriented strategic systems",1990,"Information Systems Research","https://www.scopus.com/inward/record.uri?eid=2-s2.0-0003186053&doi=10.1287%2fisre.1.3.325&partnerID=40&md5=62c8cd73485e89482c9175d28be378bc",Article,Scopus
"Lee O.-K., Sambamurthy V., Lim K.H., Wei K.K.","How does IT ambidexterity impact organizational agility?",2015,"Information Systems Research","https://www.scopus.com/inward/record.uri?eid=2-s2.0-84959204513&doi=10.1287%2fisre.2015.0577&partnerID=40&md5=ddef70af06ea368f753eb135b6a4130c",Article,Scopus
"Das S.R., Zahra S.A., Warkentin M.E.","Integrating the content and process of strategic MIS planning with competitive strategy",1991,"Decision Sciences",,,Scopus
"Goodhue D., Lewis W., Thompson R.","Statistical power in analyzing interaction effects: Questioning the advantage of PLS with product indicators",2007,"Information Systems Research","https://www.scopus.com/inward/record.uri?eid=2-s2.0-57649121504&doi=10.1287%2fisre.1070.0123&partnerID=40&md5=8c6488bc4f19106a98075648ea0ac99f",Article,Scopus
"Iyengar S.","The art of choosing",2010,"The Art of Choosing",,,Scopus
"Karimi J., Somers T.M., Bhattacherjee A.","The role of information systems resources in ERP capability building and business process outcomes",2007,"Journal of Management Information Systems","https://www.scopus.com/inward/record.uri?eid=2-s2.0-38349141625&doi=10.2753%2fMIS0742-1222240209&partnerID=40&md5=9131d81c36200201caa64032ca707dd1",Article,Scopus
"Luftman J.N.",[No title available],1996,"Competing in the Information Age: Strategic Alignment in Practice",,,Scopus
"Baskerville R.L., Myers M.D.","Fashion waves in information systems research and practice",2009,"MIS Quarterly: Management Information Systems","https://www.scopus.com/inward/record.uri?eid=2-s2.0-72049088513&doi=10.2307%2f20650319&partnerID=40&md5=a3ec623e9ce878593834980dc2676f27",Review,Scopus
"Nemeth C.J.","Managing innovation: When less is more",1997,"California Management Review","https://www.scopus.com/inward/record.uri?eid=2-s2.0-0031322916&doi=10.2307%2f41165922&partnerID=40&md5=ff42e89d686a3457bdacf091ab6e6cae",Article,Scopus
"Ethiraj S.K., Levinthal D.","Bounded rationality and the search for organizational architecture: An evolutionary perspective on the design of organizations and their evolvability",2004,"Administrative Science Quarterly","https://www.scopus.com/inward/record.uri?eid=2-s2.0-14944368949&partnerID=40&md5=5aa3644425f05428aed4515a2dd087b4",Review,Scopus
"Hann I.-H., Terwiesch C.","Measuring the frictional costs of online transactions: The case of a name-your-own-price channel",2003,"Management Science","https://www.scopus.com/inward/record.uri?eid=2-s2.0-0242454030&doi=10.1287%2fmnsc.49.11.1563.20586&partnerID=40&md5=09a2918999291c760d5d571fe6d9789d",Article,Scopus
"Dehning B., Stratopoulos T.","Determinants of a sustainable competitive advantage due to an IT-enabled strategy",2003,"Journal of Strategic Information Systems","https://www.scopus.com/inward/record.uri?eid=2-s2.0-84867974661&doi=10.1016%2fS0963-8687%2802%2900035-5&partnerID=40&md5=5eac419d0cdb9cece67177aa416dcca8",Article,Scopus
"Galliers R.D., Land F.F.","Viewpoint: Choosing Appropriate Information Systems Research Methodologies",1987,"Communications of the ACM","https://www.scopus.com/inward/record.uri?eid=2-s2.0-84976814937&doi=10.1145%2f32206.315753&partnerID=40&md5=d92d41097dcf2fa11336422f9f212756",Article,Scopus
"King W.R., Teo T.S.H.","Integration between business planning and information systems planning: Validating a stage hypothesis",1997,"Decision Sciences","https://www.scopus.com/inward/record.uri?eid=2-s2.0-0031492920&doi=10.1111%2fj.1540-5915.1997.tb01312.x&partnerID=40&md5=74777986b3505e811060d5c30eedda54",Article,Scopus
"Nan N.","Capturing bottom-up information technology use processes: A complex adaptive systems model",2011,"MIS Quarterly: Management Information Systems","https://www.scopus.com/inward/record.uri?eid=2-s2.0-80051778081&doi=10.2307%2f23044054&partnerID=40&md5=a9dbeed8480522dafb8bcb92922affaa",Review,Scopus
"Soo C., Devinney T., Midgley D., Deering A.","Knowledge management: Philosophy, processes, and pitfalls",2002,"California Management Review","https://www.scopus.com/inward/record.uri?eid=2-s2.0-0036619440&doi=10.2307%2f41166146&partnerID=40&md5=8811b3476380f56d91a32c3d1dd98352",Review,Scopus
"Venkatraman N., Lee C.-H.","Preferential linkage and network evolution: A conceptual model and empirical test in the U.S. video game sector",2004,"Academy of Management Journal","https://www.scopus.com/inward/record.uri?eid=2-s2.0-11844255394&doi=10.2307%2f20159628&partnerID=40&md5=44ec69e71858e0931450e861e0367c30",Review,Scopus
"Palmer J.W., Markus M.L.","The Performance Impacts of Quick Response and Strategic Alignment in Specialty Retailing",2000,"Information Systems Research","https://www.scopus.com/inward/record.uri?eid=2-s2.0-0034555049&doi=10.1287%2fisre.11.3.241.12203&partnerID=40&md5=f2f7855a63796002d381a5538888b3f5",Article,Scopus
"Strassmann P.",[No title available],1997,"The Squandered Computer",,,Scopus
"Modigliani F.","New developments on the oligopoly front",1958,"Journal of Political Economy",,,Scopus
"Itami H., Numagami T.","Dynamic interaction between strategy and technology",1992,"Strategic Management Journal","https://www.scopus.com/inward/record.uri?eid=2-s2.0-84989045960&doi=10.1002%2fsmj.4250130909&partnerID=40&md5=f54a26d9e692c29ab464e3bbd663bd60",Article,Scopus
"Applegate L.M., Elam J.J.","New information systems leaders: A changing role in a changing world",1992,"MIS Quarterly: Management Information Systems","https://www.scopus.com/inward/record.uri?eid=2-s2.0-0001633808&doi=10.2307%2f249732&partnerID=40&md5=77f65b92f89da3ae0685dda5fff2e4a8",Article,Scopus
"Schroeter J.R.","Estimating the degree of market power in the beef packing industry",1988,"Review of Economics and Statistics",,,Scopus
"Li H., Atuahene-Gima K.","The adoption of agency business activity, product innovation, and performance in Chinese technology ventures",2002,"Strategic Management Journal","https://www.scopus.com/inward/record.uri?eid=2-s2.0-0036605208&doi=10.1002%2fsmj.233&partnerID=40&md5=6fbfe02e1e874c9ce0e2026203c834c1",Article,Scopus
"Backoff N., Wiseman C., Ullrich W.A.","Information systems for competitive advantage: Implementation of a planning process",1985,"MIS Quarterly: Management Information Systems","https://www.scopus.com/inward/record.uri?eid=2-s2.0-55249122550&doi=10.2307%2f249229&partnerID=40&md5=0d9225073c248c228322775fb0fe3914",Article,Scopus
"Droge C., Calantone R., Harmancioglu N.","New product success: Is it really controllable by managers in highly turbulent environments?",2008,"Journal of Product Innovation Management","https://www.scopus.com/inward/record.uri?eid=2-s2.0-41149084675&doi=10.1111%2fj.1540-5885.2008.00300.x&partnerID=40&md5=41921463f522a1d8e2a26c4c433e15d7",Conference Paper,Scopus
"Hooley G., Broderick A., Möller K.","Competitive positioning and the resource-based view of the firm",1998,"Journal of Strategic Marketing","https://www.scopus.com/inward/record.uri?eid=2-s2.0-0005683440&doi=10.1080%2f09652549800000003&partnerID=40&md5=a7fdc13fc23e133fdb98c9efd0bb1ec2",Article,Scopus
"Coltman T., Tallon P., Sharma R., Queiroz M.","Strategic IT alignment: Twenty-five years on",2015,"Journal of Information Technology","https://www.scopus.com/inward/record.uri?eid=2-s2.0-84930029566&doi=10.1057%2fjit.2014.35&partnerID=40&md5=9578c64ca385ab0ace4ab3420605e93e",Review,Scopus
"Daniel E.M., Wilson H.N.","The role of dynamic capabilities in e-business transformation",2003,"European Journal of Information Systems","https://www.scopus.com/inward/record.uri?eid=2-s2.0-1442303741&doi=10.1057%2fpalgrave.ejis.3000478&partnerID=40&md5=9f4cceb5ea2af4120b3f43764d8febb1",Article,Scopus
"Van Der Zee J.T.M., De Jong B.","Alignment Is Not Enough: Integrating Business and Information Technology Management with the Balanced Business Scorecard",1999,"Journal of Management Information Systems","https://www.scopus.com/inward/record.uri?eid=2-s2.0-0033277396&doi=10.1080%2f07421222.1999.11518249&partnerID=40&md5=573779d98463631858d1c8b23d63da06",Article,Scopus
"Wang Eric T.G., Seidmann Abraham","Electronic data interchange: competitive externalities and strategic implementation policies",1995,"Management Science","https://www.scopus.com/inward/record.uri?eid=2-s2.0-0029275247&doi=10.1287%2fmnsc.41.3.401&partnerID=40&md5=40893564d97f0c30dc390c215ce9f6e3",Article,Scopus
"Eisenhardt K.M.","Speed and Strategic Choice: How Managers Accelerate Decision Making",1990,"California Management Review","https://www.scopus.com/inward/record.uri?eid=2-s2.0-84968188622&doi=10.2307%2f41166616&partnerID=40&md5=a315b9c7d4358ec80c0f33d5593bc82a",Article,Scopus
"Holland J.H., Holyoak K.J., Nisbett R.E., Thagard P.R.",[No title available],1986,"Induction",,,Scopus
"Soto-Acosta P., Popa S., Palacios-Marqués D.","E-business, organizational innovation and firm performance in manufacturing SMEs: an empirical study in Spain",2016,"Technological and Economic Development of Economy","https://www.scopus.com/inward/record.uri?eid=2-s2.0-84945205263&doi=10.3846%2f20294913.2015.1074126&partnerID=40&md5=82bda2358056767b39f356fb0dfec742",Article,Scopus
"Beinhocker E.D.","Robust adaptive strategies",1999,"Sloan Management Review",,,Scopus
"Pedersen T., Thomsen S.","European patterns of corporate ownership: A twelve-country study",1997,"Journal of International Business Studies","https://www.scopus.com/inward/record.uri?eid=2-s2.0-0031311992&doi=10.1057%2fpalgrave.jibs.8490118&partnerID=40&md5=caea26a1ea07ca80e5c770a9ccacc356",Article,Scopus
"Stoddard D.B., Jarvenpaa S.L.","Business process redesign: Tactics for managing radical change",1995,"Journal of Management Information Systems","https://www.scopus.com/inward/record.uri?eid=2-s2.0-0002857188&doi=10.1080%2f07421222.1995.11518071&partnerID=40&md5=4e3a95e6bd7fc74857da9581da9ada72",Article,Scopus
"Vaast E., Walsham G.","Representations and actions: The transformation of work practices with IT use",2005,"Information and Organization","https://www.scopus.com/inward/record.uri?eid=2-s2.0-12444257812&doi=10.1016%2fj.infoandorg.2004.10.001&partnerID=40&md5=7a1a831300656814187340377fdf1f76",Article,Scopus
"Benbasat I., Nault B.R.","An evaluation of empirical research in managerial support systems",1990,"Decision Support Systems","https://www.scopus.com/inward/record.uri?eid=2-s2.0-0025477607&doi=10.1016%2f0167-9236%2890%2990015-J&partnerID=40&md5=bb0078cc2c65e70b0e674829f3fc794e",Article,Scopus
"Daft R.L.","Learning the craft of organizational research",1983,"Academy of Management Review",,,Scopus
"Craighead C.W., Hult G.T.M., Ketchen Jr. D.J.","The effects of innovation-cost strategy, knowledge, and action in the supply chain on firm performance",2009,"Journal of Operations Management","https://www.scopus.com/inward/record.uri?eid=2-s2.0-68749112655&doi=10.1016%2fj.jom.2009.01.002&partnerID=40&md5=f94c45f63d1a63743468253493e165d3",Article,Scopus
"Smaltz D.H., Sambamurthy V., Agarwal R.","The antecedents of CIO role effectiveness in organizations: An empirical study in the healthcare sector",2006,"IEEE Transactions on Engineering Management","https://www.scopus.com/inward/record.uri?eid=2-s2.0-33646062255&doi=10.1109%2fTEM.2006.872248&partnerID=40&md5=b79303821b7295e4b2bd255ee64a0d80",Article,Scopus
"Dopfer K.","The evolutionary foundations of economics",2005,"The Evolutionary Foundations of Economics","https://www.scopus.com/inward/record.uri?eid=2-s2.0-84927962632&doi=10.1017%2fCBO9780511492297&partnerID=40&md5=bcc3f7d6c295911835970f5a621be26b",Book,Scopus
