Authors,Title,Year,Source title,Link,Document Type,Source
"Lucio-Nieto T., Colomo-Palacios R., Soto-Acosta P., Popa S., Amescua-Seco A.","Implementing an IT service information management framework: The case of COTEMAR",2012,"International Journal of Information Management","https://www.scopus.com/inward/record.uri?eid=2-s2.0-84870489437&doi=10.1016%2fj.ijinfomgt.2012.08.004&partnerID=40&md5=bc5a6597ff902984f8789904aa81d2d5",Article,Scopus
"Knights D., Scarbrough H.","In search of relevance: Perspectives on the contribution of academic-practitioner networks",2010,"Organization Studies","https://www.scopus.com/inward/record.uri?eid=2-s2.0-77958518564&doi=10.1177%2f0170840610374398&partnerID=40&md5=e940a6053f7e9a49d6784c09d5dec21a",Article,Scopus
"Schwarz A., Kalika M., Keffi H., Schwarz C.","A dynamic capabilities approach to understanding the impact of IT-enabled businesses processes and IT-business alignment on the strategic and operational performance of the firm",2010,"Communications of the Association for Information Systems","https://www.scopus.com/inward/record.uri?eid=2-s2.0-77953050607&doi=10.17705%2f1cais.02604&partnerID=40&md5=3e3cd45e43abc2bba68cb468a678b0e4",Article,Scopus
"Preston D.S., Leidner D.E., Chen D.","CIO Leadership Profiles: Implications of Matching CIO Authority and Leadership Capability on IT Impact",2008,"MIS Quarterly Executive",,,Scopus
"Brown I.T.J.","Testing and extending theory in strategic information systems planning through literature analysis",2004,"Information Resources Management Journal","https://www.scopus.com/inward/record.uri?eid=2-s2.0-4444369332&doi=10.4018%2firmj.2004100102&partnerID=40&md5=94b53e342444ad9e461908a44ed0eee5",Review,Scopus
"Geoffrion A.M., Krishnan R.","E-business and management science: Mutual impacts (Part 1 of 2)",2003,"Management Science","https://www.scopus.com/inward/record.uri?eid=2-s2.0-0242509132&doi=10.1287%2fmnsc.49.10.1275.17311&partnerID=40&md5=1296b84dd1eca7086a28eb6a7ca81bd9",Article,Scopus
"Jones M.C., Taylor G.S., Spencer B.A.","The CEO/CIO relationship revisited: An empirical assessment of satisfaction with IS",1995,"Information and Management","https://www.scopus.com/inward/record.uri?eid=2-s2.0-0038515913&doi=10.1016%2f0378-7206%2895%2900014-N&partnerID=40&md5=fd67b552f63c7b3888a5d00a79f73ff8",Article,Scopus
"Karimi J.","Strategic planning for information systems: Requirements and information engineering methods",1987,"Journal of Management Information Systems","https://www.scopus.com/inward/record.uri?eid=2-s2.0-70449941251&partnerID=40&md5=0ae1fb20e23495013e1ca1792d0e8bc3",Article,Scopus
"Murphy P.J.","A 2×2 Conceptual Foundation for Entrepreneurial Discovery Theory",2011,"Entrepreneurship: Theory and Practice","https://www.scopus.com/inward/record.uri?eid=2-s2.0-79952715060&doi=10.1111%2fj.1540-6520.2010.00368.x&partnerID=40&md5=512439a3c3acb552e8dd70818ce22a32",Article,Scopus
"Gordon J.R.M., Lee P.-M., Lucas Jr. H.C.","A resource-based view of competitive advantage at the Port of Singapore",2005,"Journal of Strategic Information Systems","https://www.scopus.com/inward/record.uri?eid=2-s2.0-15844372959&doi=10.1016%2fj.jsis.2004.10.001&partnerID=40&md5=be7e04df184aa218216f9616f729fdaa",Article,Scopus
[No author name available],[No title available],2009,"The Risk IT Framework",,,Scopus
"Desouza K.C., El Sawy O.A., Galliers R.D., Loebbecke C., Watson R.T.","Beyond rigor and relevance towards responsibility and reverberation: Information systems research that really matters",2006,"Communications of the AIS",,,Scopus
"Sambamurthy V., Venkataraman S., Desanctis G.","The design of information technology planning systems for varying organizational contexts",1993,"European Journal of Information Systems",,,Scopus
"Wilson T.D.","The implementation of information system strategies in UK companies: Aims and barriers to success",1989,"International Journal of Information Management","https://www.scopus.com/inward/record.uri?eid=2-s2.0-38249025995&doi=10.1016%2f0268-4012%2889%2990048-0&partnerID=40&md5=e7e2074ff438b407e1b1e711a5fd711c",Article,Scopus
"Goes P.B.","Editor's comments: Design science research in top information systems journals",2014,"MIS Quarterly",,,Scopus
"Krogh G.v.","Individualist and collectivist perspectives on knowledge in organizations: Implications for information systems research",2009,"Journal of Strategic Information Systems","https://www.scopus.com/inward/record.uri?eid=2-s2.0-70349147810&doi=10.1016%2fj.jsis.2009.08.001&partnerID=40&md5=4944e0021fedcd6fa147999bcac59e1f",Article,Scopus
"Singh S.K., Watson H.J., Watson R.T.","EIS support for the strategic management process",2002,"Decision Support Systems","https://www.scopus.com/inward/record.uri?eid=2-s2.0-0036568165&doi=10.1016%2fS0167-9236%2801%2900129-4&partnerID=40&md5=94d14c65dc5df39c3971b73277ddc444",Article,Scopus
"McKelvey B.","Energizing order-creating networks of distributed intelligence",2001,"International Journal of Innovation Management",,,Scopus
"Hagmann C., McCahon C.S.","Strategic information systems and competitiveness. Are firms ready for an IST-driven competitive challenge?",1993,"Information and Management","https://www.scopus.com/inward/record.uri?eid=2-s2.0-0000803737&doi=10.1016%2f0378-7206%2893%2990067-4&partnerID=40&md5=29233efc023c579c2b4a177df0bbbe1c",Article,Scopus
"Doll W.J., Vonderembse M.A.","Forging a partnership to achieve competitive advantage: The CIM challenge",1987,"MIS Quarterly: Management Information Systems","https://www.scopus.com/inward/record.uri?eid=2-s2.0-0001144769&doi=10.2307%2f249364&partnerID=40&md5=fb37ee98d294d9f08ce1a7048033dfe9",Article,Scopus
"Wu I.-L., Chiu M.-L.","Organizational applications of IT innovation and firm's competitive performance: A resource-based view and the innovation diffusion approach",2015,"Journal of Engineering and Technology Management - JET-M","https://www.scopus.com/inward/record.uri?eid=2-s2.0-85027958391&doi=10.1016%2fj.jengtecman.2014.09.002&partnerID=40&md5=8f1424a3d36ae90ac1e65900403b4996",Article,Scopus
"Murer S., Bonati B., Furrer F.J.","Managed evolution: A strategy for very large information systems",2011,"Managed Evolution: A Strategy for Very Large Information Systems","https://www.scopus.com/inward/record.uri?eid=2-s2.0-84892803631&doi=10.1007%2f978-3-642-01633-2&partnerID=40&md5=5c9821462a21e9338fbb8681e7add3aa",Book,Scopus
"Venkatesh V., Bala H., Venkatraman S., Bates J.","Enterprise architecture maturity: The story of the veterans health administration",2007,"MIS Quarterly Executive",,,Scopus
"Philip G.","IS strategic planning for operational efficiency",2007,"Information Systems Management","https://www.scopus.com/inward/record.uri?eid=2-s2.0-34547347468&doi=10.1080%2f10580530701404504&partnerID=40&md5=6002075311d2d901c8b3b2c02bc09582",Article,Scopus
"Rouibah K., Ould-Ali S.","PUZZLE: A concept and prototype for linking business intelligence to business strategy",2002,"Journal of Strategic Information Systems","https://www.scopus.com/inward/record.uri?eid=2-s2.0-84867939184&doi=10.1016%2fS0963-8687%2802%2900005-7&partnerID=40&md5=7c728f5f48a8972e474b1f0685ec5c9d",Article,Scopus
"Min S.K., Suh E.H., Kim S.Y.","An integrated approach toward strategic information systems planning",1999,"Journal of Strategic Information Systems","https://www.scopus.com/inward/record.uri?eid=2-s2.0-0004651629&doi=10.1016%2fS0963-8687%2800%2900029-9&partnerID=40&md5=489bd2944b78cb20cd72daed411f348f",Article,Scopus
"Earl M.J.","Putting IT in its place: A polemic for the nineties",1992,"Journal of Information Technology","https://www.scopus.com/inward/record.uri?eid=2-s2.0-70449737885&doi=10.1057%2fjit.1992.15&partnerID=40&md5=b74341aed1bcae6930c4f706a160a72b",Article,Scopus
"Mohdzain M.B., Ward J.M.","A study of subsidiaries' views of information systems strategic planning in multinational organisations",2007,"Journal of Strategic Information Systems","https://www.scopus.com/inward/record.uri?eid=2-s2.0-36048955211&doi=10.1016%2fj.jsis.2007.02.003&partnerID=40&md5=9fb7655605e8328e64ad6721c4218de6",Article,Scopus
"Hodgkinson S.L.","The role of the corporate IT function in the federal IT organisation",1996,"Information Management: The Organisational Dimension",,,Scopus
"Foster R.N.","Timing technological transitions",1985,"Technology in Society","https://www.scopus.com/inward/record.uri?eid=2-s2.0-0011796096&doi=10.1016%2f0160-791x%2885%2990022-3&partnerID=40&md5=6e20cb49d6a4056376f273d451511bc1",Article,Scopus
"Galliers R.D.","Further Developments in Information Systems Strategizing: Unpacking the Concept",2011,"The Oxford Handbook of Management Information Systems: Critical Perspectives and New Directions","https://www.scopus.com/inward/record.uri?eid=2-s2.0-84876272697&doi=10.1093%2foxfordhb%2f9780199580583.003.0015&partnerID=40&md5=2aca67060bc84fcf762d45c871adff33",Book Chapter,Scopus
"Cai Y., Sullivan K.J.","Modularity analysis of logical design models",2006,"Proceedings - 21st IEEE/ACM International Conference on Automated Software Engineering, ASE 2006","https://www.scopus.com/inward/record.uri?eid=2-s2.0-34547493165&doi=10.1109%2fASE.2006.53&partnerID=40&md5=51b308b7485017f00ab962ac0bcccd42",Conference Paper,Scopus
"Luftman J.N.","Competing in the Information Age: Align in the Sand: Second Edition",2003,"Competing in the Information Age: Align in the Sand: Second Edition","https://www.scopus.com/inward/record.uri?eid=2-s2.0-84919531866&doi=10.1093%2f0195159535.001.0001&partnerID=40&md5=34b1c0b916c577cce6c5121a9187f451",Book,Scopus
"Sambamurthy V.","Business strategy in hypercompetitive environments: Rethinking the logic of IT differentiation",2000,"Framing the Domains of IT Management: Projecting the Future Through the Past",,,Scopus
"Lacity M., Hirschheim R.","Implementing information systems outsourcing: Key issues and experiences of an early adopter",1993,"Journal of General Management",,,Scopus
"Bradley R.V., Pratt R.M.E., Byrd T.A., Simmons L.L.","The role of enterprise architecture in the quest for IT value",2011,"MIS Quarterly Executive","https://www.scopus.com/inward/record.uri?eid=2-s2.0-79958222143&partnerID=40&md5=0f3800fb99761aeb3d991022c507a2cc",Article,Scopus
"Makadok R.","The interaction effect of rivalry restraint and competitive advantage on profit: Why the whole is less than the sum of the parts",2010,"Management Science","https://www.scopus.com/inward/record.uri?eid=2-s2.0-77249174860&doi=10.1287%2fmnsc.1090.1102&partnerID=40&md5=a8167aded93d08f12a53fb7afc9ca230",Article,Scopus
"Moisander J., Stenfors S.","Exploring the edges of theory-practice gap: Epistemic cultures in strategy-tool development and use",2009,"Organization","https://www.scopus.com/inward/record.uri?eid=2-s2.0-60449092819&doi=10.1177%2f1350508408100476&partnerID=40&md5=0116d5936767d6413ec5f10773d03be6",Article,Scopus
"Motahari-Nezhad H.R., Stephenson B., Singhal S.","Outsourcing business to cloud computing services: Opportunities and challenges",2009,"Outsourcing Business to Cloud Computing Services: Opportunities and Challenges",,,Scopus
"Baldwin C.Y., Clark K.B.","Modularity in the design of complex engineering systems",2004,"Modularity in the Design of Complex Engineering Systems",,,Scopus
"Lee G.G., Pai J.-C.","Effects of organizational context and inter-group behaviour on the success of strategic information systems planning: An empirical study",2003,"Behaviour and Information Technology","https://www.scopus.com/inward/record.uri?eid=2-s2.0-0142186099&doi=10.1080%2f0144929031000136548&partnerID=40&md5=6344aeead3083509e8c652f35555c629",Article,Scopus
"Barua A., Whinston A.B.","Decision support for managing organizational design dynamics",1998,"Decision Support Systems","https://www.scopus.com/inward/record.uri?eid=2-s2.0-0031654499&doi=10.1016%2fS0167-9236%2896%2900059-0&partnerID=40&md5=85f07c784d626d6dd701c0418b3a6a63",Article,Scopus
"Jenkin T.A., Chan Y.E.","IS project alignment - A process perspective",2010,"Journal of Information Technology","https://www.scopus.com/inward/record.uri?eid=2-s2.0-77749254754&doi=10.1057%2fjit.2009.10&partnerID=40&md5=c391a3614153ce88b7003a3c56ea366a",Article,Scopus
"Noble C.H.","Building the strategy implementation network",1999,"Business Horizons","https://www.scopus.com/inward/record.uri?eid=2-s2.0-0033229064&doi=10.1016%2fS0007-6813%2899%2980034-2&partnerID=40&md5=f5134712ba5ea552fe46684db865840c",Article,Scopus
"Ray G., Muhanna W.A., Barney J.B.","Competing with IT: The role of shared IT-business understanding",2007,"Communications of the ACM","https://www.scopus.com/inward/record.uri?eid=2-s2.0-36949011638&doi=10.1145%2f1323688.1323700&partnerID=40&md5=830cea8f11dc468608c5c810dbea8f73",Article,Scopus
"Burgelman R.A., Grove A.S.","Cross-boundary disruptors: Powerful interindustry entrepreneurial change agents",2007,"Strategic Entrepreneurship Journal",,,Scopus
"Allen P.M., Varga L.","A co-evolutionary complex systems perspective on information systems",2006,"Journal of Information Technology","https://www.scopus.com/inward/record.uri?eid=2-s2.0-33751543102&doi=10.1057%2fpalgrave.jit.2000075&partnerID=40&md5=6d5c8ccc4b0cc54396253906ca02d8cb",Article,Scopus
"Maqsood T., Finegan A., Walker D.","Applying project histories and project learning through knowledge management in an Australian construction company",2006,"Learning Organization","https://www.scopus.com/inward/record.uri?eid=2-s2.0-33644537625&doi=10.1108%2f09696470610639149&partnerID=40&md5=2fceac1da546da5c6e3be0783e0968ca",Article,Scopus
"Walker G.",[No title available],2004,"Modern Competitive Strategy",,,Scopus
"Waema T.M., Walsham G.","Information Systems strategy formulation",1990,"Information and Management","https://www.scopus.com/inward/record.uri?eid=2-s2.0-0025263101&doi=10.1016%2f0378-7206%2890%2990061-L&partnerID=40&md5=c1ce9677fe8aade191ef295b686e9625",Article,Scopus
"Henderson J.C., Rockart J.F., Sifonis J.G.","Integrating management support systems into strategic information systems planning",1987,"Journal of Management Information Systems",,,Scopus
"Tan B.C.C., Pan S.L., Hackney R.","The strategic implications of web technologies: A process model of how web technologies enhance organizational performance",2010,"IEEE Transactions on Engineering Management","https://www.scopus.com/inward/record.uri?eid=2-s2.0-77951621774&doi=10.1109%2fTEM.2009.2023130&partnerID=40&md5=3dd5bae51bd5cd600fb370731f14ed1e",Article,Scopus
"Chan Y.E., Huff S.L.","Investigating information systems strategic alignment",1993,"Proceedings of the 14th International Conference on Information Systems",,,Scopus
"Raghunathan B., Raghunathan T.","Information systems planning and effectiveness: An empirical analysis",1991,"Omega","https://www.scopus.com/inward/record.uri?eid=2-s2.0-0001727585&doi=10.1016%2f0305-0483%2891%2990022-L&partnerID=40&md5=fe96f9254ca0c7fd741027884c48325f",Article,Scopus
"Henderson J.C., Venkatraman N.","Strategic Alignment: A Framework for Strategic Information Technology Management",1989,"Strategic Alignment: A Framework for Strategic Information Technology Management",,,Scopus
"Sylos Labini P.","Oligopolio e progresso tecnico",1956,"Oligopolio e Progresso Tecnico",,,Scopus
"Nolan R.L.","Ubiquitous IT: The case of the Boeing 787 and implications for strategic IT research",2012,"Journal of Strategic Information Systems","https://www.scopus.com/inward/record.uri?eid=2-s2.0-84865261757&doi=10.1016%2fj.jsis.2011.12.003&partnerID=40&md5=b1d464bbe908d89a598373cf41bec9e4",Article,Scopus
"Kane G.C., Borgatti S.P.","Centrality-is proficiency alignment and workgroup performance",2011,"MIS Quarterly: Management Information Systems","https://www.scopus.com/inward/record.uri?eid=2-s2.0-81355153648&doi=10.2307%2f41409973&partnerID=40&md5=c4c0edc1b768828454d798f7f4ba04b2",Article,Scopus
"Page S.E.",[No title available],2009,"Understanding Complexity",,,Scopus
"Kunnathur A.S., Shi Z.","An investigation of the strategic information systems planning success in Chinese publicly traded firms",2001,"International Journal of Information Management","https://www.scopus.com/inward/record.uri?eid=2-s2.0-0035575429&doi=10.1016%2fS0268-4012%2801%2900034-2&partnerID=40&md5=1aa40eaab2be2564da243446c256b9b1",Article,Scopus
"Teo T.S.H., King W.R.","An empirical study of the impacts of integrating business planning and information systems planning",1999,"European Journal of Information Systems","https://www.scopus.com/inward/record.uri?eid=2-s2.0-22844455262&doi=10.1057%2fpalgrave.ejis.3000334&partnerID=40&md5=be66b38daecd436ed8bc3167de5b5a64",Article,Scopus
"Earl M.J.","Integrating IS and the organization: A framework of organizational fit",1996,"Information Management: The Organizational Dimension",,,Scopus
"Earl M.J.",[No title available],1988,"Information Management: The Strategic Dimension",,,Scopus
"Beath C.M., Ives B.","Competitive information systems in support of pricing",1986,"MIS Quarterly",,,Scopus
"Thatcher M.E., Pingry D.E.","An economic model of product quality and IT value",2004,"Information Systems Research","https://www.scopus.com/inward/record.uri?eid=2-s2.0-9144254551&doi=10.1287%2fisre.1040.0029&partnerID=40&md5=0f11484e11761ca668338a55a0286461",Review,Scopus
"Baker B.","The role of feedback in assessing information systems planning effectiveness",1995,"Journal of Strategic Information Systems","https://www.scopus.com/inward/record.uri?eid=2-s2.0-0001893662&doi=10.1016%2f0963-8687%2895%2980015-I&partnerID=40&md5=222bb25346b4df9b339ced8f530a4eb3",Article,Scopus
"Walsham G., Han C.K.","Information systems strategy formation and implementation: The case of a central government agency",1993,"Accounting, Management and Information Technologies","https://www.scopus.com/inward/record.uri?eid=2-s2.0-38249001659&doi=10.1016%2f0959-8022%2893%2990016-Y&partnerID=40&md5=4ecb27f4a871fe65182d80e87400c6dd",Article,Scopus
"Burn J.M.","Information systems strategies and the management of organizational change – a strategic alignment model",1993,"Journal of Information Technology","https://www.scopus.com/inward/record.uri?eid=2-s2.0-21344485623&doi=10.1057%2fjit.1993.32&partnerID=40&md5=64c72c16b9f0e134f1172d2e177f1226",Article,Scopus
"Singleton J.P., McLean E.R., Altman E.N.","Measuring information systems performance: Experience with the management by results system at security pacific bank",1988,"MIS Quarterly: Management Information Systems","https://www.scopus.com/inward/record.uri?eid=2-s2.0-0038515800&doi=10.2307%2f248857&partnerID=40&md5=3b2ba7a726538a8aee45e902ab0da5a0",Article,Scopus
"Mintzberg H.","Patterns in strategy formation",1978,"Management Science",,,Scopus
"Martin R.L.","The big lie of strategic planning",2014,"Harvard Business Review","https://www.scopus.com/inward/record.uri?eid=2-s2.0-84890864347&partnerID=40&md5=fd695f429011a7f3ba697c625b4a157e",Note,Scopus
"Celuch K., Murphy G.B., Callaway S.K.","More bang for your buck: Small firms and the importance of aligned information technology capabilities and strategic flexibility",2007,"Journal of High Technology Management Research","https://www.scopus.com/inward/record.uri?eid=2-s2.0-33846897123&doi=10.1016%2fj.hitech.2006.11.006&partnerID=40&md5=4f84db9993956a03238625eb98cb6787",Article,Scopus
"Whalen P.J.","Strategic and technology planning on a roadmapping foundation",2007,"Research Technology Management","https://www.scopus.com/inward/record.uri?eid=2-s2.0-34249011174&doi=10.1080%2f08956308.2007.11657440&partnerID=40&md5=be4c073994798efb3e9003f30bb25102",Article,Scopus
"O’Regan N., Ghobadian A.","Formal strategic planning: The key to effective business process management?",2002,"Business Process Management Journal","https://www.scopus.com/inward/record.uri?eid=2-s2.0-84986165606&doi=10.1108%2f14637150210449102&partnerID=40&md5=e47396885839c68e30f316e5428c8b48",Article,Scopus
"Kim S.H., Jang D.H., Lee D.H., Cho S.H.","A methodology of constructing a decision path for IT investment",2000,"Journal of Strategic Information Systems","https://www.scopus.com/inward/record.uri?eid=2-s2.0-0010639643&doi=10.1016%2fS0963-8687%2800%2900034-2&partnerID=40&md5=a393f8cdd92d9dc8ba8775b9e540ce44",Article,Scopus
"Logan J.W., Lutter R.W.","Guaranteed lowest prices: do they facilitate collusion?",1989,"Economics Letters","https://www.scopus.com/inward/record.uri?eid=2-s2.0-38249005616&doi=10.1016%2f0165-1765%2889%2990197-3&partnerID=40&md5=73a20b0ab1f71b1025a4c96042890332",Article,Scopus
"Gillette F.","The rise and inglorious fall of myspace",2011,"Bloomberg Businessweek",,,Scopus
"Whittington R.","Practice perspectives on strategy: Unifying and developing a field",2002,"Academy of Management Proceedings",,,Scopus
"Hackney R., Little S.","Opportunistic strategy formulation for is/it planning",1999,"European Journal of Information Systems","https://www.scopus.com/inward/record.uri?eid=2-s2.0-22644449338&doi=10.1057%2fpalgrave.ejis.3000331&partnerID=40&md5=beab89f025934d20eebf8a3d504823b0",Article,Scopus
"Burn J.M.","IS innovation and organizational alignment - A professional juggling act",1996,"Journal of Information Technology","https://www.scopus.com/inward/record.uri?eid=2-s2.0-0030528215&doi=10.1080%2f026839696345388&partnerID=40&md5=6f12233030afa0624b36faa79bee00c3",Article,Scopus
"El Sherif H., El Sawy O.A.","Issue-based decision support systems for the Egyptian cabinet",1988,"MIS Quarterly: Management Information Systems","https://www.scopus.com/inward/record.uri?eid=2-s2.0-3042992146&doi=10.2307%2f249131&partnerID=40&md5=5082af720590b0c225e3913db79b6459",Article,Scopus
"Schwartz M., Reynolds R.J.","Contestable markets: An uprising in the theory of industry structure: Comment",1983,"American Economic Review",,,Scopus
"Albert D., Kreutzer M., Lechner C.","Resolving the paradox of interdependency and strategic renewal in activity systems",2015,"Academy of Management Review","https://www.scopus.com/inward/record.uri?eid=2-s2.0-84929169441&doi=10.5465%2famr.2012.0177&partnerID=40&md5=505152f5bef80a0f662c11a938c7a43c",Article,Scopus
"Keutel M., Michalik B., Richter J.","Towards mindful case study research in IS: A critical analysis of the past ten years",2014,"European Journal of Information Systems","https://www.scopus.com/inward/record.uri?eid=2-s2.0-84901347122&doi=10.1057%2fejis.2013.26&partnerID=40&md5=d798d3b4f27f1e7183d19486dddd7d03",Review,Scopus
"Buchwald A., Urbach N., Ahlemann F.","Business value through controlled IT: Toward an integrated model of IT governance success and its impact",2014,"Journal of Information Technology","https://www.scopus.com/inward/record.uri?eid=2-s2.0-84900869349&doi=10.1057%2fjit.2014.3&partnerID=40&md5=fd861c08a8151715085c039c9ecda844",Article,Scopus
"Chao C.-A., Chandra A.","Impact of owner's knowledge of information technology (IT) on strategic alignment and IT adoption in US small firms",2012,"Journal of Small Business and Enterprise Development","https://www.scopus.com/inward/record.uri?eid=2-s2.0-84857678150&doi=10.1108%2f14626001211196433&partnerID=40&md5=ba8dd9eaac3fdf3ea327380846be70eb",Article,Scopus
"Bruque-Cámara S., Vargas-Sánchez A., Hernández-Ortiz M.J.","Organizational determinants of IT adoption in the pharmaceutical distribution sector",2004,"European Journal of Information Systems","https://www.scopus.com/inward/record.uri?eid=2-s2.0-3142772187&doi=10.1057%2fpalgrave.ejis.3000490&partnerID=40&md5=049d53bce132807ff5cd50f8a62aa9ff",Article,Scopus
"Simon H.A.","The science of design: Creating the artificial",1996,"The Sciences of the Artificial",,,Scopus
"Huysman M.H., Fischer S.J., Heng M.S.","An organizational learning perspective on information systems planning",1994,"Journal of Strategic Information Systems","https://www.scopus.com/inward/record.uri?eid=2-s2.0-0028497777&doi=10.1016%2f0963-8687%2894%2990024-8&partnerID=40&md5=b4b1b0981fc487d66a5b65689663c913",Article,Scopus
"Wiseman C.",[No title available],1985,"Strategy and Computers",,,Scopus
"Chanias S., Hess T.","Understanding digital transformation strategy formation: Insights from Europe's automotive industry",2016,"Pacific Asia Conference on Information Systems, PACIS 2016 - Proceedings","https://www.scopus.com/inward/record.uri?eid=2-s2.0-85011076119&partnerID=40&md5=ada5ff6bc80ed1c9ed2fdc5c4237b7d3",Conference Paper,Scopus
[No author name available],[No title available],2015,"Entrepreneurship at a Glance, 2015",,,Scopus
"Ward J.M.","Information systems strategy: Quo vadis?",2012,"Journal of Strategic Information Systems","https://www.scopus.com/inward/record.uri?eid=2-s2.0-84865225061&doi=10.1016%2fj.jsis.2012.05.002&partnerID=40&md5=ff6b101d3bb9f8b29a96df02b93c9b54",Article,Scopus
"Buchanan M.",[No title available],2002,"Nexus",,,Scopus
"Hidding G.J.","Sustaining strategic IT advantage in the information age: How strategy paradigms differ by speed",2001,"Journal of Strategic Information Systems","https://www.scopus.com/inward/record.uri?eid=2-s2.0-0035414912&doi=10.1016%2fS0963-8687%2801%2900052-X&partnerID=40&md5=fcb11d96ffc435f3ddd9b3d7cdcc182d",Article,Scopus
"Lynne Markus M.","Reflections on the systems integration enterprise",2001,"Business Process Management Journal","https://www.scopus.com/inward/record.uri?eid=2-s2.0-85003154757&doi=10.1108%2fbpmj.2001.15707caf.001&partnerID=40&md5=1a0119bc2318985c59323dd43bf1d928",Article,Scopus
"Pervan G.","How chief executive officers in large organizations view the management of their information systems",1998,"Journal of Information Technology","https://www.scopus.com/inward/record.uri?eid=2-s2.0-0039992277&doi=10.1080%2f026839698344882&partnerID=40&md5=2361346ec4aaf9a8b264a45559f6fa87",Article,Scopus
"Camillus John C., Lederer Albert L.","CORPORATE STRATEGY AND THE DESIGN OF COMPUTERIZED INFORMATION SYSTEMS.",1985,"Sloan management review","https://www.scopus.com/inward/record.uri?eid=2-s2.0-0022031240&partnerID=40&md5=401ec69ad442e56caf4b54fd80ff1d1a",Article,Scopus
