Authors,Title,Year,Source title,Link,Document Type,Source
"Ashenfelter O.","Estimating the effect of training programs on earnings",1978,"Review of Economics and Statistics",,,Scopus
"Walsham G.","The emergence of interpretivism in IS research",1995,"Information Systems Research","https://www.scopus.com/inward/record.uri?eid=2-s2.0-73549100231&doi=10.1287%2fisre.6.4.376&partnerID=40&md5=1ee7fc64bc026b56782b1a9501f2c243",Article,Scopus
"SCHNEIDER B.","ORGANIZATIONAL CLIMATES: AN ESSAY",1975,"Personnel Psychology","https://www.scopus.com/inward/record.uri?eid=2-s2.0-84986976556&doi=10.1111%2fj.1744-6570.1975.tb01386.x&partnerID=40&md5=cfdb4d388f6f206acf0d166ee9a97f67",Article,Scopus
"Weill P., Broadbent M.",[No title available],1998,"Leveraging the New Infrastructure: How Market Leaders Capitalize on Information Technology",,,Scopus
"Buyya R., Broberg J., Goscinski A.","Cloud Computing: Principles and Paradigms",2011,"Cloud Computing: Principles and Paradigms","https://www.scopus.com/inward/record.uri?eid=2-s2.0-84891585028&doi=10.1002%2f9780470940105&partnerID=40&md5=4fffff64af4100acf7f02fa0a5e19d67",Book,Scopus
"Tallon P.P., Pinsonneault A.","Competing perspectives on the link between strategic information technology alignment and organizational agility: Insights from a mediation model",2011,"MIS Quarterly: Management Information Systems","https://www.scopus.com/inward/record.uri?eid=2-s2.0-80051777499&doi=10.2307%2f23044052&partnerID=40&md5=2388a83e4ce38fe7c34d0d065f19ba50",Article,Scopus
"Rothaermel F.T.","Incumbent's advantage through exploiting complementary assets via interfirm cooperation",2001,"Strategic Management Journal","https://www.scopus.com/inward/record.uri?eid=2-s2.0-0000388376&doi=10.1002%2fsmj.180&partnerID=40&md5=831e8c38e02a1b6873861be073cc5826",Article,Scopus
"Brynjolfsson E., Hitt L.M.","Computing productivity: Firm-level evidence",2003,"Review of Economics and Statistics","https://www.scopus.com/inward/record.uri?eid=2-s2.0-0242678541&doi=10.1162%2f003465303772815736&partnerID=40&md5=6ae75f1beffe980ff2d792413bd0d62b",Review,Scopus
"Weill P.","The relationship between investment in information technology and firm performance: A study of the valve manufacturing sector",1992,"Information Systems Research","https://www.scopus.com/inward/record.uri?eid=2-s2.0-73549107428&doi=10.1287%2fisre.3.4.307&partnerID=40&md5=3b7e441e20b9f6baff03d0bbbaf28cd4",Article,Scopus
"Boudreau M.-C., Gefen D., Straub D.W.","Validation in information systems research: A state-of-the-art assessment",2001,"MIS Quarterly: Management Information Systems","https://www.scopus.com/inward/record.uri?eid=2-s2.0-9744260316&doi=10.2307%2f3250956&partnerID=40&md5=602990434739fdc44c51c8e0e7a1d5cd",Article,Scopus
"Clemons E.K., Row M.C.","Sustaining IT advantage: The role of structural differences",1991,"MIS Quarterly: Management Information Systems","https://www.scopus.com/inward/record.uri?eid=2-s2.0-53349121459&doi=10.2307%2f249639&partnerID=40&md5=a0dc48ec2c50f8d5b16b7ad0388abea0",Article,Scopus
"Burgelman R.A.","Fading memories: A process theory of strategic business exit in dynamic environments",1994,"Administrative Science Quarterly",,,Scopus
"Miller D.","Stale in the saddle: CEO tenure and the match between organization and environment",1991,"Management Science","https://www.scopus.com/inward/record.uri?eid=2-s2.0-84934409601&doi=10.1287%2fmnsc.37.1.34&partnerID=40&md5=d52f0c85b872ad4e844d12775f3421b9",Article,Scopus
"Overby E., Bharadwaj A., Sambamurthy V.","Enterprise agility and the enabling role of information technology",2006,"European Journal of Information Systems","https://www.scopus.com/inward/record.uri?eid=2-s2.0-33745795865&doi=10.1057%2fpalgrave.ejis.3000600&partnerID=40&md5=4aa048116e621641b178f28f40f0b963",Article,Scopus
"Lewin A.Y., Volberda H.W.","Prolegomena on Coevolution: A Framework for Research on Strategy and New Organizational Forms",1999,"Organization Science","https://www.scopus.com/inward/record.uri?eid=2-s2.0-0033272472&doi=10.1287%2forsc.10.5.519&partnerID=40&md5=bba186b953912a2d396ec84cdf2e0fcc",Article,Scopus
"Keen P.G.W.","Shaping the future: Business design through information technology",1991,"Shaping the Future: Business Design Through Information Technology",,,Scopus
"Helfat C.E., Winter S.G.","Untangling dynamic and operational capabilities: Strategy for the (N)ever-changing world",2011,"Strategic Management Journal","https://www.scopus.com/inward/record.uri?eid=2-s2.0-84860389455&doi=10.1002%2fsmj.955&partnerID=40&md5=c272ad6387a76ef2994eaaf84457ce57",Article,Scopus
"Lu Y., Ramamurthy K.","Understanding the link between information technology capability and organizational agility: An empirical examination",2011,"MIS Quarterly: Management Information Systems","https://www.scopus.com/inward/record.uri?eid=2-s2.0-81355132835&doi=10.2307%2f41409967&partnerID=40&md5=d8705512f61f0da871332cb75f4395da",Article,Scopus
"Gefen D.","Customer loyalty in e-commerce",2002,"Journal of the Association for Information Systems",,,Scopus
"Cash J.I., McFarlan F.W., McKenney J.L., Applegate L.M.",[No title available],1992,"Corporate Information Systems Management",,,Scopus
"Mukhopadhyay T., Kekre S., Kalathur S.","Business value of information technology: A study of electronic data interchange",1995,"MIS Quarterly: Management Information Systems","https://www.scopus.com/inward/record.uri?eid=2-s2.0-30244550225&doi=10.2307%2f249685&partnerID=40&md5=bb152d00bb1b3a0aa29110f076f70c9a",Article,Scopus
"Cash J.I., Konsynski B.R.","IS redraws competitive boundaries",1985,"Harvard Business Review",,,Scopus
"Dedrick J., Gurbaxani V., Kraemer K.L.","Information technology and economic performance: A critical review of the empirical evidence",2003,"ACM Computing Surveys","https://www.scopus.com/inward/record.uri?eid=2-s2.0-1842543881&doi=10.1145%2f641865.641866&partnerID=40&md5=8a7c1724b37c9a61473a38c18eddf14f",Review,Scopus
"Johnson G., Melin L., Whittington R.","Micro strategy and strategizing: Towards an activity-based view",2003,"Journal of Management Studies",,,Scopus
"Whittington R.",[No title available],1993,"What is Strategy and Does it Matter?",,,Scopus
"Luftman J.","Assessing business-IT alignment maturity",2000,"Communications of the Association for Information Systems",,,Scopus
"Benson J.K.","Organizations: A dialectical view",1977,"Administrative Science Quarterly",,,Scopus
"Mason E.S.","Price and production policies of large-scale enterprise",1939,"American Economic Review",,,Scopus
"Ives B., Learmonth G.P.","The information system as a competitive weapon",1984,"Communications of the ACM","https://www.scopus.com/inward/record.uri?eid=2-s2.0-0021617733&doi=10.1145%2f2135.2137&partnerID=40&md5=28058bf2f6e41bc41e7cfabe2a3f602f",Article,Scopus
"Spence A.M.","Entry, capacity, investment and oligopolistic pricing",1977,"Bell Journal of Economics",,,Scopus
"Swanson E.B., Ramiller N.C.","Innovating mindfully with information technology",2004,"MIS Quarterly: Management Information Systems","https://www.scopus.com/inward/record.uri?eid=2-s2.0-9744280481&doi=10.2307%2f25148655&partnerID=40&md5=2a2fe6ede269b5277facd9833e19528d",Review,Scopus
"Boyd B.K.","CEO duality and firm performance: A contingency model",1995,"Strategic Management Journal","https://www.scopus.com/inward/record.uri?eid=2-s2.0-84989143765&doi=10.1002%2fsmj.4250160404&partnerID=40&md5=ba40577fed2ee5d8527a30e2384f6d1d",Article,Scopus
"Pettigrew A.M.","The character and significance of strategy process research",1992,"Strategic Management Journal","https://www.scopus.com/inward/record.uri?eid=2-s2.0-84989051516&doi=10.1002%2fsmj.4250130903&partnerID=40&md5=4eb1775f46f161095eaa8c9d251dab9e",Article,Scopus
"Kelly D., Amburgey T.L.","Organizational inertia and momentum: A dynamic model of strategic change",1991,"Academy of Management Journal",,,Scopus
"Jayachandran S., Sharma S., Kaufman P., Raman P.","The role of relational information processes and technology use in customer relationship management",2005,"Journal of Marketing","https://www.scopus.com/inward/record.uri?eid=2-s2.0-27144482455&doi=10.1509%2fjmkg.2005.69.4.177&partnerID=40&md5=834a8e3dca29f22405709b70e2c4b7c6",Article,Scopus
"Lichtenthaler U.","Absorptive capacity, environmental turbulence, and the complementarity of organizational learning processes",2009,"Academy of Management Journal","https://www.scopus.com/inward/record.uri?eid=2-s2.0-70350334578&doi=10.5465%2fAMJ.2009.43670902&partnerID=40&md5=a2132bd6f6208446e4828afe1bea4c7e",Article,Scopus
"Song J., Almeida P., Wu G.","Learning-by-hiring: When is mobility more likely to facilitate interfirm knowledge transfer?",2003,"Management Science","https://www.scopus.com/inward/record.uri?eid=2-s2.0-0042202656&doi=10.1287%2fmnsc.49.4.351.14429&partnerID=40&md5=a0e61686b65d53ecfa72597dde1126b2",Article,Scopus
"Evans P., Wurster T.S.","Blown to bits: How the new economics of information transforms strategy",2000,"Blown to Bits: How the New Economics of Information Transforms Strategy",,,Scopus
"McGrath R.G.","Business models: A discovery driven approach",2010,"Long Range Planning","https://www.scopus.com/inward/record.uri?eid=2-s2.0-77952568109&doi=10.1016%2fj.lrp.2009.07.005&partnerID=40&md5=407b084ea0598db7c81cdb3d7a12e57c",Article,Scopus
"Powell T.C.","Organizational alignment as competitive advantage",1992,"Strategic Management Journal","https://www.scopus.com/inward/record.uri?eid=2-s2.0-84989069076&doi=10.1002%2fsmj.4250130204&partnerID=40&md5=f199632e8bed0e9d538f6d5518d831ef",Article,Scopus
"Ansoff H.I.",[No title available],1965,"Corporate Strategy: An Analytic Approach to Business Policy for Growth and Expansion",,,Scopus
"Miller D.","The architecture of simplicity",1993,"Academy of Management Review",,,Scopus
"Gurbaxani V., Whang S.","The Impact of Information Systems on Organizations And Markets",1991,"Communications of the ACM","https://www.scopus.com/inward/record.uri?eid=2-s2.0-0025723587&doi=10.1145%2f99977.99990&partnerID=40&md5=79283ce3a597fb882dc520eab4dcd83d",Article,Scopus
"Bourgeois L.J.","Strategy and environment: A conceptual integration",1980,"Academy of Management Review",,,Scopus
"Catteddu D., Hogben G.","Cloud computing: Benefits, risks and recommendations for information security",2009,"Cloud Computing: Benefits, Risks and Recommendations for Information Security",,,Scopus
"Brandenburger A.M., Stuart Jr. H.W.","Value-based business strategy",1996,"Journal of Economics and Management Strategy","https://www.scopus.com/inward/record.uri?eid=2-s2.0-0030490743&doi=10.1111%2fj.1430-9134.1996.00005.x&partnerID=40&md5=0cd79200e427ca5e3edc27e5fcd6ec5f",Article,Scopus
"Doz Y.L., Kosonen M.","Embedding strategic agility: A leadership agenda for accelerating business model renewal",2010,"Long Range Planning","https://www.scopus.com/inward/record.uri?eid=2-s2.0-77952585003&doi=10.1016%2fj.lrp.2009.07.006&partnerID=40&md5=1682c364e1402de922ad62df1b07a735",Article,Scopus
"Jarzabkowski P., Balogun J., Seidl D.","Strategizing: The challenges of a practice perspective",2007,"Human Relations","https://www.scopus.com/inward/record.uri?eid=2-s2.0-33846587065&doi=10.1177%2f0018726707075703&partnerID=40&md5=e0fe067c1cff6ed9e1f80a9fec4a6f8e",Review,Scopus
"Helfat C.E., Raubitschek R.S.","Product sequencing: Co-evolution of knowledge, capabilities and products",2000,"Strategic Management Journal","https://www.scopus.com/inward/record.uri?eid=2-s2.0-0001607234&doi=10.1002%2f1097-0266%28200010%2f11%2921%3a10%2f11%3c961%3a%3aaid-smj132%3e3.0.co%3b2-e&partnerID=40&md5=40a52ca2173d2bef358577c216551344",Article,Scopus
"Hamel G., Breen B.",[No title available],2007,"The Future of Management",,,Scopus
"Reich B.H., Benbasat I.","Measuring the linkage between business and information technology objectives",1996,"MIS Quarterly: Management Information Systems","https://www.scopus.com/inward/record.uri?eid=2-s2.0-0013359382&doi=10.2307%2f249542&partnerID=40&md5=052ae3fbc1f1af1d2988a5d3b386b3ea",Article,Scopus
"Fredrickson J.W., Mitchell T.R.","Strategic decision processes: Comprehensiveness and performance in an industry with an unstable environment",1984,"Academy of Management Journal",,,Scopus
"McGrath R.G.","A real options logic for initiating technology positioning investments",1997,"Academy of Management Review","https://www.scopus.com/inward/record.uri?eid=2-s2.0-0031484914&doi=10.5465%2fAMR.1997.9711022113&partnerID=40&md5=e7ecd4e6328da7268f0f3802cfcd3e81",Article,Scopus
"Mintzberg H.","The Strategy Concept I: Five Ps For Strategy",1987,"California Management Review","https://www.scopus.com/inward/record.uri?eid=2-s2.0-84968274427&doi=10.2307%2f41165263&partnerID=40&md5=6c63adc7f4f9b48a700c3dd1d4708f85",Article,Scopus
"Geyskens I., Steenkamp J.-B.E.M., Kumar N.","Make, buy, or ally: A transaction cost theory meta-analysis",2006,"Academy of Management Journal","https://www.scopus.com/inward/record.uri?eid=2-s2.0-33745686655&doi=10.5465%2fAMJ.2006.21794670&partnerID=40&md5=8264e00660d93782090bc2b25f8835a2",Article,Scopus
"Orlikowski W.J.","The sociomateriality of organisational life: Considering technology in management research",2009,"Cambridge Journal of Economics","https://www.scopus.com/inward/record.uri?eid=2-s2.0-77950937513&doi=10.1093%2fcje%2fbep058&partnerID=40&md5=67488c4f1ebe8771cab8f1abd23cd02b",Article,Scopus
"Madjar N., Oldham G.R., Pratt M.G.","There's no place like home? The contributions of work and nonwork creativity support to employees' creative performance",2002,"Academy of Management Journal","https://www.scopus.com/inward/record.uri?eid=2-s2.0-0036670752&doi=10.2307%2f3069309&partnerID=40&md5=1857ab63a9e6b8b9c799f0ee532ede20",Article,Scopus
"Song M., Droge C., Hanvanich S., Calantone R.","Marketing and technology resource complementarity: An analysis of their interaction effect in two environmental contexts",2005,"Strategic Management Journal","https://www.scopus.com/inward/record.uri?eid=2-s2.0-13244253877&doi=10.1002%2fsmj.450&partnerID=40&md5=cddcc4cd1052fc99603cdafb2ebdbc51",Article,Scopus
"Sosna M., Trevinyo-Rodríguez R.N., Velamuri S.R.","Business model innovation through trial-and-error learning: The naturhouse case",2010,"Long Range Planning","https://www.scopus.com/inward/record.uri?eid=2-s2.0-77952557100&doi=10.1016%2fj.lrp.2010.02.003&partnerID=40&md5=6091bc0c84008919a960cb40222605ef",Article,Scopus
"Segars A.H., Grover V.","Strategic information systems planning success: An investigation of the construct and its measurement",1998,"MIS Quarterly: Management Information Systems","https://www.scopus.com/inward/record.uri?eid=2-s2.0-9744262493&doi=10.2307%2f249393&partnerID=40&md5=773169566142ff5002353d4c26f15588",Article,Scopus
"Applegate L.M., McFarlan F.W., McKenney J.L.",[No title available],1996,"Corporate Information Systems Management: Text and Cases, 4th Edition",,,Scopus
"Mithas S., Ramasubbu N., Sambamurthy V.","How information management capability influences firm performance",2011,"MIS Quarterly: Management Information Systems","https://www.scopus.com/inward/record.uri?eid=2-s2.0-79551561546&doi=10.2307%2f23043496&partnerID=40&md5=910e9cc098477070c0c8782ff33fee50",Article,Scopus
"McFarlan F.W.","Portfolio approach to information systems",1981,"Harvard Business Review",,,Scopus
"Arthur W.B., Durlauf S.N., Lane D.A.",[No title available],1997,"The Economy as an Evolving Complex System II",,,Scopus
"Jarzabkowski P.","Strategy as practice: An activity-based approach",2005,"Strategy as Practice: An Activity-Based Approach","https://www.scopus.com/inward/record.uri?eid=2-s2.0-84949755179&doi=10.4135%2f9781446215777&partnerID=40&md5=9399a2ed801a35953ea5db261719f56b",Book,Scopus
"West J.","How open is open enough? Melding proprietary and open source platform strategies",2003,"Research Policy","https://www.scopus.com/inward/record.uri?eid=2-s2.0-0038785540&doi=10.1016%2fS0048-7333%2803%2900052-0&partnerID=40&md5=caf964d030df9e1324d77e9a153d6d98",Article,Scopus
"Olson E.M., Slater S.F., Hult G.T.M.","The performance implications of fit among business strategy, marketing organization structure, and strategic behavior",2005,"Journal of Marketing","https://www.scopus.com/inward/record.uri?eid=2-s2.0-22544457631&doi=10.1509%2fjmkg.69.3.49.66362&partnerID=40&md5=9755599fb2fde134b27ed0361820f099",Article,Scopus
"Ciborra C.",[No title available],2000,"From Control to Drift: The Dynamics of Corporate Information Infrastructures",,,Scopus
"Hardy M.A.","Regression with dummy variables",1993,"Regression with Dummy Variables",,,Scopus
"Aral S., Weill P.","IT assets, organizational capabilities, and firm performance: How resource allocations and organizational differences explain performance variation",2007,"Organization Science","https://www.scopus.com/inward/record.uri?eid=2-s2.0-41449112482&doi=10.1287%2forsc.1070.0306&partnerID=40&md5=2a68a2132d15b8bc7d4b5067c9e573ea",Article,Scopus
"Holt D.T., Armenakis A.A., Feild H.S., Harris S.G.","Readiness for organizational change: The systematic development of a scale",2007,"Journal of Applied Behavioral Science","https://www.scopus.com/inward/record.uri?eid=2-s2.0-34249733071&doi=10.1177%2f0021886306295295&partnerID=40&md5=bb1bdad804a4e059207b15762aee957c",Article,Scopus
"Miller J.H., Page S.E.","Complex adaptive systems: An introduction to computational models of social life",2009,"Complex Adaptive Systems: An Introduction to Computational Models of Social Life","https://www.scopus.com/inward/record.uri?eid=2-s2.0-84924212250&partnerID=40&md5=ef1e4fa75af63c04ce4d3872cc58587c",Book,Scopus
"Byrd T.A., Turner D.E.","Measuring the flexibility of information technology infrastructure: Exploratory analysis of a construct",2000,"Journal of Management Information Systems","https://www.scopus.com/inward/record.uri?eid=2-s2.0-0034434541&doi=10.1080%2f07421222.2000.11045632&partnerID=40&md5=29a8114f9a7fc2268ea3aec18d23bac1",Article,Scopus
"Rindova V.P., Kotha S.","Continuous ""morphing"": Competing through dynamic capabilities, form, and function",2001,"Academy of Management Journal","https://www.scopus.com/inward/record.uri?eid=2-s2.0-0035528636&doi=10.2307%2f3069400&partnerID=40&md5=768fd60200c88d47a14f3c2401e43cdd",Article,Scopus
"Hedman J., Kalling T.","The business model concept: Theoretical underpinnings and empirical illustrations",2003,"European Journal of Information Systems","https://www.scopus.com/inward/record.uri?eid=2-s2.0-0037357555&doi=10.1057%2fpalgrave.ejis.3000446&partnerID=40&md5=9db7786fa9eebb6cf875a1113f1d0f24",Article,Scopus
"Akkermans H., Van Helden K.","Vicious and virtuous cycles in ERP implementation: A case study of interrelations between critical success factors",2002,"European Journal of Information Systems","https://www.scopus.com/inward/record.uri?eid=2-s2.0-0036001767&doi=10.1057%2fpalgrave.ejis.3000418&partnerID=40&md5=79f196541bd41516705fc3a5945a20be",Article,Scopus
"Duncan N.B.","Capturing flexibility of information technology infrastructure: A study of resource characteristics and their measure",1995,"Journal of Management Information Systems","https://www.scopus.com/inward/record.uri?eid=2-s2.0-71549155056&doi=10.1080%2f07421222.1995.11518080&partnerID=40&md5=ef8d057986bd45a6241bd8366f326375",Article,Scopus
"Anderson P.W., Arrow K.J., Pines D.",[No title available],1988,"The Economy as an Evolving Complex System",,,Scopus
"Volberda H.W.",[No title available],1998,"Building the Flexible Firm: How to Remain Competitive",,,Scopus
"Peppard J., Ward J.","Beyond strategic information systems: Towards an IS capability",2004,"Journal of Strategic Information Systems","https://www.scopus.com/inward/record.uri?eid=2-s2.0-2942715360&doi=10.1016%2fj.jsis.2004.02.002&partnerID=40&md5=5663de37dbce46fceec2396352bcec2b",Article,Scopus
"Zahra S.A., Covin J.G.","Business strategy, technology policy and firm performance",1993,"Strategic Management Journal","https://www.scopus.com/inward/record.uri?eid=2-s2.0-84989052440&doi=10.1002%2fsmj.4250140605&partnerID=40&md5=4d420b9dcace89f3c3e608f8a9c23d86",Article,Scopus
"Brancheau J.C., Wetherbe J.C.","Key issues in information systems management",1987,"MIS Quarterly: Management Information Systems","https://www.scopus.com/inward/record.uri?eid=2-s2.0-55249089317&doi=10.2307%2f248822&partnerID=40&md5=410cc30cabbf4a8f6aecf7b8f2999bb0",Article,Scopus
"Piccoli G., Ives B.","Review: IT-dependent strategic initiatives and sustained competitive advantage: A review and synthesis of the literature",2005,"MIS Quarterly: Management Information Systems","https://www.scopus.com/inward/record.uri?eid=2-s2.0-33751573321&doi=10.2307%2f25148708&partnerID=40&md5=d23bc2857ffe5eab80bda4112e2e588a",Article,Scopus
"Garud R., Karnoe P.","Path creation as a process of mindful deviation",2001,"Path Dependence and Creation",,,Scopus
"Ireland R.D., Covin J.G., Kuratko D.F.","Conceptualizing corporate entrepreneurship strategy",2009,"Entrepreneurship: Theory and Practice","https://www.scopus.com/inward/record.uri?eid=2-s2.0-58149291530&doi=10.1111%2fj.1540-6520.2008.00279.x&partnerID=40&md5=8d5d79307bea7e976155e3ae45ace5a6",Article,Scopus
"Keeney R.L.","Value of internet commerce to the customer",1999,"Management Science","https://www.scopus.com/inward/record.uri?eid=2-s2.0-0032678626&doi=10.1287%2fmnsc.45.4.533&partnerID=40&md5=2e8d368377c9f59cf88bc72062721777",Article,Scopus
"Whittington R.","Strategy as practice",1996,"Long Range Planning","https://www.scopus.com/inward/record.uri?eid=2-s2.0-0000356229&doi=10.1016%2f0024-6301%2896%2900068-4&partnerID=40&md5=83471b96a1b481c2b15723087fddfc9a",Conference Paper,Scopus
"Jarvenpaa S.L., Ives B.","Executive involvement and participation in the management of information technology",1991,"MIS Quarterly: Management Information Systems","https://www.scopus.com/inward/record.uri?eid=2-s2.0-0039396840&doi=10.2307%2f249382&partnerID=40&md5=76858510df42a7fa4df0b5464c0f9435",Article,Scopus
"Fredrickson J.W.","The comprehensiveness of strategic decision processes: Extension, observations, future directions",1984,"Academy of Management Journal",,,Scopus
"Cross N.",[No title available],2011,"Design Thinking: Understanding How Designers Think and Work",,,Scopus
"Saxenian A.","Regional Networks and the Resurgence of Silicon Valley",1990,"California Management Review","https://www.scopus.com/inward/record.uri?eid=2-s2.0-84968136125&doi=10.2307%2f41166640&partnerID=40&md5=a64dd37c21cfc80867456b68e80224f9",Article,Scopus
"Starbuck W.H., Milliken F.J.","Executives' perceptual filters: What they notice and how they make sense",1988,"The Executive Effect: Concepts and Methods for Studying Top Managers",,,Scopus
"Boynton A.C., Zmud R.W., Jacobs G.C.","The influence of IT management practice on IT use in large organizations",1994,"MIS Quarterly: Management Information Systems","https://www.scopus.com/inward/record.uri?eid=2-s2.0-0000880687&doi=10.2307%2f249620&partnerID=40&md5=6047c8ec98729a8325f3599a31552234",Article,Scopus
"Niederman F., Brancheau J.C., Wetherbe J.C.","Information systems management issues for the 1990s",1991,"MIS Quarterly: Management Information Systems","https://www.scopus.com/inward/record.uri?eid=2-s2.0-24044502721&doi=10.2307%2f249452&partnerID=40&md5=2775222562ce7feaf6e76db23bb65334",Article,Scopus
"Weber R.","Still desperately seeking the IT artifact",2003,"MIS Quarterly",,,Scopus
"George G., Bock A.J.","The Business Model in Practice and its Implications for Entrepreneurship Research",2011,"Entrepreneurship: Theory and Practice","https://www.scopus.com/inward/record.uri?eid=2-s2.0-78751539206&doi=10.1111%2fj.1540-6520.2010.00424.x&partnerID=40&md5=ba559d8fddc6562b9d6da98d6da8627c",Article,Scopus
"Newbert S.L.","Value, rareness, competitive advantage, and performance: A conceptual-level empirical investigation of the resource-based view of the firm",2008,"Strategic Management Journal","https://www.scopus.com/inward/record.uri?eid=2-s2.0-45849097260&doi=10.1002%2fsmj.686&partnerID=40&md5=8da79f37d659b90a4462abe2d75cd42a",Article,Scopus
"Rorty R.",[No title available],1998,"Truth and Progress",,,Scopus
"Tanriverdi H., Venkatraman N.","Knowledge relatedness and the performance of multibusiness firms",2005,"Strategic Management Journal","https://www.scopus.com/inward/record.uri?eid=2-s2.0-11844254457&doi=10.1002%2fsmj.435&partnerID=40&md5=a793056d2e42fcdfdc9def6947e86c13",Review,Scopus
"Abernathy W.J.",[No title available],1978,"The Productivity Dilemma: Roadblock to Innovation in the Automobile Industry",,,Scopus
"Ethiraj S.K., Levinthal D.","Modularity and Innovation in Complex Systems",2004,"Management Science","https://www.scopus.com/inward/record.uri?eid=2-s2.0-1642361663&doi=10.1287%2fmnsc.1030.0145&partnerID=40&md5=44e7beabf7c2282285620d6de8b4f062",Review,Scopus
"Earl M.J.","Experiences in strategic information systems planning",1993,"MIS Quarterly",,,Scopus
"Garud R., Nayyar P.R.","Transformative capacity: Continual structuring by intertemporal technology transfer",1994,"Strategic Management Journal","https://www.scopus.com/inward/record.uri?eid=2-s2.0-84989078317&doi=10.1002%2fsmj.4250150504&partnerID=40&md5=350af3ce91a791ab288b7741b29b799c",Article,Scopus
"Boudreau K.","Open platform strategies and innovation: Granting access vs. devolving control",2010,"Management Science","https://www.scopus.com/inward/record.uri?eid=2-s2.0-77958033399&doi=10.1287%2fmnsc.1100.1215&partnerID=40&md5=7e55ba0bdb737c05f6653c7bbf202b14",Article,Scopus
"Hoopes D.G., Madsen T.L., Walker G.","Guest editors' introduction to the special issue: Why is there a resource-based view? Toward a theory of competitive heterogeneity",2003,"Strategic Management Journal","https://www.scopus.com/inward/record.uri?eid=2-s2.0-0141680360&doi=10.1002%2fsmj.356&partnerID=40&md5=4bfaaf85fa8203841ecbf9e6d3ca70d9",Article,Scopus
