Author,Title,Year,Source Title,Document Type,FAMILY_TYPE
"Morahan-Martin, J., Schumacher, P.",Incidence and correlates of pathological internet use among college students,2000,Computers in Human Behavior,Article,CHILD
"Cooper, C.",Terminally addicted,1998,Lancet,Article,CHILD
"Young, K., Pistner, M., O'Mara, J., Buchanan, J.",Cyber disorders: The mental health concern for the new millennium,1999,Cyberpsychology and Behavior,Article,CHILD
"Hollinger, R.C., Clark, J.P.",Formal and Informal Social Controls of Employee Deviance,1982,Sociological Quarterly,Article,CHILD
"Robinson, S.L., Bennett, R.J.",A typology of deviant workplace behaviors: A multidimensional scaling study,1995,Academy of Management Journal,Article,CHILD
"Mastrangelo, P.M., Everton, W., Jolton, J.A.",Exploring facets and correlates of counterproductive computer use at work,2002,Annual Society for Industrial and Organizational Psychology Meeting,Article,CHILD
"Chen, P.Y., Spector, P.E.","Relationships of work stressors with aggression, withdrawal, theft and substance use: An exploratory study",1992,Journal of Occupational and Organizational Psychology,Article,CHILD
"Maertz, C.P., Campion, M.A.",25 years of voluntary turnover research: A review and critique,1998,International Review of Industrial and Organizational Psychology,Article,CHILD
"Morahan-Martin, J.",The gender gap in internet use: Why men use the internet more than women - A literature review,1998,Cyberpsychology and Behavior,Review,CHILD
"Teo, T.S.H., Lim, V.K.G.",Usage and perceptions of the internet: What has age got to do with it?,1998,Cyberpsychology and Behavior,Article,CHILD
"Weiser, E.B.",Gender differences in Internet use patterns and internet application preferences: A two-sample comparison,2000,Cyberpsychology and Behavior,Article,CHILD
"Webster, C.D., Jackson, M.A.",A clinical perspective on impulsivity,1997,"Impulsivity: Theory, Assessment, and Treatment",Article,CHILD
"Lin, S.S.J., Tsai, C.-C.",Sensation seeking and internet dependence of Taiwanese high school adolescents,2002,Computers in Human Behavior,Article,CHILD
"BARRICK, M.R., MOUNT, M.K.",THE BIG FIVE PERSONALITY DIMENSIONS AND JOB PERFORMANCE: A META‐ANALYSIS,1991,Personnel Psychology,Article,CHILD
"Brooner, R.K., Costa Jr., P.T., Fetch, L.J.",The personality dimensions of male and female drug abusers with and without antisocial personality disorder,1991,"Annual Scientific Meeting, Committee on Problems of Drug Dependence",Article,CHILD
"Woolley, R.M., Hakstian, A.R.",An examination of the construct validity of personality-based and overt measures of integrity,1992,Educational and Psychological Measurement,Article,CHILD
"Zuckerman, M.",The sensation seeking motive.,1974,Progress in experimental personality research,Review,CHILD
"Roberti, J.W., Storch, E.A., Bravata, E.",Further Psychometric Support for the Sensation Seeking Scale-Form V,2003,Journal of Personality Assessment,Article,CHILD
"Patton, J.H., Stanford, M.S., Barratt, E.S.",Factor structure of the barratt impulsiveness scale,1995,Journal of Clinical Psychology,Article,CHILD
"BARRATT, E.S.",FACTOR ANALYSIS OF SOME PSYCHOMETRIC MEASURES OF IMPULSIVENESS AND ANXIETY.,1965,Psychological reports,Article,CHILD
"Carrillo-de-la-Peña, M.T., Otero, J.M., Romero, E.",Comparison among various methods of assessment of impulsiveness.,1993,Perceptual and motor skills,Article,CHILD
"Stanton, J.M., Sinar, E.F., Balzer, W.K., Julian, A.L., Thoresen, P., Aziz, S., Fisher, G.G., Smith, P.C.",Development of a compact measure of job satisfaction: The abridged Job Descriptive Index,2002,Educational and Psychological Measurement,Article,CHILD
"Smith, P.C., Kendall, L.M., Hulin, C.L.",The measurement of satisfaction in work and retirement,1969,The Measurement of Satisfaction in Work and Retirement,Article,CHILD
"Goldberg, L.R.","A broad-bandwidth, public-domain, personality inventory measuring the lower-level facets of several five-factor models",1999,Personality Psychology in Europe,Article,CHILD
"Goldberg, L.R.",The Development of Markers for the Big-Five Factor Structure,1992,Psychological Assessment,Article,CHILD
"Matteson, M.T., Ivancevich, J.M.",Controlling Work Stress. Effective Human Resource and Management Strategies,1987,Controlling Work Stress,Article,CHILD
"Margolis, B.L., Kroes, W.H., Quinn, R.P.",Job stress: An unlisted occupational hazard,1974,Journal of Occupational Medicine,Article,CHILD
"Moretti, D.M.",The prediction of employee counterproductivity through attitude assessment,1986,Journal of Business and Psychology,Article,CHILD
"Meece, M.",Many play online at work (and some look for new jobs),2000,The New York Times,Article,CHILD
Reference Count: 32,,,,,
,,,,,
"Lim V.K.G., Teo T.S.H.","Prevalence, perceived seriousness, justification and regulation of cyberloafing in Singapore: An exploratory study",2005,Information and Management,Article,PARENT
[No author name available],Getting the goods on time thieves,1983,ABA Banking Journal,Article,CHILD
"Anandarajan, M.",Internet abuse in the workplace,2002,Communications of the ACM,Article,CHILD
"Aquino, K., Lewis, M.U., Bradfield, M.","Justice constructs, negative affectivity, and employee deviance: A proposed model and empirical test",1999,Journal of Organizational Behavior,Article,CHILD
"Brune, H.H.",The social implications of information processing,1978,Information and Management,Article,CHILD
"Chang, M.K., Cheung, W.",Determinants of the intention to use Internet/WWW at work: A confirmatory study,2001,Information and Management,Article,CHILD
"Chung, J., Tan, F.B.",Antecedents of perceived playfulness: An exploratory study on user acceptance of general information-searching websites,2004,Information and Management,Article,CHILD
"Fox, S., Spector, P.E.",A model of work frustration-aggression,1999,Journal of Organizational Behavior,Article,CHILD
"Greenberg, J.","The cognitive geometry of employee theft: Negotiating """"the line"""" between taking and stealing",1998,Dysfunctional Behavior in Organizations,Article,CHILD
"Hollinger, R.C.",Neutralizing in the workplace: An empirical analysis of property theft and production deviance,1991,Deviant Behavior,Article,CHILD
"Hollinger, R.C., Clark, J.P.","Deterrence in the workplace: perceived certainty, perceived severity, and employee theft.",1983,Social forces; a scientific medium of social study and interpretation,Article,CHILD
"Joinson, A.","Social desirability, anonymity, and Internet-based questionnaires",1999,"Behavior Research Methods, Instruments, and Computers",Article,CHILD
"Lim, V.K.G.","The IT way of loafing on the job: Cyberloafing, neutralizing and organizational justice",2002,Journal of Organizational Behavior,Article,CHILD
"Lim, V.K.G., Teo, T.S.H., Loo, G.L.",How do I loaf here? Let me count the ways,2002,Communications of the ACM,Article,CHILD
"Lim, V.K.G., See, S.K.B.","Attitudes toward, and intentions to report, academic cheating among students in Singapore",2001,Ethics and Behavior,Article,CHILD
"Mills, J.E., Hu, B., Beldona, S., Clay, J.",Cyberslacking! A liability issue for wired workplaces,2001,Cornell Hotel and Restaurant Administration Quarterly,Article,CHILD
"Mirchandani, D., Motwani, J.",Reducing internet abuse in the workplace,2003,SAM Advanced Management Journal,Article,CHILD
"Ranganathan, C., Ganapathy, S.",Key dimensions of business-to-consumer web sites,2002,Information and Management,Article,CHILD
"Griffin, R.W., O'Leary-Kelly, A., Collins, J.M.",Dysfunctional behavior in organizations: Violent and deviant behavior,1998,Dysfunctional Behavior in Organizations,Article,CHILD
"Roman, L.A.",Survey: Employees traveling in Cyberspace while on the clock,1996,Memphis Business Journal,Article,CHILD
"Salancik, G.R., Pfeffer, J.",A social information processing approach to job attitudes and task design.,1978,Administrative science quarterly,Review,CHILD
"Scheuermann, L.E., Langford, H.P.","Perceptions of internet abuse, liability, and fair use",1997,Perceptual and Motor Skills,Article,CHILD
"Sykes, G.M., Matza, D.",Techniques of neutralization: A theory of delinquency,1957,American Sociological Review,Article,CHILD
"Snyder, N.H., Blair, K.E., Arndt, T.",Breaking the bad habits behind time theft,1990,Business,Article,CHILD
"Teo, T.S.H.",Attitudes toward online shopping and the Internet,2002,Behaviour and Information Technology,Article,CHILD
"Teo, T.S.H., Choo, W.Y.",Assessing the impact of using the Internet for competitive intelligence,2001,Information and Management,Article,CHILD
"Teo, T.S.H., Lim, V.K.G.",Usage and perceptions of the internet: What has age got to do with it?,1998,Cyberpsychology and Behavior,Article,CHILD
"Teo, T.S.H., Lim, V.K.G., Lai, R.Y.C.",Users and uses of the internet: The case of Singapore,1997,International Journal of Information Management,Article,CHILD
"Teo, T.S.H., Lim, V.K.G., Lai, R.Y.C.",Intrinsic and extrinsic motivation in Internet usage,1999,Omega,Article,CHILD
"Teo, T.S.H., Too, B.L.",Information systems orientation and business use of the internet: An empirical study,2000,International Journal of Electronic Commerce,Article,CHILD
"Verton, D.",Employers ok with e-surfing,2000,Computerworld,Article,CHILD
Reference Count: 30,,,,,
,,,,,
"Mahatanankoon P., Anandarajan M., Igbaria M.",Development of a Measure of Personal Web Usage in the Workplace,2004,Cyberpsychology and Behavior,Article,PARENT
"Greenfield, D.N., Davis, R.A.",Lost in cyberspace: The web @ work,2002,Cyberpsychology and Behavior,Article,CHILD
"Bequai, August",Employee abuses in cyberspace: Management's legal quagmire,1998,Computers and Security,Editorial,CHILD
"Foster, M.",Be alert to the signs of employee Internet addiction,2001,National Public Accountant,Article,CHILD
"Scheuermann, L.E., Langford, H.P.","Perceptions of internet abuse, liability, and fair use",1997,Perceptual and Motor Skills,Article,CHILD
"Anandarajan, M.",Internet abuse in the workplace,2002,Communications of the ACM,Article,CHILD
"Lim, V.K.G.","The IT way of loafing on the job: Cyberloafing, neutralizing and organizational justice",2002,Journal of Organizational Behavior,Article,CHILD
"Davis, R.A.",Cognitive-behavioral model of pathological Internet use,2001,Computers in Human Behavior,Article,CHILD
"Davis, R.A., Flett, G.L., Besser, A.",Validation of a new scale for measuring problematic internet use: Implications for pre-employment screening,2002,Cyberpsychology and Behavior,Article,CHILD
"Case, C.J., Young, K.S.",Employee Internet management: Current business practices and outcomes,2002,Cyberpsychology and Behavior,Article,CHILD
"Greenfield, D.N.","Virtual addiction: Help for netheads, cyberfreaks, and those who love them",1999,"Virtual Addiction: Help for Netheads, Cyberfreaks, and Those Who Love Them",Article,CHILD
"Bellm, M.",Cutting down on internet abuse at work,1998,Control Engineering,Article,CHILD
"Dunn, K.",Xerox fires employees for Internet misuse,1999,Workforce,Article,CHILD
"Steven, T.",Cyberspace abuse,2000,Industry Week,Article,CHILD
"Wen, H.J., Lin, B.",Internet and employee productivity,1998,Management Decision,Article,CHILD
"Belanger, F., Van Slyke, C.",Abuse or learning?,2002,Communications of the ACM,Article,CHILD
"Mahatanankoon, P., Igbaria, M., Anandarajan, M.",Person web usage in the workplace: A comparison between Thai vs U.S.,2002,7th Asia-Pacific Decision Sciences Institution Conference July 24-27,Article,CHILD
"Lederer, A.L., Maupin, D.J., Sena, M.P., Zhuang, Y.",Technology acceptance model and the World Wide Web,2000,Decision Support Systems,Article,CHILD
"Stevens, P.M., Williams, K.P., Smith, M.C.",Organizational communication and information processes in an internet-enabled environment,2000,Psychology and Marketing,Article,CHILD
"Teo, T.S.H., Lim, V.K.G.",Usage and perceptions of the internet: What has age got to do with it?,1998,Cyberpsychology and Behavior,Article,CHILD
"Teo, T.S.H., Lim, V.K.G., Lai, R.Y.C.",Intrinsic and extrinsic motivation in Internet usage,1999,Omega,Article,CHILD
"Korgaonkar, P.K., Wolin, L.D.",A multivariate analysis of web usage,1999,Journal of Advertising Research,Article,CHILD
"Papacharissi, Z., Rubin, A.M.",Predictors of internet use,2000,Journal of Broadcasting and Electronic Media,Article,CHILD
"Armstrong, L., Phillips, J.G., Saling, L.L.",Potential determinants of heavier Internet usage,2000,International Journal of Human Computer Studies,Article,CHILD
"Lim, V.K.G., Teo, T.S.H., Loo, G.L.",How do I loaf here? Let me count the ways,2002,Communications of the ACM,Article,CHILD
"Babin, B.J., Boles, J.S., Robin, D.P.",Representing the perceived ethical work climate among marketing employees,2000,Journal of the Academy of Marketing Science,Article,CHILD
"Gefen, D., Straub, D., Boudreau, M.",Structural equation modeling and regression: Guidelines for research practice,2000,Communications of the Association for Information Systems,Article,CHILD
"Byrne, B.M.","Structural equation modeling with AMOS: Basic concepts, applications, and programming",2001,"Structural Equation Modeling with AMOS: Basic Concepts, Applications, and Programming",Article,CHILD
"Segars, A.H., Grover, V.",Re-examining perceived ease of use and usefulness: A confirmatory factor analysis,1993,MIS Quarterly: Management Information Systems,Article,CHILD
"Anderson, J.C., Gerbing, D.W.",Structural Equation Modeling in Practice: A Review and Recommended Two-Step Approach,1988,Psychological Bulletin,Article,CHILD
"Gefen, D.",Reflections on the Dimensions of Trust and Trustworthiness among Online Consumers,2002,Data Base for Advances in Information Systems,Article,CHILD
"Hackman, J.R., Oldham, G.R.",Development of the Job Diagnostic Survey,1975,Journal of Applied Psychology,Article,CHILD
"Anandarajan, M., Simmers, C., Igbaria, M.",An exploratory investigation of the antecedents and impact of internet usage: An individual perspective,2000,Behaviour and Information Technology,Article,CHILD
"LaPlante, A.",Start small think infinite,1997,Computerworld,Article,CHILD
"Hollinger, R.C., Clark, J.P.",Formal and Informal Social Controls of Employee Deviance,1982,Sociological Quarterly,Article,CHILD
"Hollinger, R.C.",Acts against the workplace: Social bonding and employee deviance,1986,Deviant Behavior,Article,CHILD
"Huiras, J., Uggen, C., McMorris, B.","Career jobs, survival jobs, and employee deviance: A social investment model of workplace misconduct",2000,Sociological Quarterly,Article,CHILD
"Bolin, A., Heatherly, L.",Predictors of employee deviance: The relationship between bad attitudes and bad behavior,2001,Journal of Business and Psychology,Article,CHILD
"Young, K.",Caught on-line,1998,Credit Union Management,Article,CHILD
Reference Count: 38,,,,,
,,,,,
"Young K.S., Case C.J.",Internet Abuse in the Workplace: New Trends in Risk Management,2004,Cyberpsychology and Behavior,Article,PARENT
"Stewart, F.","Internet acceptable use policies: Navigating the management, legal, and technical issues",2000,Information Systems Security,Article,CHILD
"Abdur-Razzaq, B.M.",Boom times,2002,PC Magazine,Article,CHILD
"Swanson, S.",Beware: Employee monitoring is on the rise,2001,Information Week,Article,CHILD
"Vanscoy, K.",What your workers are really up to,2001,smartbusinessmag.com,Article,CHILD
"Seltzer, L.",Monitoring software,2000,PC Magazine,Article,CHILD
[No author name available],Snoop at your peril,2000,PC Magazine,Article,CHILD
"Wilder, C., Soat, J.",A question of ethics,2001,informationweek.com,Article,CHILD
[No author name available],A dow chemical fires 50 over offensive e-mail,2000,CNET News,Article,CHILD
"DiSabatino, J.A.",Email probe triggers firings,2000,Computerworld,Article,CHILD
"Naughton, K., Raymond, J., Shulman, K.",Cyberslacking,1999,Newsweek,Article,CHILD
"Anandarajan, M.",Internet abuse in the workplace,2002,Communications of the ACM,Article,CHILD
"Greenfield, D.","Internet addiction: Disinhibition, accelerated intimacy and other theoretical considerations",1999,107th Annual Meeting of the American Psychological Association,Article,CHILD
"Morahan-Martin, J.M., Schumacher, P.",Incidence and correlates of pathological internet use,1997,105th Annual Convention of the American Psychological Association,Article,CHILD
"Scherer, K.",College Life On-Line: Healthy and Unhealthy Internet Use,1997,Journal of College Student Development,Article,CHILD
"Young, K.S.",Managing employee internet abuse: Seven strategies to maximize productivity and reduce liability,2001,Center for Online Addiction,Article,CHILD
"Young, K.S.",Advanced risk assessment and treatment approaches for internet-addicted clients,2002,Employee Assistance Professional Association,Article,CHILD
"Case, C.J., Matz, L.",Internet electronic mail: A viable research tool?,1998,Asia Journal of Business and Entrepreneurship,Article,CHILD
Reference Count: 17,,,,,
,,,,,
"Sharma S.K., Gupta J.N.D.",Improving workers' productivity and reducing Internet abuse,2003,Journal of Computer Information Systems,Article,PARENT
"Adams III, H., Scheuing, S.M., Feeley, S.A.","E-mail monitoring in the workplace: The good, the bad and the ugly",2000,Defense Counsel Journal,Article,CHILD
[No author name available],E-business or bust,2000,Sales and Marketing Management,Article,CHILD
[No author name available],Internet Abuse is on the Increase,2001,Management Services,Article,CHILD
"Cook, B.",Paradoxically Speaking: Increased IT Spending the Lack of Productivity Improvements,1999,Inform,Article,CHILD
"Diewert, W.E., Fox, K.J.",Can measurement error explain the productivity paradox?,1999,Canadian Journal of Economics,Article,CHILD
"Wolff, E.N.",The productivity paradox: Evidence from indirect indicators of service sector productivity growth,1999,Canadian Journal of Economics,Article,CHILD
"Ferris, N.",Cleaning up your e-mail,2000,Government Executive,Article,CHILD
"Kudlow, L.",Greenspan Through the Looking Glass,2000,New York Times,Article,CHILD
"Lehr, B., Lichtenberg, F.","Information technology and its impact on productivity: Firm-level evidence from government and private data sources, 1977-1993",1999,Canadian Journal of Economics,Article,CHILD
"Marsan, C.D.",Employee Study Cites Rampant Internet Abuse,2000,Network World,Article,CHILD
"Merlino, L.",Employers Laid Back over Internet Abuse,2000,Upside,Article,CHILD
"Conlin, M.","Workers, surf at your own risk",2000,Business Week,Article,CHILD
"Schwartz, P.",Long Live the Long Boom,1999,Wired,Article,CHILD
"Silva, D.",Companies Take Steps to Combat Internet Abuse,2001,Puget Sound Business Journal,Article,CHILD
"Stratopoulos, T., Dehning, B.",Does successful investment in information technology solve the productivity paradox?,2000,Information and Management,Article,CHILD
"Sullivan, K.B.",Web Monitoring and Filtering Programs Promote Productivity,1996,PC-week,Article,CHILD
"Uchitelle, L.",U.S. Productivity Rose At 5% Rate In 2nd Half Of '99,2000,New York Times,Article,CHILD
"Zelnick, N.",The Productivity Paradox,1999,Internet-world,Article,CHILD
Reference Count: 18,,,,,
,,,,,
Griffiths M.,Internet abuse in the workplace: Issues and concerns for employers and employment counselors,2003,Journal of Employment Counseling,Review,PARENT
[No author name available],Blue money,1999,The Guardian,Article,CHILD
"Cooper, A., Putnam, D.E., Planchon, L.A., Boies, S.C.",Online sexual compulsivity: Getting tangled in the net,1999,Sexual Addiction and Compulsivity,Article,CHILD
"Cooper, A., Scherer, C.R., Gordon, B.L., Boies, S.C.",Sexuality on the internet: From sexual exploration to pathological expression,1999,Professional Psychology: Research and Practice,Article,CHILD
"Cooper, A., Sportolari, L.",Romance in cyberspace: Understanding online attraction,1997,Journal of Sex Education and Therapy,Article,CHILD
"Griffiths, M.D.",Technological addictions,1995,Clinical Psychology Forum,Article,CHILD
"Griffiths, M.",Internet addiction,1999,Psychologist,Article,CHILD
"Griffiths, M.",Internet addiction: Does it really exist?,1998,"Psychology and the Internet: Intrapersonal, Interpersonal, and Transpersonal Implications",Article,CHILD
"Griffiths, M.D.",Internet addiction: Internet fuels other addictions,1999,Student British Medical Journal,Article,CHILD
"Griffiths, M.",Does Internet and computer 'addiction' exist? Some case study evidence,2000,Cyberpsychology and Behavior,Article,CHILD
"Griffiths, M.",Excessive Internet use: Implications for sexual behavior,2000,Cyberpsychology and Behavior,Review,CHILD
"Griffiths, M.",Internet Addiction - Time to be Taken Seriously?,2000,Addiction Research,Article,CHILD
"Griffiths, M.",Occupational health issues concerning Internet use in the workplace,2002,Work and Stress,Editorial,CHILD
"Joinson, A.",Causes and implications of disinhibited behavior on the Internet,1998,"Psychology and the Internet: Intrapersonal, Interpersonal, and Transpersonal Implications",Article,CHILD
"Snoddy, J.",Bill's up for office surfers,2000,The Guardian,Article,CHILD
"Young, K.",Internet addiction: Evaluation and treatment,1999,Student British Medical Journal,Article,CHILD
Reference Count: 15,,,,,
,,,,,
Lim V.K.G.,"The IT way of loafing on the job: Cyberloafing, neutralizing and organizational justice",2002,Journal of Organizational Behavior,Article,PARENT
[No author name available],Getting the goods on time thieves,1983,ABA Banking Journal,Article,CHILD
"Anandarajan, M.",Internet abuse in the workplace,2002,Communications of the ACM,Article,CHILD
"Anandarajan, M., Simmers, C., Igbaria, M.",An exploratory investigation of the antecedents and impact of internet usage: An individual perspective,2000,Behaviour and Information Technology,Article,CHILD
"Aquino, K., Lewis, M.U., Bradfield, M.","Justice constructs, negative affectivity, and employee deviance: A proposed model and empirical test",1999,Journal of Organizational Behavior,Article,CHILD
"Cheyne, T.L., Ritter, F.E.",Targeting audiences on the internet,2001,Communications of the ACM,Article,CHILD
"Dabney, D., Dabney, D.",Neutralization and deviance in the workplace: Theft of supplies and medicines by hospital nurses,1995,Deviant Behavior,Article,CHILD
"Floyd, F.J., Widaman, K.F.",Factor Analysis in the Development and Refinement of Clinical Assessment Instruments,1995,Psychological Assessment,Article,CHILD
"Folger, R., Cropanzano, R.",Organizational justice and human resource management,1998,Organizational Justice and Human Resource Management,Article,CHILD
"Kehoe, C., Pitkow, J., Sutton, K., Aggarwal, G., Rogers, J.D.",Results of GVU's Tenth World Wide Web User Survey,1999,Results of GVU's Tenth World Wide Web User Survey,Article,CHILD
"Greenberg, J.","The cognitive geometry of employee theft: Negotiating """"the line"""" between taking and stealing",1998,Dysfunctional Behavior in Organizations,Article,CHILD
"Gouldner, A.W.",The norm of reciprocity,1960,American Sociological Review,Article,CHILD
"Hollinger, R.C.",Neutralizing in the workplace: An empirical analysis of property theft and production deviance,1991,Deviant Behavior,Article,CHILD
"Hollinger, R.C., Clark, J.P.",Theft by employees,1983,Theft by Employees,Article,CHILD
"Joinson, A.","Social desirability, anonymity, and Internet-based questionnaires",1999,"Behavior Research Methods, Instruments, and Computers",Article,CHILD
"Lim, V.K.G., Teo, T.S.H., Loo, G.L.",How do I loaf here? Let me count the ways,2002,Communications of the ACM,Article,CHILD
"Meckbach, G.",The secret world of monitoring software,1998,Computing Canada,Article,CHILD
"Menzel, D.C.",www.ethics.gov: Issues and Challenges Facing Public Managers,1998,Public Administration Review,Article,CHILD
"Minor, W.W.",Techniques of Neutralization: A Reconceptualization and Empirical Examination,1981,Journal of Research in Crime and Delinquency,Article,CHILD
"Mitchell, J., Dodder, R.A., Norris, T.D.",Neutralization and delinquency: a comparison by sex and ethnicity.,1990,Adolescence,Article,CHILD
"Niehoff, B.P., Moorman, R.H.",Justice as a mediator of the relationship between methods of monitoring and organizational citizenship behavior,1993,Academy of Management Journal,Article,CHILD
"Robinson, S.L., Kraatz, M.S.",Constructing the reality of normative behavior: The use of neutralization strategies by organizational deviants,1998,Dysfunctional Behavior in Organizations,Article,CHILD
"Roman, L.A.",Survey: Employees traveling in Cyberspace while on the clock,1996,Memphis Business Journal,Article,CHILD
"Rousseau, D.M.",Psychological contracts in organizations: Understanding written and unwritten agreements,1995,Psychological Contracts in Organizations: Understanding Written and Unwritten Agreements,Article,CHILD
"Shields, I.W., Whitehall, G.C.",Neutralization and delinquency among teenagers,1994,Criminal Justice and Behavior,Article,CHILD
"Skarlicki, D.P., Folger, R.","Retaliation in the workplace: The roles of distributive, procedural, and interactional justice",1997,Journal of Applied Psychology,Article,CHILD
"Skarlicki, D.P., Folger, R., Tesluk, P.",Personality as a moderator in the relationship between fairness and retaliation,1999,Academy of Management Journal,Article,CHILD
"Snyder, N.H., Blair, K.E., Arndt, T.",Breaking the bad habits behind time theft,1990,Business,Article,CHILD
[No author name available],A costly pleasure: Net surfing is riding high at work and employees are waxing up their keyboards and checking out their personal interests at company expenses,1999,"The Orlando Sentinel, 19 May",Article,CHILD
[No author name available],Cyberslackers at work,2000,"The Straits Times, 28 April",Article,CHILD
[No author name available],Surfing abuse costing universities big money,2000,The Straits Times,Article,CHILD
"Sykes, G.M., Matza, D.",Techniques of neutralization: A theory of delinquency,1957,American Sociological Review,Article,CHILD
