Author,Title,Year,Source Title,Document Type,FAMILY_TYPE
"Organ, D.W.",Organizational citizenship behavior: The good soldier syndrome,1988,Organizational Citizenship Behavior: The Good Soldier Syndrome,Article,CHILD
"Robinson, S.L., Bennett, R.J.",A typology of deviant workplace behaviors: A multidimensional scaling study,1995,Academy of Management Journal,Article,CHILD
"Spector, P.E., Fox, S.",An emotion-centered model of voluntary work behavior. Some parallels between counterproductive work behavior and organizational citizenship behavior,2002,Human Resource Management Review,Article,CHILD
"Spector, P.E., Fox, S.",Theorizing about the deviant citizen: An attributional explanation of the interplay of organizational citizenship and counterproductive work behavior,2010,Human Resource Management Review,Article,CHILD
"Sykes, G.M., Matza, D.",Techniques of neutralization: A theory of delinquency,1957,American Sociological Review,Article,CHILD
"Ugrin, J.C., Pearson, J.M., Odom, M.D.","Profiling cyber-slackers in the workplace: Demographic, cultural, and workplace factors",2007,Journal of Internet Commerce,Article,CHILD
"Yellowlees, P.M., Marks, S.",Problematic Internet use or Internet addiction?,2007,Computers in Human Behavior,Article,CHILD
"Young, K.S.",Internet addiction: The emergence of a new clinical disorder,1998,Cyberpsychology and Behavior,Article,CHILD
"Young, K.S.",Internet addiction: A new clinical phenomenon and its consequences,2004,American Behavioral Scientist,Review,CHILD
Reference Count: 38,,,,,
,,,,,
Coker B.L.,Freedom to surf: The positive effects of workplace Internet leisure browsing,2011,"New Technology, Work and Employment",Article,PARENT
"Anandarajan, M., Paravastu, N., Simmers, C.A.",Perceptions of Personal Web Usage in the workplace: A Q-methodology approach,2006,Cyberpsychology and Behavior,Article,CHILD
"Baard, P.P., Deci, E.L., Ryan, R.M.",Intrinsic need satisfaction: A motivational basis of performance and well-being in two work settings,2004,Journal of Applied Social Psychology,Article,CHILD
"Baron, R.S.",Distraction-conflict theory: Progress and problems,1986,Advances in Experimental Social Psychology,Article,CHILD
"Beal, D.J., Weiss, H.M., Barros, E., MacDermid, S.M.",An episodic process model of affective influences on performance,2005,Journal of Applied Psychology,Review,CHILD
"Breaugh, J.A.",The Measurement of Work Autonomy,1985,Human Relations,Article,CHILD
"Csikszentmihalyi, M., LeFevre, J.",Optimal Experience in Work and Leisure,1989,Journal of Personality and Social Psychology,Article,CHILD
"Deci, E.L., Connell, J.P., Ryan, R.M.",Self-Determination in a Work Organization,1989,Journal of Applied Psychology,Article,CHILD
"Doerr, K.H., Mitchell, T.R., Klastorin, T.D., Brown, K.A.",Impact of material flow policies and goals on job outcomes,1996,Journal of Applied Psychology,Article,CHILD
"Gagné, M., Deci, E.L.",Self-determination theory and work motivation,2005,Journal of Organizational Behavior,Article,CHILD
"Greenfield, D.N., Davis, R.A.",Lost in cyberspace: The web @ work,2002,Cyberpsychology and Behavior,Article,CHILD
"Henning, R.A., Jacques, P., Kissel, G.V., Sullivan, A.B., Alteras-Webb, S.M.",Frequent short rest breaks from computer work: Effects on productivity and well-being at two field sites,1997,Ergonomics,Article,CHILD
"Jett, Q.R., George, J.M.",Work interrupted: A closer look at the role of interruptions in organizational life,2003,Academy of Management Review,Review,CHILD
"Kanfer, R., Ackerman, P.L., Murtha, T.C., Dugdale, B., Nelson, L.","Goal Setting, Conditions of Practice, and Task Performance: A Resource Allocation Perspective",1994,Journal of Applied Psychology,Article,CHILD
"Koestner, R., Ryan, R.M., Bernieri, F., Holt, K.",Setting limits on children's behavior: The differential effects of controlling vs. informational styles on intrinsic motivation and creativity,1984,Journal of Personality,Article,CHILD
"Lee, Y., Lee, Z., Kim, Y.",Understanding personal Web usage in organizations,2007,Journal of Organizational Computing and Electronic Commerce,Article,CHILD
"Lepper, M.R., Greene, D.",Turning play into work: Effects of adult surveillance and extrinsic rewards on children's intrinsic motivation,1975,Journal of Personality and Social Psychology,Article,CHILD
"Lim, V.K.G., Teo, T.S.H.","Prevalence, perceived seriousness, justification and regulation of cyberloafing in Singapore: An exploratory study",2005,Information and Management,Article,CHILD
"Lim, V.K.G., Teo, T.S.H., Loo, G.L.",How do I loaf here? Let me count the ways,2002,Communications of the ACM,Article,CHILD
"Marmot, M.G., Bosma, H., Hemingway, H., Brunner, E., Stansfeld, S.",Contribution of job control and other risk factors to social variations in coronary heart disease incidence,1997,Lancet,Article,CHILD
"Oravec, J.A.",Constructive approaches to internet recreation in the workplace,2002,Communications of the ACM,Article,CHILD
"Seymour, L., Nadasen, K.",Web access for IT staff: A developing world perspective on web abuse,2007,Electronic Library,Article,CHILD
"Sheldon, K.M., Elliot, A.J., Kim, Y., Kasser, T.",What is satisfying about satisfying events? Testing 10 candidate psychological needs,2001,Journal of Personality and Social Psychology,Article,CHILD
"Speier, C., Valacich, J.S., Vessey, I.",The influence of task interruption on individual decision making: An information overload perspective,1999,Decision Sciences,Review,CHILD
"Wallerstein, N.","Powerlessness, empowerment, and health: Implications for health promotion programs",1992,American Journal of Health Promotion,Review,CHILD
"Young, K.S., Case, C.J.",Internet Abuse in the Workplace: New Trends in Risk Management,2004,Cyberpsychology and Behavior,Article,CHILD
"Zijlstra, F.R.H., Robert A, R., Leonora, A.B., Krediet, I.",Temporal factors in mental work: Effects of interrupted activities,1999,Journal of Occupational and Organizational Psychology,Article,CHILD
Reference Count: 26,,,,,
,,,,,
"Liberman B., Seidman G., McKenna K.Y.A., Buffardi L.E.",Employee job attitudes and organizational characteristics as predictors of cyberloafing,2011,Computers in Human Behavior,Article,PARENT
"Ajzen, I., Fishbein, M.",Attitude-behavior relations: A theoretical analysis and review of empirical research,1977,Psychological Bulletin,Article,CHILD
"Anandarajan, M., Simmers, C., Igbaria, M.",An exploratory investigation of the antecedents and impact of internet usage: An individual perspective,2000,Behaviour and Information Technology,Article,CHILD
"Bennett, R.J., Robinson, S.L.","The past, present and future of workplace deviance research",2003,Organizational Behavior: The State of the Science,Article,CHILD
"Berry, C.M., Ones, D.S., Sackett, P.R.","Interpersonal deviance, organizational deviance, and their common correlates: A review and meta-analysis",2007,Journal of Applied Psychology,Article,CHILD
"Blanchard, A.L., Henle, C.A.",Correlates of different forms of cyberloafing: The role of norms and external locus of control,2008,Computers in Human Behavior,Article,CHILD
"Blau, G., Yang, Y., Ward-Cook, K.",Testing a measure of cyberloafing,2006,Journal of Allied Health,Article,CHILD
"Bolin, A., Heatherly, L.",Predictors of employee deviance: The relationship between bad attitudes and bad behavior,2001,Journal of Business and Psychology,Article,CHILD
"Chang, M.K., Cheung, W.",Determinants of the intention to use Internet/WWW at work: A confirmatory study,2001,Information and Management,Article,CHILD
"Chen, J.V., Chen, C.C., Yang, H.-H.",An empirical evaluation of key factors contributing to internet abuse in the workplace,2008,Industrial Management and Data Systems,Article,CHILD
"Conlin, M.","Workers, surf at your own risk",2000,Business Week,Article,CHILD
"D'Abate, C.P.",Working hard or hardly working: A study of individuals engaging in personal business on the job,2005,Human Relations,Article,CHILD
"Dalal, R.S.",A meta-analysis of the relationship between organizational citizenship behavior and counterproductive work behavior,2005,Journal of Applied Psychology,Review,CHILD
"De Lara, P.Z.M.","Relationship between organizational justice and cyberloafing in the workplace: Has """"anomia"""" a say in the matter?",2007,Cyberpsychology and Behavior,Article,CHILD
"Zoghbi-Manrique-De-Lara, P., Olivares-Mesa, A.",Bringing cyber loafers back on the right track,2010,Industrial Management and Data Systems,Article,CHILD
"Deci, E.L., Ryan, R.M.","The """"what"""" and """"why"""" of goal pursuits: Human needs and the self-determination of behavior",2000,Psychological Inquiry,Article,CHILD
"Eastin, M.S., Glynn, C.J., Griffiths, R.P.",Psychology of communication technology use in the workplace,2007,Cyberpsychology and Behavior,Article,CHILD
"Feldman, D.C.",The development and enforcement of group norms,1984,Academy of Management Review,Article,CHILD
"Galperin, B.L., Burke, R.J.",Uncovering the relationship between workaholism and workplace destructive and constructive deviance: An exploratory study,2006,International Journal of Human Resource Management,Article,CHILD
"Garrett, R.K., Danziger, J.N.",Disaffection or expected outcomes: Understanding personal Internet use during work,2008,Journal of Computer-Mediated Communication,Article,CHILD
"George, J.M.",Extrinsic and intrinsic origins of perceived social loafing in organizations,1992,Academy of Management Journal,Article,CHILD
"Greenfield, D.N., Davis, R.A.",Lost in cyberspace: The web @ work,2002,Cyberpsychology and Behavior,Article,CHILD
"Henle, C.A., Blanchard, A.L.",The interaction of work stressors and organizational sanctions on cyberloafing,2008,Journal of Managerial Issues,Article,CHILD
"Henle, C.A., Kohut, G., Booth, R.",Designing electronic use policies to enhance employee perceptions of fairness and to reduce cyberloafing: An empirical test of justice theory,2009,Computers in Human Behavior,Article,CHILD
"Hollinger, R.C., Slora, K.B., Terris, W.","Deviance in the fast‐food restaurant: Correlates of employee theft, altruism, and counterproductivity",1992,Deviant Behavior,Article,CHILD
"Jackson, L.A., Ervin, K.S., Gardner, P.D., Schmitt, N.",Gender and the internet: Women communicating and men searching,2001,Sex Roles,Article,CHILD
"Judge, T.A., Scott, B.A., Ilies, R.","Hostility, job attitudes, and workplace deviance: Test of a multilevel model",2006,Journal of Applied Psychology,Review,CHILD
"Ketchen Jr., D.J., Craighead, C.W., Buckley, M.R.","Time bandits: How they are created, why they are tolerated, and what can be done about them",2008,Business Horizons,Article,CHILD
"Kraus, S.J.",Attitudes and the prediction of behavior: A meta-analysis of the empirical literature,1995,Personality and Social Psychology Bulletin,Article,CHILD
"LaPlante, A.",Start small think infinite,1997,Computerworld,Article,CHILD
"Lau, V.C.S., Au, W.T., Ho, J.M.C.",A qualitative and quantitative review of antecedents of counterproductive behavior in organizations,2003,Journal of Business and Psychology,Review,CHILD
"Lewis, W., Agarwal, R., Sambamurthy, V.",Sources of influence on beliefs about information technology use: An empirical study of knowledge workers,2003,MIS Quarterly: Management Information Systems,Article,CHILD
"Lichtash, A.E.",Inappropriate use of e-mail and the internet in the workplace: The arbitration picture,2004,Dispute Resolution Journal,Article,CHILD
"Lim, V.K.G.","The IT way of loafing on the job: Cyberloafing, neutralizing and organizational justice",2002,Journal of Organizational Behavior,Article,CHILD
"Lim, V.K.G., Teo, T.S.H.","Prevalence, perceived seriousness, justification and regulation of cyberloafing in Singapore: An exploratory study",2005,Information and Management,Article,CHILD
"Lodahl, T.M., Kejnar, M.",The definition and measurement of job involvement,1965,Journal of Applied Psychology,Article,CHILD
"Mahatanankoon, P.",Predicting cyber-production deviance in the workplace,2006,International Journal of Internet and Enterprise Management,Article,CHILD
"Martin, L.E., Brock, M.E., Buckley, M.R., Ketchen Jr., D.J.",Time banditry: Examining the purloining of time in organizations,2010,Human Resource Management Review,Article,CHILD
"Morrison, E.W.",Longitudinal Study of the Effects of Information Seeking on Newcomer Socialization,1993,Journal of Applied Psychology,Article,CHILD
"Mount, M., Ilies, R., Johnson, E.",Relationship of personality traits and counterproductive work behaviors: The mediating effects of job satisfaction,2006,Personnel Psychology,Article,CHILD
"Naughton, K., Raymond, J., Shulman, K.",Cyberslacking,1999,Newsweek,Article,CHILD
"Paullay, I.M., Alliger, G.M., Stone-Romero, E.F.",Construct Validation of Two Instruments Designed to Measure Job Involvement and Work Centrality,1994,Journal of Applied Psychology,Article,CHILD
"Pee, L.G., Woon, I.M.Y., Kankanhalli, A.",Explaining non-work-related computing in the workplace: A comparison of alternative models,2008,Information and Management,Article,CHILD
"Robinson, S.L., Greenberg, J.","Employees behaving badly: Dimensions, determinants and dilemmas in the study of workplace deviance",1998,Trends in Organizational Behavior,Article,CHILD
"Robinson, S.L., Bennett, R.J.",A typology of deviant workplace behaviors: A multidimensional scaling study,1995,Academy of Management Journal,Article,CHILD
"Robinson, S.L., Kraatz, M.S.",Constructing the reality of normative behavior: The use of neutralization strategies by organizational deviants,1998,Dysfunctional Behavior in Organizations,Article,CHILD
"Robinson, S.L., O'Leary-Kelly, A.M.","Monkey see, monkey do: The influence of work groups on the antisocial behavior of employees",1998,Academy of Management Journal,Article,CHILD
"Rosen, L.D., Weil, M.M.","What have we learned from a decade of research (1983-1993) on """"the psychological impact of technology?""""",1994,Computers and Society,Article,CHILD
"Scheuermann, L.E., Langford, H.P.","Perceptions of internet abuse, liability, and fair use",1997,Perceptual and Motor Skills,Article,CHILD
"Sipior, J.C., Ward, B.T.",A strategic response to the broad spectrum of internet abuse,2002,Information Systems Management,Article,CHILD
"Stewart, F.","Internet acceptable use policies: Navigating the management, legal, and technical issues",2000,Information Systems Security,Article,CHILD
"Teo, T.S.H., Choo, W.Y.",Assessing the impact of using the Internet for competitive intelligence,2001,Information and Management,Article,CHILD
"Teo, T.S.H., Too, B.L.",Information systems orientation and business use of the internet: An empirical study,2000,International Journal of Electronic Commerce,Article,CHILD
"Vardi, Y., Wiener, Y.",Misbehavior in Organizations: A Motivational Framework,1996,Organization Science,Article,CHILD
"Verton, D.",Employers ok with e-surfing,2000,Computerworld,Article,CHILD
"Vitak, J., Crouse, J., Larose, R.",Personal Internet use at work: Understanding cyberslacking,2011,Computers in Human Behavior,Conference Paper,CHILD
"Anandarajan, M.",Internet abuse in the workplace,2002,Communications of the ACM,Article,CHILD
Reference Count: 56,,,,,
,,,,,
"Anandarajan M., Simmers C.A., D'Ovidio R.",Exploring the underlying structure of personal web usage in the workplace,2011,"Cyberpsychology, Behavior, and Social Networking",Article,PARENT
"Lee, Y., Lee, Z., Kim, Y.",Understanding personal Web usage in organizations,2007,Journal of Organizational Computing and Electronic Commerce,Article,CHILD
"Garrett, R.K., Danziger, J.N.",Disaffection or expected outcomes: Understanding personal Internet use during work,2008,Journal of Computer-Mediated Communication,Article,CHILD
"Block, W.","Cyberslacking, business ethics and managerial economics",2001,Journal of Business Ethics,Article,CHILD
"Mills, J.E., Hu, B., Beldona, S., Clay, J.",Cyberslacking! A liability issue for wired workplaces,2001,Cornell Hotel and Restaurant Administration Quarterly,Article,CHILD
"Case, C.J., Young, K.S.",Employee Internet management: Current business practices and outcomes,2002,Cyberpsychology and Behavior,Article,CHILD
"Lim, V.K.G.","The IT way of loafing on the job: Cyberloafing, neutralizing and organizational justice",2002,Journal of Organizational Behavior,Article,CHILD
"Mastrangelo, P.M., Everton, W., Jolton, J.A.",Personal use of work computers: Distraction versus destruction,2006,Cyberpsychology and Behavior,Conference Paper,CHILD
"Everton, W.J., Mastrangelo, P.M., Jolton, J.A.",Personality correlates of employees' personal use of work computers,2005,Cyberpsychology and Behavior,Article,CHILD
"Caplan, S.E.",Problematic Internet use and psychosocial well-being: Development of a theory-based cognitive-behavioral measurement instrument,2002,Computers in Human Behavior,Article,CHILD
"Davis, R.A., Flett, G.L., Besser, A.",Validation of a new scale for measuring problematic internet use: Implications for pre-employment screening,2002,Cyberpsychology and Behavior,Article,CHILD
"Young, K.S., Rogers, R.C.",The relationship between depression and internet addiction,1998,Cyberpsychology and Behavior,Article,CHILD
"Griffiths, M.",Does Internet and computer 'addiction' exist? Some case study evidence,2000,Cyberpsychology and Behavior,Article,CHILD
"Greenfield, D.N.",Psychological characteristics of compulsive internet use: A preliminary analysis,1999,Cyberpsychology and Behavior,Article,CHILD
"Sia, C.-L., Tan, B.C.Y., Wei, K.-K.","Group polarization and computer-mediated communication: Effects of communication cues, social presence, and anonymity",2002,Information Systems Research,Article,CHILD
"Sloane, P.",The temptations of the web,2002,Database and Network Journal,Article,CHILD
"Verespej, M.A.",New ruling target temps,2000,Industry Week,Article,CHILD
"Mahatanankoon, P., Anandarajan, M., Igbaria, M.",Development of a Measure of Personal Web Usage in the Workplace,2004,Cyberpsychology and Behavior,Article,CHILD
"Rousseau, D.M.",Psychological contracts in organizations: Understanding written and unwritten agreements,1995,Psychological Contracts in Organizations: Understanding Written and Unwritten Agreements,Article,CHILD
"Rousseau, D.M.",Psychological and implied contracts in organizations,1989,Employee Responsibilities and Rights Journal,Article,CHILD
"Guest, D.E.",Is the psychological contract worth taking seriously?,1998,Journal of Organizational Behavior,Article,CHILD
"Bordia, P., Restubog, S.L.D., Tang, R.L.",When Employees Strike Back: Investigating Mediating Mechanisms Between Psychological Contract Breach and Workplace Deviance,2008,Journal of Applied Psychology,Article,CHILD
"Pavlou, P.A., Gefen, D.","Psychological contract violation in online marketplaces: Antecedents, consequences, and moderating role",2005,Information Systems Research,Article,CHILD
"Anandarajan, M., Devine, P., Simmers, C.",A multidimensional scaling approach to personal Web usage in the workplace,2004,Information Science Publishing,Article,CHILD
"Behson, S.J.",The relative contribution of formal and informal organizational work-family support,2005,Journal of Vocational Behavior,Article,CHILD
"Frone, M.R., Yardley, J.K., Markel, K.S.",Developing and testing an integrative model of the work-family interface,1997,Journal of Vocational Behavior,Article,CHILD
"Valcour, P.M., Batt, R., Moen, P.",Work-life integration: Challenges and organizational responses,2003,It's about Time: Couples and Careers,Article,CHILD
"Sunoo, B.P.",This employee may be loafing,1996,Personnel Journal,Article,CHILD
"Lim, V.K.G., Teo, T.S.H., Loo, G.L.",How do I loaf here? Let me count the ways,2002,Communications of the ACM,Article,CHILD
"Arthur, M.B., Rousseau, D.M.",A career lexicon for the 21st century,1996,Academy of Management Executive,Article,CHILD
"Holt, K., Noe, R.A., Cavanaugh, M.",Managers' developmental responses to 360-degree feedback,1996,Presented at Annual Meeting of the Society for Feedback Process 35 Industrial and Organizational Psychology,Article,CHILD
"Tracey, J.B., Tannenbaum, S.I., Kavanagh, M.J.",Applying Trained Skills on the Job: The Importance of the Work Environment,1995,Journal of Applied Psychology,Article,CHILD
"Belanger, F., Van Slyke, C.",Abuse or learning?,2002,Communications of the ACM,Article,CHILD
"Carmeli, A.",Work commitment and employees' misuse of the internet in the workplace,2014,The Internet and Workplace Transformation,Book Chapter,CHILD
"Moorman, R.H., Blakely, G.L.",Individualism‐collectivism as an individual difference predictor of organizational citizenship behavior,1995,Journal of Organizational Behavior,Article,CHILD
"Anandarajan, M., Simmers, C.",Constructive and dysfunctional personal web usage in the workplace: Mapping employee attitudes,2004,Personal Web Usage in the Workplace A Guide to Effective Human Resources Management,Article,CHILD
"Kruskal, J.B., Wish, M.",Multidimensional scaling,1978,Multidimensional Scaling,Article,CHILD
"Aldenderfer, M.S., Blashfield, R.K.",Cluster analysis,1984,Cluster Analysis,Article,CHILD
"Punj, G., Stewart, D.W.",Cluster analysis in marketing research: Review and suggestions for application,1983,Journal of Marketing Research,Article,CHILD
"Levering, R., Moskowitz, M.",The 100 best companies to work for,2000,Fortune,Article,CHILD
"Moberg, D.J.",On employee vice,1997,Business Ethics Quarterly,Article,CHILD
"Vardi, Y., Wiener, Y.",Misbehavior in Organizations: A Motivational Framework,1996,Organization Science,Article,CHILD
"London, M., Smither, J.W.",Empowered self-development and continuous learning,1999,Human Resource Management,Article,CHILD
"Axtell, C.M., Holman, D.J., Unsworth, K.L., Wall, T.D., Waterson, P.E., Harrington, E.",Shopfloor innovation: Facilitating the suggestion and implementation of ideas,2000,Journal of Occupational and Organizational Psychology,Article,CHILD
"Chen, J.V., Chen, C.C., Yang, H.-H.",An empirical evaluation of key factors contributing to internet abuse in the workplace,2008,Industrial Management and Data Systems,Article,CHILD
"Eastin, M.S., Glynn, C.J., Griffiths, R.P.",Psychology of communication technology use in the workplace,2007,Cyberpsychology and Behavior,Article,CHILD
"Gelbard, R., Carmeli, A., Bittmann, R.M., Ronen, S.(S.)",Cluster analysis using multi-algorithm voting in cross-cultural studies,2009,Expert Systems with Applications,Article,CHILD
Reference Count: 46,,,,,
,,,,,
"Vitak J., Crouse J., Larose R.",Personal Internet use at work: Understanding cyberslacking,2011,Computers in Human Behavior,Conference Paper,PARENT
"Ajzen, I.",The theory of planned behavior,1991,Organizational Behavior and Human Decision Processes,Article,CHILD
"Blanchard, A.L., Henle, C.A.",Correlates of different forms of cyberloafing: The role of norms and external locus of control,2008,Computers in Human Behavior,Article,CHILD
"Bock, G.-W., Ho, S.L.",Non-work related computing (NWRC),2009,Communications of the ACM,Article,CHILD
"Chang, M.K., Cheung, W.",Determinants of the intention to use Internet/WWW at work: A confirmatory study,2001,Information and Management,Article,CHILD
"Chen, J.V., Chen, C.C., Yang, H.-H.",An empirical evaluation of key factors contributing to internet abuse in the workplace,2008,Industrial Management and Data Systems,Article,CHILD
"Cooper, A., Safir, M.P., Rosenmann, A.",Workplace worries: A preliminary look at online sexual activities at the office - Emerging issues for clinicians and employers,2006,Cyberpsychology and Behavior,Article,CHILD
"Day, M.G., Gehringer, E.F.","Educators and pornography: The """"unacceptable use"""" of school computers",2002,International Symposium on Technology and Society,Conference Paper,CHILD
"Eastin, M.S., Glynn, C.J., Griffiths, R.P.",Psychology of communication technology use in the workplace,2007,Cyberpsychology and Behavior,Article,CHILD
"Garrett, R.K., Danziger, J.N.",Disaffection or expected outcomes: Understanding personal Internet use during work,2008,Journal of Computer-Mediated Communication,Article,CHILD
"Garrett, R.K., Danziger, J.N.",On cyberslacking: Workplace status and personal Internet use at work,2008,Cyberpsychology and Behavior,Article,CHILD
"Greenfield, D.N., Davis, R.A.",Lost in cyberspace: The web @ work,2002,Cyberpsychology and Behavior,Article,CHILD
"Johnson, P.R., Indvik, J.",The organizational benefits of reducing cyberslacking in the workplace,2004,"Journal of Organizational Culture, Communications, and Conflict",Article,CHILD
"LaRose, R.","Cybercompulsions: Media habits, media addictions and the Internet",2004,Impact and Issues in New Media: Toward Intelligent Societies,Article,CHILD
"LaRose, R.",The problem of media habits,2010,Communication Theory,Article,CHILD
"LaRose, R., Eastin, M.S.",A social cognitive theory of Internet uses and gratifications: Toward a new model of media attendance,2004,Journal of Broadcasting &amp; Electronic Media,Article,CHILD
"Larose, R., Kim, J.H., Peng, W.","Social networking: Addictive, compulsive, problematic, or just another media habit?",2010,"A Networked Self: Identity, Community, and Culture on Social Network Sites",Article,CHILD
"Lavoie, J.A.A., Pychyl, T.A.","Cyberslacking and the procrastination superhighway: A web-based survey of online procrastination, attitudes, and emotion",2001,Social Science Computer Review,Article,CHILD
"Lim, V.K.G.","The IT way of loafing on the job: Cyberloafing, neutralizing and organizational justice",2002,Journal of Organizational Behavior,Article,CHILD
"Lim, V.K.G., Teo, T.S.H.","Prevalence, perceived seriousness, justification and regulation of cyberloafing in Singapore: An exploratory study",2005,Information and Management,Article,CHILD
"Lim, V.K.G., Teo, T.S.H., Loo, G.L.",How do I loaf here? Let me count the ways,2002,Communications of the ACM,Article,CHILD
"Madden, M.",The audience for online video-sharing sites shoots up,2009,The audience for online video-sharing sites shoots up,Article,CHILD
