Authors,Title,Year,Source title,Link,References,Document Type,Source
"Baby V.K., Reddy V.R.","How effective are the new wash security guidelines for india? an empirical case study of andhra pradesh",2013,"Water Policy","https://www.scopus.com/inward/record.uri?eid=2-s2.0-84884857460&doi=10.2166%2fwp.2013.147&partnerID=40&md5=1a0dafa660569e98656776ea62e3504e","Batchelor, C., Reddy, V.R., Linstead, C., Dhar, M., Roy, S., May, R., (2012) Do Water-Saving Technologies Improve Environmental Flows?, , Paper prepared for World Wildlife Fund, London, UK; Batchelor, C., Snehalatha, M., Batchelor, J., (2012) Skewed and Inequitable Access to Rural Water Supply, Sanitation and Hygiene Services: What are the Solutions to This Perennial Problem?, , Draft Paper, Centre for Economic and Social Studies, Hyderabad; Braithwaite, J., (2005) Markets in Vice, Markets in Virtue, , Oxford University Press, Oxford, UK; Deshpande, R.S., Reddy, V.R., Social dynamics and farmers' society:A case study of pani - panchayat (jointly) (1990) Indian Journal of Agricultural Economics, XLV. , July-September(3; Dharmadhikary, S., A flawed model for water regulation (2007) India Together, , http://www.indiatogether.org/2007/may/env-mwrra.htm, May 23; Fonseca, C., Franceys, R., Batchelor, C., McIntyre, P., Klutse, A., Komives, K., Moriarty, P., Snehalatha, M., (2011) Life-Cycle Costs Approach. Costing Sustainable Services, , Briefing Note 1, International Water and Sanitation Centre (IRC) International Water and Sanitation Centre, The Hague, The Netherlands; (2010) Strategic Plan 2010-2022, , GoI . Department of Drinking Water and Sanitation-Rural Drinking Water, Ministry of Rural Development, Government of India, New Delhi; (2010) Rajiv Gandhi National Drinking Water Mission - Movement towards Ensuring People's Drinking Water Security in Rural India - Framework for Implementation 2009-2013, , GoI . Department of Drinking Water Supply, Ministry of Rural Development, Government of India, New Delhi; (2010) A Hand Book for Gram Panchayats: To Help Them Plan, Implement, Operate, Maintain and Manage Drinking Water Security, , GoI . Department of Rural Drinking Water, Ministry of Rural Development, Government of India and Water and Sanitation Programme, The World Bank, New Delhi; (2011) Population Census 2011, , GoI . Department of Census, Government of India, New Delhi; (2011) Report of the Working Group on Rural Domestic Water and Sanitation - Twelfth Five Year Plan (2012-2017), , GoI . Ministry of Drinking Water and Sanitation, Government of India, New Delhi, September; (2012) Background Note and Agenda for Conference of State Ministers and State Secretaries In-charge of Rural Water Supply and Rural Sanitation, Ministry of Drinking Water and Sanitation, , GoI ., Hall No. 4, Vigyan Bhawan 24-25 May 2012, New Delhi; Kumar, D., (2010) Managing Water in River Basins - Hydrology, Economics and Institutions, , Oxford University Press, Oxford, UK; Kurian, P.K., Baby, V.K., Thomas, T., (2012) Decentralized Governance and Sustainable Service Delivery:A Case of Nenmeni Rural Water Supply Scheme, Kerala, India, in Sustainable Water and Sanitation Services: The Life-cycle Costs Approach to Planning and Management in India (Forthcoming), , Draft Paper, WASHCost Project, Centre for Economic and Social Studies, Hyderabad; Moriarty, P., Batchelor, C., Fonseca, C., Klutse, A., Naafs, A., Nyarko, K., Pezon, C., Snehalatha, M., (2010) Ladders for Assessing and Costing Water Service Delivery, , WASHCost Working Paper 2. International Water and Sanitation Centre (IRC), The Hague, The Netherlands; Ramachandrudu, M.V., Fanaian, S., Subramanyam, N.R., (2012) Transparency, Accountability and Participation (TAP): Understanding Governance in Rural WASH Sector, , Draft Paper, WASHCost Project Centre for Economic and Social Studies, Hyderabad; Reddy, V.R., (2009) Water Security: Ecological Imperatives and Policy Initiatives, , Academic Foundation, New Delhi; Reddy, V.R., Hydrological externalities and livelihoods impacts: Informed communities for better resource management (2012) Journal of Hydrology, pp. 412-413. , 279-290; Reddy, V.R., Jayakumar, N., Venkataswamy, M., Snehalatha, M., (2011) Cost of Provision: How Good are Unconditional Allocations? A Study of Water Services Delivery in Rural Andhra Pradesh, India, , Briefing Note 3, Centre for Economic and Social Studies, Hyderabad; Reddy, V.R., Snehalatha, M., Venkataswamy, M., (2012) Costs and Service per Technology in Rural Water Supply: How Efficient are Multi Village Schemes? Briefing Note 4, Centre for Economic and Social Studies, , Hyderabad; Saleth, M., Dinar, A., (2004) The Institutional Economics of Water:A Cross Country Analysis of Institutions and Performance, , Edward Elgar, a Co-publication with The World Bank, UK; Van Koppan, B., Moriarty, P., Boelee, E., (2006) Multiple-Use Water Services to Advance the Millennium Development Goals, , International Water Management Institute (IWMI), Research Report 098, Colombo, Sri Lanka; (2010) A Decade of Total Sanitation Campaign: Rapid Assessment of Processes and Outcomes, Vol.1, , WSP (Water and Sanitation Program) . Water and Sanitation Program (WSP), The World Bank, New Delhi",Article,Scopus
"Li H., Zhang J., Sarathy R.","Understanding compliance with internet use policy from the perspective of rational choice theory",2010,"Decision Support Systems","https://www.scopus.com/inward/record.uri?eid=2-s2.0-75349090403&doi=10.1016%2fj.dss.2009.12.005&partnerID=40&md5=ff2a0cd585248ae8090b7170a5291671","Abdur-Razzaq, B.M., Boom times (2002) PC Magazine, 1 (30); Amabile, T.M., How to kill creativity (1998) Harvard Business Review, 76 (5); Bachman, R., Paternoster, R., Ward, S., The rationality of sexual offending: testing a deterrence/rational choice conception of sexual assault (1992) Law & Society Review, 26 (2); Bagozzi, R.P., Yi, Y., On the evaluation of structural equation models (1988) Journal of the Academy of Marketing Science, 16 (1); Becker, G.S., Crime and punishment: an economic approach (1968) Journal of Political Economy, 76 (2); Bollen, K., Lennox, R., Conventional wisdom on measurement: a structural equation perspective (1991) Psychological Bulletin, 110 (2); Chan, M., Woon, I., Kankanhalli, A., Perceptions of information security at the workplace: linking information security climate to compliant behavior (2005) Journal of Information Privacy and Security, 1 (3); Chan, M., Woon, I., Kankanhalli, A., Perceptions of information security in the workplace: linking information security climate to compliant behavior (2005) Journal of Information Privacy and Security, 1 (3); Chin, W.W., Issues and opinions on structural equation modeling (1998) MIS Quarterly, 22 (1); Chin, W.W., Marcolin, B.L., Newsted, P.R., A partial least squares latent variable modeling approach for measuring interaction effects: results from a Monte Carlo simulation study and an electronic mail adoption study (2003) Information Systems Research, 14 (2); Chiricos, T.G., Waldo, G.P., Punishment and crime: an examination of some empirical evidence (1970) Social Problems, 18 (2); Cohen, J., (1988) Statistical power analysis for the behavior sciences, , Lawrence Erlbaum, Hillsdale, NJ; Dhillon, G., Backhouse, J., Current directions in IS security research: towards socio-organizational perspectives (2001) Information Systems Journal, 11 (2); Diamantopoulos, A., Winklhofer, H.M., Index construction with formative indicators: an alternative to scale development (2001) Jounal of Marketing Research, 38 (2); Dubin, J., Wilde, L., An empirical analysis of federal income tax auditing and compliance (1988) National Tax Journal, 16 (1); Dutton, J.E., Dukerich, J.M., Harquail, C.V., Organizational images and member identification (1994) Administrative Science Quarterly, 39 (2); Fishbein, M., Ajzen, I., (1975) Belief attitude, intention, and behavior: an introduction to theory and research, , Addison-Wesley, Reading, MA; Fornell, C., Larcker, D., Evaluating structural equation models with unobservable variables and measurement error (1981) Journal of Marketing Research, 18 (1); Foster, M., (2006) Help your employees avoid the dangers of Internet misuse, , www.FosterInstitute.com, June 18; Gautam, T., Dick, R.V., Wagner, U., Organizational identification and organizational commitment: distinct aspects of two related concepts (2004) Asian Journal of Social Psychology, 7 (3); Gefen, D., Straub, D., A practical guide to factorial validity using PLS-Graph: tutorial and annotated example (2005) Communications of the AIS, 16 (5); Herath, T., Rao, H.R., Encouraging information security behaviors in organizations: Role of penalties, pressures and perceived effectiveness (2009) Decision Support Systems, 47 (2). , doi: 10.1016/j.dss.2009.02.005; Herath, T., Rao, H.R., Protection motivation and deterrence: a framework for security policy compliance in organizations (2009) European Journal of Information Systems, 18 (2); Kelman, H.C., Compliance, identification, and internalization: three processes of attitude change (1958) Journal of Conflict Resolution, 2 (1); Lau, V.C.S., Au, W.T., Ho, J.M.C., A qualitative and quantitative review of antecedents of counterproductive behavior in organizations (2003) Journal of Business and Psychology, 18 (1); Lim, V.K.G., The IT way of loafing on the job: cyberloafing, neutralizing and organizational justice (2002) Journal of Organizational Behavior, 23 (5); Limayem, M., Khalifa, M., Chin, W.W., Factors motivating software piracy: a longitudinal study (1999) Proceedings of the International Conference on Information Systems, North Carolina, United States; Mathieson, K., Peacock, E., Chin, W.W., Extending the technology acceptance model: the influence of perceived user resources (2001) Database for Advances in Information Systems, 32 (3); May, P.J., Regulation and compliance motivations: examining different approaches (2005) Public Administration Review, 65 (1); Murphy, K., Enforcing tax compliance: to punish or persuade? (2008) Economic Analysis & Policy, 38 (1); Pahnila, S., Siponen, M., Mahmood, A., Employees' behavior toward IS security policy compliance (2007) 40th Hawaii International Conference on System Sciences, Hawaii; Paternoster, R., Simpson, S., Sanction threats and appeals to morality: testing a rational choice model of corporate crime (1996) Law & Society Review, 30 (3); Pavlou, P.A., Sawy, O.A.E., From IT leveraging competence to competitive advantage in turbulent environments: the case of new product development (2006) Information Systems Research, 17 (3); Peace, A.G., Galletta, D., Thong, J., Software piracy in the workplace: a model and empirical test (2003) Journal of Management Information Systems, 20 (1); Pee, L.G., Woon, I.M.Y., Kankanhalli, A., Explaining non-work-related computing in the workplace: a comparison of alternative models (2008) Information & Management, 45 (2); Piquero, N.L., Exum, M.L., Simpson, S.S., Integrating the desire-for-control and rational choice in a corporate crime context (2005) Justice Quarterly, 22 (2); Preacher, K.J., Curran, P.J., Bauer, D.J., (2003) Probing interactions in multiple linear regression, latent curve analysis, and hierarchical linear modeling Interactive calculation tools for establishing simple intercepts, simple slopes, and regions of significance, , http://www.psych.ku.edu/preacher/interact/index.html, (Last accessed in March, 2007) http://www.psych.ku.edu/preacher/interact/index.html; Rhee, H.-S., Ryu, Y.U., Kim, C.-T., Twenty-Sixth International Conference on Information Systems, I am fine but you are not: optimistic bias and illusion of control on information security (2005) Twenty-Sixth International Conference on Information Systems, (Las Vegas (Nevada), United States, 2005); D. Schweitzer, Workplace Web use: Give 'em an inch.... (2004). 2009 (February 15) http://www.searchsap.techtarget.com/news/article/0, 289142, sid21_gci1009417, 00.html#; Siponen, M., Pahnila, S., Mahmood, A., Factors influencing protection motivation and IS security policy compliance (2006) Innovations in Information Technology 2006; Smith, K.W., Integrating three perspectives on noncompliance: a sequential decision model (1990) Criminal Justice and Behavior, 17 (3); Sophos, (2008) Sophos security report, , http://www.rsaconference.com/uploadedFiles/RSA365/Security_Topics/Hackers_and_Threats/White_Papers/Sophos/sophos-security-report-08.pdf, June 17; Tyler, T.R., Callahan, P.E., Frost, J., Armed, and dangerous (?): motivating rule adherence among agents of social control (2007) Law & Society Review, 41 (2); (2008) Vault.com, Internet use in the workplace survey results, (2005), , http://www.vault.com/surveys, June 21 internetusesurvey/home.jsp; Venkatesh, V., Davis, F.D., A theoretical extension of the technology acceptance model: four longitudinal field studies (2000) Management Science, 46 (2); Venkatesh, V., Morris, M.G., Davis, G.B., Davis, F.D., User acceptance of information technology: toward a unified view (2003) MIS Quarterly, 27 (3); I. Websense, Blue Monday draws high employee traffic to shopping websites during work day, (2004). 2008 (June 25) http://www.websense.com/global/en/PressRoom/PressReleases/PressReleaseDetail/?Release=041201792; Wenzel, M., An analysis of norm processes in tax compliance (2004) Journal of Economic Psychology, 25 (2); Wenzel, M., The social side of sanctions: personal and social norms as moderators of deterrence (2004) Law and Human Behavior, 28 (5); Woon, I.M.Y., Tan, G.W., Low, R.T., A protection motivatoin theory approach to home wireless security (2005) Proceedings of the Twenty-Sixth International Conference on Information Systems, Las Vegas; Young, K.S., Case, C.J., Internet abuse in the workplace: new trends in risk management (2004) Cyberpsychology & Behavior, 7 (1)",Article,Scopus
