Author,Title,Year,Source Title,Document Type,FAMILY_TYPE
"Reed R., DeFillippi R.J.","Causal ambiguity, barriers to imitation, and sustainable competitive advantage",1990,Academy of Management Review,,CHILD
Robinson W.T.,Sources of market pioneer advantages: The case of industrial goods industries,1988,Journal of Marketing Research,,CHILD
"Robinson W.T., Fornell C.",Sources of market pioneer advantages in consumer goods industries,1985,Journal of Marketing Research,,CHILD
Rumelt R.P.,Towards a strategic theory of the firm,1984,Competitive Strategic Management,,CHILD
Rumelt R.P.,"Theory, strategy, and entrepreneurship",1987,The Competitive Challenge,,CHILD
Schmalensee R.,Product differentiation advantages of pioneering brands,1982,American Economic Review,,CHILD
Sims C.A.,"Money, income and causality",1972,American Economic Review,,CHILD
"Sirri E.R., Tufano P.",Competition and change in the mutual fund industry,1993,Financial Services: Perspectives and Challenges,,CHILD
Tufano P.,Financial innovation and first-mover advantages,1989,Journal of Financial Economics,Article,CHILD
"Urban Glen L., Carter Theresa, Gaskin Steven, Mucha Zofia",MARKET SHARE REWARDS TO PIONEERING BRANDS: AN EMPIRICAL ANALYSIS AND STRATEGIC IMPLICATIONS.,1986,Management Science,Article,CHILD
VAN HORNE J.C.,Of Financial Innovations and Excesses,1985,The Journal of Finance,Article,CHILD
Wernerfelt B.,A resource‐based view of the firm,1984,Strategic Management Journal,Article,CHILD
Wernerfelt B.,Brand loyalty and market equilibrium,1991,Marketing Science,,CHILD
Williams J.R.,How Sustainable is Your Competitive Advantage?,1992,California Management Review,Article,CHILD
Reference Count: 41,,,,,
,,,,,
"Powell T.C., Dent-Micallef A.","Information technology as competitive advantage: The role of human, business, and technology resources",1997,Strategic Management Journal,Article,PARENT
"Bakos J.Y., Treacy M.E.",Information technology and corporate strategy: A research perspective,1986,MIS Quarterly: Management Information Systems,Article,CHILD
"Banker R.D., Kauffman R.J.",Strategic contributions of information technology: An empirical study of ATM networks,1988,Proceedings of the Ninth International Conference on Information Systems,,CHILD
Barley S.R.,The alignment of technology and structure through roles and networks.,1990,Administrative science quarterly,Review,CHILD
Barney J.B.,Organizational culture: Can it be a source of sustained competitive advantage?,1986,Academy of Management Review,,CHILD
Barney J.B.,"Strategic factor markets: Expectations, luck, and business strategy",1986,Management Science,,CHILD
Barney J.,Firm Resources and Sustained Competitive Advantage,1991,Journal of Management,Article,CHILD
"Beath C.M., Ives B.",Competitive information systems in support of pricing,1986,MIS Quarterly,,CHILD
"Benjamin R.I., Levinson E.",A framework for managing IT-enabled change,1993,Sloan Management Review,,CHILD
"Benjamin Robert I., Rockart John F., Scott Morton Michael S., Wyman John",INFORMATION TECHNOLOGY: A STRATEGIC OPPORTUNITY.,1984,Sloan management review,Article,CHILD
"Black J.A., Boal K.B.","Strategic resources: Traits, configurations and paths to sustainable competitive advantage",1994,Strategic Management Journal,Article,CHILD
Boar B.,Information technology and business alignment: A strategic assessment,1994,Handbook of Business Strategy,,CHILD
"Bourgeois L.J., III",Performance and consensus,1980,Strategic Management Journal,Article,CHILD
"Broderick R., Boudreau J.W.","Human resource management, information technology, and the competitive edge",1992,Academy of Management Executive,,CHILD
Buday R.,Sabre gives the edge to American Airlines,1986,Information Week,,CHILD
Carroll G.R.,A sociological view on why firms differ,1993,Strategic Management Journal,Article,CHILD
"Cash J.I., Konsynski B.R.",IS redraws competitive boundaries,1985,Harvard Business Review,,CHILD
"Child J., Mansfield R.","Technology, Size, and Organization Structure",1972,Sociology,Article,CHILD
Clemons E.K.,Information systems for sustainable competitive advantage,1986,Information and Management,Article,CHILD
Clemons E.,Strategic necessities,1988,Computer World,,CHILD
"Clemons E.K., Row M.C.",Sustaining IT advantage: The role of structural differences,1991,MIS Quarterly: Management Information Systems,Article,CHILD
"Clemons E.K., Row M.C.",Information power and the control of the distribution channel,1993,Chief Executive,,CHILD
"Cool K., Dierickx I.","Rivalry, strategic groups and firm profitability",1993,Strategic Management Journal,Article,CHILD
Cronbach L.J.,Coefficient alpha and the internal structure of tests,1951,Psychometrika,Article,CHILD
Davenport T.H.,Saving IT's soul: Human-centered information management,1994,Harvard Business Review,,CHILD
Dess G.,Consensus in the strategy formulation process and firm performance,1983,Academy of Management Proceedings,,CHILD
Dess G.G.,Consensus on strategy formulation and organizational performance: Competitors in a fragmented industry,1987,Strategic Management Journal,Article,CHILD
"Dess G.G., Origer N.K.","Environment, structure, and consensus in strategy formulation: A conceptual integration",1987,Academy of Management Review,,CHILD
"DeWoot P., Heyvaert H., Martou F.",Strategic management: An empirical study of 168 Belgian firms,1977,International Studies of Management and Organization,,CHILD
"Dierickx I., Cool K.",Asset stock accumulation and sustainability of competitive advantage,1989,Management Science,,CHILD
Eisenhardt K.M.,Agency theory: An assessment and review,1989,Academy of Management Review,,CHILD
"Emery F.E., Trist E.L.",The Causal Texture of Organizational Environments,1965,Human Relations,Article,CHILD
"Floyd S.W., Wooldridge B.","Path analysis of the relationship between competitive strategy, information technology, and financial performance",1990,Journal of Management Information Systems,Article,CHILD
"Ginsberg A., Venkatraman N.",Investing in new information technology: The role of competitive posture and issue diagnosis,1992,Strategic Management Journal,Article,CHILD
Gleckman H.,The technology payoff,1993,Business Week,,CHILD
Gomez‐Mejia L.R.,"Structure and process of diversification, compensation strategy, and firm performance",1992,Strategic Management Journal,Article,CHILD
"Hambrick D.C., Geletkanycz M.A., Fredrickson J.W.",Top executive commitment to the status quo: Some tests of its determinants,1993,Strategic Management Journal,Article,CHILD
"Hannan M.T., Freeman J.",Structural inertia and organizational change,1984,American Sociological Review,,CHILD
"Henderson J.C., Venkatraman N.",Strategic alignment: leveraging information technology for transforming organizations,1993,IBM Systems Journal,Article,CHILD
"Holland C., Lockett G., Blackman I.",Planning for electronic data interchange,1992,Strategic Management Journal,Article,CHILD
Huber G.P.,"A theory of the effects of advanced information technologies on organizational design, intelligence, and decision making",1990,Academy of Management Review,,CHILD
"Jensen M.C., Meckling W.H.","Theory of the firm: Managerial behavior, agency costs and ownership structure",1976,Journal of Financial Economics,Article,CHILD
Moss Kanter Rosabeth,INNOVATION - THE ONLY HOPE FOR TIMES AHEAD?,1984,Sloan management review,Article,CHILD
Keen P.G.W.,Information technology and the management difference: a fusion map,1993,IBM Systems Journal,Article,CHILD
Keidel R.W.,Rethinking organizational design,1994,Academy of Management Executive,,CHILD
"Kettinger W.J., Grover V., Guha S., Segars A.H.",Strategic information systems revisited: A study in sustainability and performance,1994,MIS Quarterly: Management Information Systems,Article,CHILD
King W.R.,Strategic planning for management information systems,1978,MIS Quarterly,,CHILD
King William R.,EXPLOITING INFORMATION AS A STRATEGIC BUSINESS RESOURCE.,1984,International Journal on Policy and Information,Article,CHILD
"Klein B., Crawford R.G., Alchian A.A.","Vertical integration, appropriable rents, and the competitive contracting process",1978,Journal of Law and Economics,,CHILD
"Lieberman M.B., Montgomery D.B.",First‐mover advantages,1988,Strategic Management Journal,Article,CHILD
Magnet M.,Good news for the service economy,1993,Fortune,,CHILD
"Mahmood M.A., Soon S.K.",A Comprehensive Model for Measuring the Potential Impact of Information Technology on Organizational Strategic Variables,1991,Decision Sciences,Article,CHILD
"Mahoney J.T., Pandian J.R.",The resource‐based view within the conversation of strategic management,1992,Strategic Management Journal,Article,CHILD
"Maidique Modesto A., Hayes Robert H.",ART OF HIGH-TECHNOLOGY MANAGEMENT.,1984,Sloan management review,Article,CHILD
"Malone T.W., Yates J., Benjamin R.I.",Electronic markets and electronic hierarchies,1987,Communications of the ACM,Article,CHILD
"McCann J., Galbraith J.R.",Interdepartmental relations,1981,Handbook of Organizational Design,,CHILD
"Miller C.C., Cardinal L.B.",Strategic planning and firm performance: A synthesis of more than two decades of research,1994,Academy of Management Journal,,CHILD
Neo B.S.,Factors facilitating the use of Information Technology for competitive advantage: An exploratory study,1988,Information and Management,Article,CHILD
"Orlikowski W.J., Gash D.C.",Changing Frames: Understanding Technological Change in Organizations,1992,Changing Frames: Understanding Technological Change in Organizations,,CHILD
Parsons Gregory L.,INFORMATION TECHNOLOGY: A NEW COMPETITIVE WEAPON.,1983,Sloan management review,Article,CHILD
Peteraf M.A.,The cornerstones of competitive advantage: A resource‐based view,1993,Strategic Management Journal,Article,CHILD
Pettigrew A.M.,The politics of organizational decision making,1973,The Politics of Organizational Decision Making,,CHILD
Pfeffer J.,Producing sustainable competitive advantage through the effective management of people,1995,Academy of Management Executive,,CHILD
"Porter M.E., Millar V.E.",How information gives you competitive advantage,1985,Harvard Business Review,,CHILD
Powell T.C.,Organizational alignment as competitive advantage,1992,Strategic Management Journal,Article,CHILD
Powell T.,When lemmings learn to sail: Turning TQM to competitive advantage,2019,1995 Handbook of Business Strategy,,CHILD
Powell T.C.,Total quality management as competitive advantage: A review and empirical study,1995,Strategic Management Journal,Article,CHILD
Rumelt R.P.,How much does industry matter?,1991,Strategic Management Journal,Article,CHILD
Quinn James Brian,"TECHNOLOGICAL INNOVATION, ENTREPRENEURSHIP, AND STRATEGY.",1979,Sloan Management Review,,CHILD
"Quinn J.B., Baily M.N.",Information technology: Increasing productivity in services,1994,Academy of Management Executive,,CHILD
"Reed R., DeFillippi R.J.","Causal ambiguity, barriers to imitation, and sustainable competitive advantage",1990,Academy of Management Review,,CHILD
[No author name available],Change at the check-out,1995,The Economist,,CHILD
Robins J.A.,Organizational economics: Notes on the use of transaction-cost theory in the study of organizations,1987,Administrative Science Quarterly,,CHILD
Rockart J.F.,Chief executives define their own data needs.,1979,Harvard Business Review,Article,CHILD
"Rockart J.F., Short J.E.",IT in the 1990s: Managing organizational interdependence,1989,Sloan Management Review,,CHILD
Rumelt R.P.,"Theory, strategy, and entrepreneurship",1987,The Competitive Challenge,,CHILD
"Singh J.V., House R.J., Tucker D.J.",Organizational change and organizational mortality,1986,Administrative Science Quarterly,,CHILD
"Smith M., White M.C.","Strategy, CEO specialization, and succession",1987,Administrative Science Quarterly,,CHILD
Teece D.J.,Economies of scope and the scope of the enterprise,1980,Journal of Economic Behavior and Organization,Article,CHILD
Teece D.J.,"Profiting from technological innovation: Implications for integration, collaboration, licensing and public policy",1987,The Competitive Challenge,,CHILD
Teece D.J.,Contributions and impediments of economic analysis to the study of strategic management,1990,Perspectives on Strategic Management,,CHILD
"Walton R.E., Dutton J.M.",The management of interdepartmental conflict: A model and review,1969,Administrative Science Quarterly,,CHILD
Winter S.G.,Knowledge and competence as strategic assets,1987,The Competitive Challenge,,CHILD
Wiseman C.,Strategic vision,1985,Computer-world,,CHILD
Woodward J.,Industrial organization,1965,Industrial Organization,,CHILD
"Zahra S.A., Covin J.G.","Business strategy, technology policy and firm performance",1993,Strategic Management Journal,Article,CHILD
Zinn L.,Retailing will never be the same,1993,Business Week,,CHILD
Reference Count: 86,,,,,
,,,,,
"Hart P., Saunders C.",Power and Trust: Critical Factors in the Adoption and Use of Electronic Data Interchange,1997,Organization Science,Article,PARENT
Arrow K.J.,Information and Economic Behavior,1973,Information and Economic Behavior,,CHILD
"Bakos J.Y., Brynjolfsson E.","Information technology, incentives, and the optimal number of suppliers",1993,Journal of Management Information Systems,Article,CHILD
"Bakos J.Y., Brynjolfsson E.",From vendors to partners: Information technology and incomplete contracts in buyer-supplier relationships,1993,Journal of Organizational Computing,,CHILD
"Barrett S., Konsynski B.",Inter-organization information sharing systems,1982,MIS Quarterly,,CHILD
Bell L.A.,"TDCC Changes Its Name to EDIA, Expands Scope Beyond Transportation",1990,Traffic World,,CHILD
Bonoma T.V.,"Conflict, cooperation and trust in three power systems",1976,Behavioral Science,Article,CHILD
Burrows P.,EDI: Still awaiting take-off but already flying high,1990,Electronic Business,,CHILD
Cartwright D.,"Influence, leadership, control",1965,Handbook of Organizations,,CHILD
"Cash J.I., Konsynski B.R.",IS redraws competitive boundaries,1985,Harvard Business Review,,CHILD
"Clemons E.K., McFarlan F.W.",Telecom: Hook up or lose out,1986,Harvard Business Review,,CHILD
"Clemons Eric K., Row Michael C.",Information technology and industrial cooperation,1992,Proceedings of the Hawaii International Conference on System Science,Conference Paper,CHILD
Dahl R.A.,The concept of power,1957,Behavioral Science,,CHILD
Dearing B.,The Strategic Benefits of EDI,1990,Journal of Business Strategy,Review,CHILD
Donaldson L.,The ethereal hand: Organizational economics and management theory,1990,Academy of Management Review,,CHILD
Downs A.,A realistic look at the final payoffs from urban data systems,1967,Public Administration Review,,CHILD
Earl M.J.,Information systems strategy formulation,1987,Critical Issues in Information Systems Research,,CHILD
Eckerson W.,Companies Strive to Consolidate EDI Nets,1991,Network World,,CHILD
Emerson R.M.,Power-dependence relations,1962,American Sociological Review,,CHILD
Emshwiller J.R.,Suppliers struggle to improve quality as big firms slash their vendor rolls,1991,Wall Street Journal,,CHILD
"Feldman M.S., March J.G.",Information in organizations as signal and symbol,1981,Administrative Science Quarterly,,CHILD
Fitzgerald M.,"Sears puts foot down, insists on EDI ability",1990,Computerworld,,CHILD
Frye C.,"EDI Beginning to Stretch National, Business Bound",1992,Software Magazine,,CHILD
Galbraith J.R.,Organization design,1977,Organization Design,,CHILD
Gaski J.F.,The theory of power and conflict in channels of distribution,1984,Journal of Marketing,,CHILD
"Gaski J.F., Nevin J.R.",The differential effects of exercised and unexercised power sources in a marketing channel,1985,Journal of Marketing Research,,CHILD
Gouldner A.W.,Reciprocity and autonomy in functional theory,1959,Symposium on Sociological Theory,,CHILD
Griesinger D.W.,The human side of economic organization,1990,Academy of Management Review,,CHILD
Gulati R.,Does familiarity breed trust? The implications of repeated ties for contractual choice in alliances,1995,Academy of Management Journal,,CHILD
"Gurbaxani V., Shi E.",Computers and Coordination in Manufacturing,1992,Journal of Organizational Computing,,CHILD
"Hamel G., Doz Y.L., Prahalad C.K.",Collaborate with your competitors and win,1989,Harvard Business Review,,CHILD
"Hart P., Estrin D.","Inter-Organization Networks, Computer Integration, and Shifts in Interdependence: The Case of the Semiconductor Industry",1991,ACM Transactions on Information Systems (TOIS),Article,CHILD
Helper S.,How much has really changed between U.S. automakers and their suppliers?,1991,Sloan Management Review,,CHILD
Henderson J.C.,Plugging into strategic partnerships: The critical IS connection,1990,Sloan Management Review,,CHILD
Hill C.W.L.,"Cooperation, opportunism, and the invisible hand: Implications for transaction cost theory",1990,Academy of Management Review,,CHILD
Hill T.,Saving Time and Labor with Electronic Data Interchange,1987,PC Week,,CHILD
Hosmer L.T.,Trust: The connecting link between organizational theory and philosophical ethics,1995,Academy of Management Review,,CHILD
Keen P.G.W.,Shaping the future: Business design through information technology,1991,Shaping the Future: Business Design Through Information Technology,,CHILD
"Kochan T.A., Cummings L.L., Huber G.P.",Operationalizing the Concepts of Goals and Goal Incompatibilities in Organizational Behavior Research,1976,Human Relations,Article,CHILD
"Lei D., Slocum Jr. J.W.",Global strategic alliances: Payoffs and pitfalls,1991,Organizational Dynamics,Article,CHILD
"Lewis J.D., Weigert A.",Trust as a social reality,1985,Social Forces,Article,CHILD
"Lusch R.F., Brown J.R.",A modified model of power in the marketing channel,1982,Journal of Marketing Research,,CHILD
"Lyons T.F., Krachenberg A.R., Henke J.W.",Mixed motive marriages: What's next for buyer-supplier relations?,1990,Sloan Management Review,,CHILD
Malone Thomas W.,MODELING COORDINATION IN ORGANIZATIONS AND MARKETS.,1987,Management Science,Article,CHILD
"Malone Thomas W., Smith Stephen A.",MODELING THE PERFORMANCE OF ORGANIZATIONAL STRUCTURES.,1988,Operations Research,Article,CHILD
"Malone T.W., Yates J., Benjamin R.I.",Electronic markets and electronic hierarchies,1987,Communications of the ACM,Article,CHILD
McCusker T.,How to Get from 80 to 100% in EDI,1993,Datamation,,CHILD
"Meier J., Chismar W.G.",A formal model of the introduction of a vertical EDI system,1991,Proceedings of the Annual Hawaii International Conference on System Sciences,Conference Paper,CHILD
Mishra A.K.,Organizational responses to crisis: The centrality of trust,1996,Trust in Organizations: Frontiers of Theory and Research,,CHILD
Mohan S.,EDI's move to prime time stalled by cost perception,1995,Computerworld,,CHILD
"Nemetz P.L., Fry L.W.",Flexible manufacturing organizations: Implications for strategy formulation and organization design,1988,Academy of Management Review,,CHILD
"O'Callaghan R., Kaufmann P.J., Konsynski B.R.",Adoption correlates and share effects of electronic data interchange systems in marketing channels,1992,Journal of Marketing,,CHILD
Parsons Gregory L.,INFORMATION TECHNOLOGY: A NEW COMPETITIVE WEAPON.,1983,Sloan management review,Article,CHILD
Pfeffer J.,Power in organizations,1981,Power in Organizations,,CHILD
PONTING B.,EDI's Next Frontier: Sending Designs and Graphics Along with the Forms,1988,Data Commun.,,CHILD
"Porter M.E., Millar V.E.",How information gives you competitive advantage,1985,Harvard Business Review,,CHILD
"Provan K.G., Beyer J.M., Kruytbosch C.",Environmental linkages and power in resource-dependence relations between organizations,1980,Administrative Science Quarterly,,CHILD
"Provan K.G., Gassenheimer J.B.",SUPPLIER COMMITMENT IN RELATIONAL CONTRACT EXCHANGES WITH BUYERS: A STUDY OF INTERORGANIZATIONAL DEPENDENCE AND EXERCISED POWER*,1994,Journal of Management Studies,Article,CHILD
"Reve T., Stern L.W.","The relationship between interorganizational form, transaction climate, and economic performance in vertical interfirm dyads",1986,Marketing Channels: Relationships and Performance,,CHILD
"Ring P.S., Van De Ven A.H.",Developmental processes of cooperative interorganizational relationships,1994,Academy of Management Review,,CHILD
Swanson E.B.,Information systems in organization theory: A review,1987,Critical Issues in Information Systems Research,,CHILD
"Tushman M.L., Nadler D.A.",Information processing as an integrating concept in organizational design,1978,Academy of Management Review,,CHILD
"Venkatraman N., Zaheer A.",Electronic integration and strategic advantage: A quasi-experimental study in the insurance industry,1990,Information Systems Research,Article,CHILD
"Wang Eric T.G., Seidmann Abraham",Electronic data interchange: competitive externalities and strategic implementation policies,1995,Management Science,Article,CHILD
"Wilkinson I., Kipnis D.",Interfirm use of power,1978,Journal of Applied Psychology,Article,CHILD
Wrong D.H.,Some problems in defining social power,1968,American Journal of Sociology,,CHILD
Reference Count: 65,,,,,
,,,,,
"Monteiro L., Macdonald S.",From efficiency to flexibility: The strategic use of information in the airline industry,1996,Journal of Strategic Information Systems,Article,PARENT
Bleeke J.A.,Strategic choices for newly opened markets,1990,Harvard Business Review,,CHILD
[No author name available],Does the frequent flyer game pay off for airlines?,1984,Business Week,,CHILD
Caves R.E.,Air Transport and its Regulators,1962,Air Transport and Its Regulators: An Industry Study,,CHILD
"Davis S., Botkin J.",The coming of knowledge-based business,1994,Harvard Business Review,,CHILD
Drucker P.F.,The coming of the new organization,1988,Harvard Business Review,,CHILD
[No author name available],Survey of airlines: By the seats of their pants - The handful of dollars that will make or break the industry,1993,Economist,,CHILD
Egelhoff W.,Information processing theory and the multinational corporation,1993,Organization Theory and the Multinational Corporation,,CHILD
Feldman J.,Computer Reservation Systems (CRSs) in the USA,1987,Travel & Tourism Analyst,,CHILD
Forsgren M.,Foreign acquisitions: Internalization or network interdependency?,1989,Advances in International Marketing,,CHILD
[No author name available],Will the airlines and the corporations fight it out?,1986,Frequent Flyer,,CHILD
Guerin-Calvert M.E.,Vertical integration as a threat to competition: Airline computer reservation systems,1989,The Antitrust Revolution,,CHILD
Hopper M.D.,Rattling SABRE - New ways to compete on information,1990,Harvard Business Review,,CHILD
Humphreys B.,Frequent flyer programs,1991,Avmark Aviation Economist,,CHILD
"King W.R., Grover V., Hufnagel E.H.",Using information and information technology for sustainable competitive advantage: Some empirical evidence,1989,Information and Management,Article,CHILD
Lamberton D.M.,The information economy revisited,1994,Information and Communication in Economics,,CHILD
Lawless J.,King of the jet set,1989,Business,,CHILD
"Layer R., Reid D.R.",Have the frequent flyer programs defeated the purpose of deregulation and how much are they costing your firm?,1988,Business Travel Review,,CHILD
Levine M.E.,Is regulation necessary? California air transportation and national regulatory policy,1965,Yale Law Journal,,CHILD
Levine M.E.,"Airline competition in deregulated markets: Theory, firm strategy, and public policy",1987,Yale Journal on Regulation,,CHILD
Macdonald S.,Formal collaboration and informal information flow,1992,International Journal of Technology Management,,CHILD
Macdonald S.,Learning to change: An information perspective on learning in the organization,1995,Organization Science,,CHILD
"Meyer J.R., Oster C.V.",Airline Deregulation: The Early Experience,1981,Airline Deregulation: The Early Experience,,CHILD
[No author name available],New York Times,1988,New York Times,,CHILD
Pettigrew A.M.,Information Control as a Power Resource,1972,Sociology,Article,CHILD
Pettigrew A.M.,CONTEXT AND ACTION IN THE TRANSFORMATION OF THE FIRM,1987,Journal of Management Studies,Article,CHILD
Reference Count: 25,,,,,
,,,,,
Kotha S.,Mass customization: Implementing the emerging paradigm for competitive advantage,1995,Strategic Management Journal,Article,PARENT
Adler P.S.,Managing Flexible Automation,1988,California Management Review,Article,CHILD
Adler P.S.,Time-and-motion regained,1993,Harvard Business Review,,CHILD
Andrews K.R.,The concept of corporate strategy,1971,The Concept of Corporate Strategy,,CHILD
Bettis R.A.,Strategic management and the straightjacket: An editorial essay,1991,Organization Science,,CHILD
Garvin D.A.,Building a learning organization.,1993,Harvard business review,Article,CHILD
Gerwin Donald,Manufacturing flexibility. A strategic perspective,1993,Management Science,Article,CHILD
"Goldhar Joel D., Jelinek Mariann","COMPUTER INTEGRATED FLEXIBLE MANUFACTURING: ORGANIZATIONAL, ECONOMIC, AND STRATEGIC IMPLICATIONS.",1985,Interfaces,Article,CHILD
Hambrick D.C.,High profit strategies in mature capital goods industries: a contingency approach,1983,Academy of Management Journal,,CHILD
"Hayes R.H., Abernathy W.J.",Managing our way to economic decline,1980,Harvard Business Review,,CHILD
"Henderson R.M., Clark K.B.",Architectural innovation: The reconfiguration of existing product technologies and the failure of established firms,1990,Administrative Science Quarterly,,CHILD
Jaikumar R.,Postindustrial manufacturing,1986,Harvard Business Review,,CHILD
"Kogut B., Zander U.","Knowledge of the firm, combinative capabilities, and the replication of technology",1992,Organization Science,,CHILD
"Kotha S., Orne D.",Generic manufacturing strategies: A conceptual synthesis,1989,Strategic Management Journal,Article,CHILD
