Authors,Title,Year,Source title,Link,Document Type,Source
"Nunnally J.C.",[No title available],1978,"Psychometric Theory",,,Scopus
"Tabachnick B.G., Fidell L.S.",[No title available],1996,"Using Multivariate Statistics",,,Scopus
"Fornell C., Larcker D.F.","Evaluating structural equation models with unobservable variables and measurement error",1981,"Journal of Marketing Research",,,Scopus
"Ajzen I.","The theory of planned behavior",1991,"Organizational Behavior and Human Decision Processes","https://www.scopus.com/inward/record.uri?eid=2-s2.0-44949274046&doi=10.1016%2f0749-5978%2891%2990020-T&partnerID=40&md5=e27ee5041e0c00279f7c9c3291a3eb1d",Article,Scopus
"Bandura A.",[No title available],1986,"Social Foundations of Thought and Action: A Social Cognitive Theory",,,Scopus
"Fishbein M., Ajzen I.",[No title available],1975,"Belief, Attitude, Intention and Behavior: An Introduction to Theory and Research",,,Scopus
"Hofstede G.","Cultures and organizations: Software of the mind",1991,"Cultures and Organizations: Software of the Mind",,,Scopus
"Olson M.",[No title available],1965,"The Logic of Collective Action",,,Scopus
"Chin W.W.","The partial least squares approach to structural equation modeling",1998,"Modern Methods for Business Research",,,Scopus
"Merton R.K.",[No title available],1957,"Social Theory and Social Structure",,,Scopus
"Churchill G.A.","A paradigm for developing better measures of marketing constructs",1979,"Journal of Marketing Research",,,Scopus
"Nozick R.",[No title available],1977,"Anarchy, State and Utopia",,,Scopus
"Belsley D.A., Kuh E., Welsch R.E.",[No title available],1980,"Regression Diagnostics: Identifying Influential Data and Sources of Collinearity",,,Scopus
"MacIntyre A.",[No title available],1981,"After Virtue: A Study in Moral Theory",,,Scopus
"Homans G.C.",[No title available],1961,"Social Behavior: Its Elementary Forms",,,Scopus
"Mintzberg H.","The structuring of organizations",1979,"The Structuring of Organizations",,,Scopus
"Chin W.W.","Issues and opinion on structural equation modeling",1998,"MIS Quarterly: Management Information Systems","https://www.scopus.com/inward/record.uri?eid=2-s2.0-0002042337&partnerID=40&md5=4385da2ebfbe717f06324e00e6ab9a99",Review,Scopus
"Ajzen I., Fishbein M.","Attitude-behavior relations: A theoretical analysis and review of empirical research",1977,"Psychological Bulletin","https://www.scopus.com/inward/record.uri?eid=2-s2.0-33646391331&doi=10.1037%2f0033-2909.84.5.888&partnerID=40&md5=b1fb41a86962e0371c5a815913e94a3b",Article,Scopus
"Kohlberg L.","Stage and sequence: The cognitive-developmental approach to socialization",1969,"Handbook of Socialization Theory and Research",,,Scopus
"Varian H.R.",[No title available],1992,"Microeconomic Analysis",,,Scopus
"Cronbach L.J.",[No title available],1990,"Essentials of Psychological Testing",,,Scopus
"Shapiro C., Varian H.R.","Information rules: A strategic guide to the network economy",1999,"Information Rules: A Strategic Guide to the Network Economy",,,Scopus
"Sandel M.",[No title available],1982,"Liberalism and the Limits of Justice",,,Scopus
"Adams J.S.","Towards an understanding of inequity",1963,"Journal of Abnormal and Social Psychology","https://www.scopus.com/inward/record.uri?eid=2-s2.0-0001603538&doi=10.1037%2fh0040968&partnerID=40&md5=9fee6a0efab4987f082c33191b691059",Article,Scopus
"Jones T.M.","Ethical decision making by individuals in organizations: An issue-contingent model",1991,"Academy of Management Review",,,Scopus
"Ross W.D.",[No title available],1930,"The Right and the Good",,,Scopus
"Sidgwick H.",[No title available],1907,"The Methods of Ethics",,,Scopus
"Rest J.R.",[No title available],1986,"Moral Development: Advances in Research and Theory",,,Scopus
[No author name available],[No title available],2010,"The Economist",,,Scopus
"Thompson R.L., Higgins C.A., Howell J.M.","Personal computing: Toward a conceptual model of utilization",1991,"MIS Quarterly: Management Information Systems","https://www.scopus.com/inward/record.uri?eid=2-s2.0-38749129220&doi=10.2307%2f249443&partnerID=40&md5=a7a049d403c3c3026f5a98e45a66e55a",Article,Scopus
"Trevino L.K.","Ethical decision making in organizations: A person-situation interactionist model",1986,"Academy of Management Review",,,Scopus
"Rawls J.",[No title available],1972,"Theory of Justice",,,Scopus
"Hunt S.D., Vitell S.","A General Theory of Marketing Ethics",1986,"Journal of Macromarketing","https://www.scopus.com/inward/record.uri?eid=2-s2.0-84970109540&doi=10.1177%2f027614678600600103&partnerID=40&md5=cac8618c5dd277c2722ff72b05887a73",Article,Scopus
"Buchanan J.M.","An economic theory of clubs",1965,"Economica",,,Scopus
"Nunnally J.",[No title available],1967,"Psychometric Methods",,,Scopus
"Hare R.M.",[No title available],1952,"The Language of Morals",,,Scopus
"Markus M.L., Robey D.","Information technology and organizational change: Causal structure in theory and research",1988,"Management Science",,,Scopus
"Hume D.",[No title available],1975,"Enquiries Concerning Human Understanding and Concerning the Principles of Morals",,,Scopus
"Ehrlich I.","Participation in illegitimate activities: A theoretical and empirical investigation",1973,"Journal of Political Economy",,,Scopus
"Ferrell O.C., Gresham L.G.","A contingency framework for understanding ethical decision making in marketing",1985,"Journal of Marketing",,,Scopus
"Werts C.E., Linn R.L., Jöreskog K.G.","Interclass reliability estimates: Testing structural assumptions",1974,"Educational and Psychological Measurement",,,Scopus
"Crowne D.P., Marlowe D.","The approval motive",1964,"The Approval Motive",,,Scopus
"Deutsch M.","Distributive justice: A social-psychological perspective",1985,"Distributive Justice: A Social Psychological Perspective",,,Scopus
"Walster E., Berscheid E., Walster G.W.","New directions in equity research",1973,"Journal of Personality and Social Psychology","https://www.scopus.com/inward/record.uri?eid=2-s2.0-0000658968&doi=10.1037%2fh0033967&partnerID=40&md5=2f9e4cabd48db1efe3fc93087d02690a",Article,Scopus
"Compeau D.R., Higgins C.A.","Application of social cognitive theory to training for computer skills",1995,"Information Systems Research","https://www.scopus.com/inward/record.uri?eid=2-s2.0-21344456569&doi=10.1287%2fisre.6.2.118&partnerID=40&md5=bd7df117edd55a7fbc08b599e1de523f",Article,Scopus
"Hare R.M.",[No title available],1963,"Freedom and Reason",,,Scopus
"Gewirth A.",[No title available],1978,"Reason and Morality",,,Scopus
"Hare R.M.",[No title available],1981,"Moral Thinking: Its Levels, Method and Point",,,Scopus
"Beck L., Ajzen I.","Predicting dishonest actions using the theory of planned behavior",1991,"Journal of Research in Personality","https://www.scopus.com/inward/record.uri?eid=2-s2.0-28844460781&doi=10.1016%2f0092-6566%2891%2990021-H&partnerID=40&md5=55a585cff100368a324ef9d5969554ab",Article,Scopus
"Mathieson K., Peacock E., Chin W.W.","Extending the Technology Acceptance Model: The Influence of Perceived User Resources",2001,"Data Base for Advances in Information Systems","https://www.scopus.com/inward/record.uri?eid=2-s2.0-25844487151&doi=10.1145%2f506724.506730&partnerID=40&md5=cffe2702aa0e8327057c84ed058c86f4",Article,Scopus
"Ford R.C., Richardson W.D.","Ethical decision making: A review of the empirical literature",1994,"Journal of Business Ethics","https://www.scopus.com/inward/record.uri?eid=2-s2.0-0000245080&doi=10.1007%2fBF02074820&partnerID=40&md5=b83317046e40a6747d1b3cd8ae1f0c59",Review,Scopus
"Beauchamp T.L., Bowie N.E.",[No title available],1983,"Ethical Theory and Business",,,Scopus
"Chin W.W., Gopal A.","Adoption intention in gss: Relative importance of beliefs",1995,"ACM SIGMIS Database","https://www.scopus.com/inward/record.uri?eid=2-s2.0-84976722216&doi=10.1145%2f217278.217285&partnerID=40&md5=f5c5aae00b1b1abccbf289a21a7e85fe",Article,Scopus
"Mason R.O.","Four ethical issues of the information age",1986,"MIS Quarterly: Management Information Systems","https://www.scopus.com/inward/record.uri?eid=2-s2.0-55249097295&doi=10.2307%2f248873&partnerID=40&md5=a6a1433accbb9befe399539fc53aaaef",Article,Scopus
"Johnson D.",[No title available],1985,"Computer Ethics",,,Scopus
"Straub Jr. D.W.","Effective IS security: An empirical study",1990,"Information Systems Research","https://www.scopus.com/inward/record.uri?eid=2-s2.0-0000280419&doi=10.1287%2fisre.1.3.255&partnerID=40&md5=7254de37c6c52ffe8d5f097ec5ac2cb0",Article,Scopus
"MOOR J.H.","WHAT IS COMPUTER ETHICS?",1985,"Metaphilosophy","https://www.scopus.com/inward/record.uri?eid=2-s2.0-84981430537&doi=10.1111%2fj.1467-9973.1985.tb00173.x&partnerID=40&md5=622272b68ee57b3cfedfc53f150d15b1",Article,Scopus
"Brenner S.N., Molander E.A.","Is the ethics of business changing?",1977,"Harvard Business Review",,,Scopus
"Thompson R.L., Higgins C.A., Howell J.M.","Influence of experience on personal computer utilization: Testing a conceptual model",1994,"Journal of Management Information Systems","https://www.scopus.com/inward/record.uri?eid=2-s2.0-0001466354&doi=10.1080%2f07421222.1994.11518035&partnerID=40&md5=7370b149742c74faccb200ce98f2b65b",Article,Scopus
"Conner K.R., Rumelt R.P.","Software piracy: An analysis of protection strategies",1991,"Management Science",,,Scopus
"Ferrell O.C., Gresham L.G., Fraedrich J.","A Synthesis of Ethical Decision Models for Marketing",1989,"Journal of Macromarketing","https://www.scopus.com/inward/record.uri?eid=2-s2.0-84970260234&doi=10.1177%2f027614678900900207&partnerID=40&md5=4ea15d895e267eed4c4eed702ba00f76",Article,Scopus
"Chonko L.B., Hunt S.D.","Ethics and marketing management: An empirical examination",1985,"Journal of Business Research","https://www.scopus.com/inward/record.uri?eid=2-s2.0-0000901049&doi=10.1016%2f0148-2963%2885%2990006-2&partnerID=40&md5=7981d84dbe63148f8e4bd09acd167002",Article,Scopus
"Bommer M., Gratto C., Gravander J., Tuttle M.","A behavioral model of ethical and unethical decision making",1987,"Journal of Business Ethics","https://www.scopus.com/inward/record.uri?eid=2-s2.0-34250101959&doi=10.1007%2fBF00382936&partnerID=40&md5=5530eaa011e7b2a85e6d3787d77bfadb",Article,Scopus
"Baumhart R.C.","How ethical are businessmen?",1961,"Harvard Business Review",,,Scopus
"Frankena W.K.",[No title available],1963,"Ethics",,,Scopus
"Thompson V.A.",[No title available],1977,"Modern Organization",,,Scopus
"Williams K.R., Hawkins R.","Perceptual research on general deterrence: A critical review",1986,"Law and Society Review",,,Scopus
"Igbaria M., Chakrabarti A.","Computer anxiety and attitudes towards microcomputer use",1990,"Behaviour and Information Technology","https://www.scopus.com/inward/record.uri?eid=2-s2.0-84950633680&doi=10.1080%2f01449299008924239&partnerID=40&md5=1e044e72d83245be8117d137d9133d4f",Article,Scopus
"Randall D.M., Gibson A.M.","Methodology in business ethics research: A review and critical assessment",1990,"Journal of Business Ethics","https://www.scopus.com/inward/record.uri?eid=2-s2.0-0001296503&doi=10.1007%2fBF00382838&partnerID=40&md5=e74d63f3b353bd2314c8e7d025afb556",Article,Scopus
"Fritzsche D.J., Becker H.","Linking management behavior to ethical philosophy - An empirical investigation",1984,"Academy of Management Journal",,,Scopus
"Harrington S.J.","The effect of codes of ethics and personal denial of responsibility on computer abuse judgments and intentions",1996,"MIS Quarterly: Management Information Systems","https://www.scopus.com/inward/record.uri?eid=2-s2.0-0000917858&doi=10.2307%2f249656&partnerID=40&md5=83f5ed046cbb04704b4ef89e24b29d93",Article,Scopus
"Kabanoff B.","Equity, equality, power, and conflict",1991,"Academy of Management Review",,,Scopus
"Floridi L.","Information ethics: On the philosophical foundation of computer ethics",1999,"Ethics and Information Technology","https://www.scopus.com/inward/record.uri?eid=2-s2.0-0011101139&partnerID=40&md5=8f08bdd17ebc97f3eb83deb12e319a9b",Article,Scopus
"Straub D.W., Nance W.D.","Discovering and disciplining computer abuse in organizations: A field study",1990,"MIS Quarterly",,,Scopus
"Murphy P.E., Laczniak G.R.","Marketing ethics: A review with implications for managers, educators and researchers",1981,"Review of Marketing",,,Scopus
"Marx K.","Ökonomisch-philosophische Manuskripte aus dem Jahre",0000,"Ökonomisch-philosophische Manuskripte",,,Scopus
"Gopal R.D., Sanders G.L.","Preventive and deterrent controls for software piracy",1997,"Journal of Management Information Systems","https://www.scopus.com/inward/record.uri?eid=2-s2.0-0031288375&doi=10.1080%2f07421222.1997.11518141&partnerID=40&md5=0ddeca8a19f3f93a33f07672a6c42780",Article,Scopus
"Banerjee D., Cronan T.P., Jones T.W.","Modeling IT ethics: A study in situational ethics",1998,"MIS Quarterly: Management Information Systems","https://www.scopus.com/inward/record.uri?eid=2-s2.0-0002520483&doi=10.2307%2f249677&partnerID=40&md5=e39174c75e340fedc5397ece51e6cb08",Article,Scopus
"Cavanagh G.F., Moberg D.J., Velasquez M.","The ethics of organizational politics",1981,"Academy of Management Review",,,Scopus
"Weber J.","Scenarios in business ethics research: Review, critical assessment, and recommendations",1992,"Business Ethics Quarterly",,,Scopus
"Swinyard W.R., Rinne H., Kau A.K.","The morality of software piracy: A cross-cultural analysis",1990,"Journal of Business Ethics","https://www.scopus.com/inward/record.uri?eid=2-s2.0-0001354192&doi=10.1007%2fBF00383392&partnerID=40&md5=c451772a8437dbcb81a90290740e9177",Article,Scopus
"Cheng H.K., Sims R.R., Teegen H.","To purchase or to pirate software: An empirical study",1997,"Journal of Management Information Systems","https://www.scopus.com/inward/record.uri?eid=2-s2.0-0031288383&doi=10.1080%2f07421222.1997.11518142&partnerID=40&md5=22c45f848b3a8cc8d7c8a23206092f2f",Article,Scopus
"Triandis H.C.","Values, attitudes, and interpersonal behavior",1980,"Nebraska Symposium on Motivation",,,Scopus
"Zey-Ferrell M., Weaver K.M., Ferrell O.C.","Predicting Unethical Behavior Among Marketing Practitioners",1979,"Human Relations","https://www.scopus.com/inward/record.uri?eid=2-s2.0-84973710587&doi=10.1177%2f001872677903200702&partnerID=40&md5=2eac2ccc6c9479d84210e6f1addacfb1",Article,Scopus
"Gorsuch R.L., Ortberg J.","Moral obligation and attitudes: Their relation to behavioral intentions",1983,"Journal of Personality and Social Psychology","https://www.scopus.com/inward/record.uri?eid=2-s2.0-0001324053&doi=10.1037%2f0022-3514.44.5.1025&partnerID=40&md5=2fdbd73af693eb1973e3aadf467da245",Article,Scopus
"Kukathas C., Pettit P.",[No title available],1990,"Rawls: A Theory of Justice and Its Critics",,,Scopus
"Paternoster R.","Decisions to participate in and desist from four types of common delinquency: Deterrence and the rational choice perspective",1989,"Law and Society Review",,,Scopus
"Schwartz R.D., Orleans S.","On legal sanctions",1967,"University of Chicago Law Review",,,Scopus
"Gopal R.D., Sanders G.L.","International Software Piracy: Analysis of Key Issues and Impacts",1998,"Information Systems Research","https://www.scopus.com/inward/record.uri?eid=2-s2.0-0032245475&doi=10.1287%2fisre.9.4.380&partnerID=40&md5=d761b17d9570568127e7f610f3614171",Article,Scopus
"Zey-Ferrell M., Ferrell O.C.","Role-Set Configuration and Opportunity as Predictors of Unethical Behavior in Organizations",1982,"Human Relations","https://www.scopus.com/inward/record.uri?eid=2-s2.0-84973703340&doi=10.1177%2f001872678203500707&partnerID=40&md5=5d5d24b24b02f90ceb569147a1ff6a71",Article,Scopus
"Loch K.D., Conger S.","Evaluating Ethical Decision Making and Computer Use",1996,"Communications of the ACM","https://www.scopus.com/inward/record.uri?eid=2-s2.0-0030194196&doi=10.1145%2f233977.233999&partnerID=40&md5=751bacb3390d08b5db1f2392f64813f6",Article,Scopus
"Sims R.R., Cheng H.K., Teegen H.","Toward a profile of student software piraters",1996,"Journal of Business Ethics","https://www.scopus.com/inward/record.uri?eid=2-s2.0-0030215265&doi=10.1007%2fBF00381852&partnerID=40&md5=71ac22f9841a68864a38c46363f46eab",Article,Scopus
"Wold H.","Introduction to the second generation of multivariate analysis",1989,"Theoretical Empiricism",,,Scopus
"Glass R.S., Wood W.A.","Situational determinants of software piracy: An equity theory perspective",1996,"Journal of Business Ethics","https://www.scopus.com/inward/record.uri?eid=2-s2.0-0030295452&doi=10.1007%2fBF00412817&partnerID=40&md5=dd83d67b561d2f28290d90eb2a1f45f1",Article,Scopus
"Davis J.R., Welton R.E.","Professional ethics: Business students' perceptions",1991,"Journal of Business Ethics","https://www.scopus.com/inward/record.uri?eid=2-s2.0-0000535664&doi=10.1007%2fBF00382829&partnerID=40&md5=29355791d6d4e69e4881ad9d45432749",Article,Scopus
"Thong J.Y.L., Yap C.-S.","Testing an ethical decision-making theory: The case of softlifting",1998,"Journal of Management Information Systems","https://www.scopus.com/inward/record.uri?eid=2-s2.0-0032223746&doi=10.1080%2f07421222.1998.11518203&partnerID=40&md5=bee9a5eece92feb034a012b3393ff224",Article,Scopus
"Forester T., Morrison P.",[No title available],1994,"Computer Ethics: Cautionary Tales and Ethical Dilemmas in Computing",,,Scopus
"Mayo M.A., Marks L.J.","An empirical investigation of a general theory of marketing ethics",1990,"Journal of the Academy of Marketing Science","https://www.scopus.com/inward/record.uri?eid=2-s2.0-51649153065&doi=10.1007%2fBF02726432&partnerID=40&md5=891b4411e6f4ad9f19ace57a28c19465",Article,Scopus
"Sturdivant F.D., Ginter J.L.","Corpora Social Responsiveness: Management Attitudes and Economic Performance",1977,"California Management Review","https://www.scopus.com/inward/record.uri?eid=2-s2.0-84968181803&doi=10.2307%2f41164709&partnerID=40&md5=fbdfd4aba989051955b276691b682bcf",Article,Scopus
"Anderson R.E., Johnson D.G., Gotterbarn D., Perrolle J.","Using the New ACM Code of Ethics in Decision Making",1993,"Communications of the ACM","https://www.scopus.com/inward/record.uri?eid=2-s2.0-84976776710&doi=10.1145%2f151220.151231&partnerID=40&md5=a6870ca1dbbb860af9f1bd04e0be51d0",Article,Scopus
"Simpson P.M., Banerjee D., Simpson Jr. C.L.","Softlifting: A model of motivating factors",1994,"Journal of Business Ethics","https://www.scopus.com/inward/record.uri?eid=2-s2.0-0001550607&doi=10.1007%2fBF00881451&partnerID=40&md5=5029705c8f9a38264b5bb1a824f45383",Article,Scopus
"Parker D.B.",[No title available],1976,"Crime by Computer",,,Scopus
"Taylor P.W.",[No title available],1975,"Principles of Ethics: An Introduction",,,Scopus
"Logsdon J.M., Thompson J.K., Reid R.A.","Software piracy: Is it related to level of moral judgment?",1994,"Journal of Business Ethics","https://www.scopus.com/inward/record.uri?eid=2-s2.0-3242671556&doi=10.1007%2fBF00871698&partnerID=40&md5=fd66036c2912d2c8de061624a9fdca06",Article,Scopus
"Wood J.A., Longenecker J.G., McKinney J.A., Moore C.W.","Ethical attitudes of students and business professionals: A study of moral reasoning",1988,"Journal of Business Ethics","https://www.scopus.com/inward/record.uri?eid=2-s2.0-0000459707&doi=10.1007%2fBF00381828&partnerID=40&md5=89807f4a758e78f4b50766f836ebbf2f",Article,Scopus
"Parasuraman S.","Predicting turnover intentions and turnover behavior: A multivariate analysis",1982,"Journal of Vocational Behavior","https://www.scopus.com/inward/record.uri?eid=2-s2.0-0003056863&doi=10.1016%2f0001-8791%2882%2990056-2&partnerID=40&md5=8823d6f79423f09abb114317515a2a0e",Article,Scopus
"Smith N.C., Quelch J.A.",[No title available],1993,"Ethics in Marketing",,,Scopus
"Singhapakdi A., Vitell S.J.","Research note: Selected factors influencing marketers' deontological norms",1991,"Journal of the Academy of Marketing Science","https://www.scopus.com/inward/record.uri?eid=2-s2.0-51649147296&doi=10.1007%2fBF02723422&partnerID=40&md5=c54a65efef02d20f69b4f4bc52e5f9c4",Article,Scopus
"Tosi H.L., Rizzo J.R., Carroll S.J.",[No title available],1990,"Managing Organizational Behavior",,,Scopus
"Besen S.M., Kirby S.N.","Private copying, appropriability, and optimal copying royalties",1989,"Journal of Law and Economics",,,Scopus
"Straub Jr. D.W., Collins R.W.","Key information liability issues facing managers: Software piracy, proprietary databases, and individual rights to privacy",1990,"MIS Quarterly: Management Information Systems","https://www.scopus.com/inward/record.uri?eid=2-s2.0-53349102510&doi=10.2307%2f248772&partnerID=40&md5=ab1b195d1c980333a681b72102034b1e",Article,Scopus
"Dewan S., Kraemer K.L.","International Dimensions of the Productivity Paradox",1998,"Communications of the ACM","https://www.scopus.com/inward/record.uri?eid=2-s2.0-0032131159&doi=10.1145%2f280324.280333&partnerID=40&md5=05d25ed3daf8fe1a92f5ae38ea328e18",Article,Scopus
"Moores T., Dhillon G.","Software piracy: A view from Hong Kong",2000,"Communications of the ACM","https://www.scopus.com/inward/record.uri?eid=2-s2.0-0042223455&doi=10.1145%2f355112.355129&partnerID=40&md5=b7e31653a7207716e22f401f93c48cf5",Article,Scopus
"Baroudi J.J., Igbaria M.","An examination of gender effects on career success of information systems employees",1994,"Journal of Management Information Systems","https://www.scopus.com/inward/record.uri?eid=2-s2.0-71549173478&doi=10.1080%2f07421222.1994.11518055&partnerID=40&md5=469a69cc18d5f02ad3392f453c88bede",Article,Scopus
"Solomon S.L., O'Brien J.A.","The effect of demographic factors on attitudes toward software piracy",1990,"Journal of Computer Information Systems",,,Scopus
"Hunt S.","Commentary on an empirical investigation of a general theory of marketing ethics",1990,"Journal of the Academy of Marketing Science","https://www.scopus.com/inward/record.uri?eid=2-s2.0-51249175127&doi=10.1007%2fBF02726433&partnerID=40&md5=c9381786b9cf88657f8c6e0f863990c9",Article,Scopus
"Arlow P., Ulrich T.A.","Business ethics, social responsibility and business students: An empirical comparison of Clark's study",1980,"Akron Business and Economic Review",,,Scopus
"Vitell S.J., Davis D.L.","Ethical beliefs of MIS professionals: The frequency and opportunity for unethical behavior",1990,"Journal of Business Ethics","https://www.scopus.com/inward/record.uri?eid=2-s2.0-0002861365&doi=10.1007%2fBF00382565&partnerID=40&md5=4be55fbfb3c86759162373e3ef315f81",Article,Scopus
"Chin W.W.",[No title available],2001,"PLS-Graph Manual",,,Scopus
"Kallman E.A., Grillo J.P.",[No title available],1996,"Ethical Decision Making and Information Technology",,,Scopus
"Miles E.W., Hatfield J.D., Huseman R.C.","The Equity Sensitivity Construct: Potential Implications for Worker Performance",1989,"Journal of Management","https://www.scopus.com/inward/record.uri?eid=2-s2.0-84970206957&doi=10.1177%2f014920638901500407&partnerID=40&md5=a1723cd8d1b6dd4179e8b570f7d9676e",Article,Scopus
"Eining M.M., Christensen A.L.","A psycho-social model of software piracy: The development and test of a model",1991,"Ethical Issues in Information Systems",,,Scopus
"Popper K.","Philosophy of science: A personal report",1957,"British Philosophy in the Mid-Century",,,Scopus
"Christensen A.L., Eining M.M.","Factors influencing software piracy: Implications for accountants",1991,"Journal of Information Systems",,,Scopus
"Vitell S.J., Hunt S.D.","The general theory of marketing ethics: A partial test of the model",1990,"Research in Marketing",,,Scopus
"Pierce M.A., Henry J.W.","Computer ethics: The role of personal, informal, and formal codes",1996,"Journal of Business Ethics","https://www.scopus.com/inward/record.uri?eid=2-s2.0-0030121915&doi=10.1007%2fBF00380363&partnerID=40&md5=4d2d20ccc157fb5e54667db252581e56",Article,Scopus
"Levy M., Dubinsky A.J.","Identifying and addressing retail salespeople's ethical problems: A method and application",1983,"Journal of Retailing",,,Scopus
"Kuo F.-Y., Hsu M.-H.","Development and validation of ethical computer self-efficacy measure: The case of softlifting",2001,"Journal of Business Ethics","https://www.scopus.com/inward/record.uri?eid=2-s2.0-0040436852&doi=10.1023%2fA%3a1010715504824&partnerID=40&md5=704efb6c1fc0377249ea660dd8c52965",Review,Scopus
"Eckhoff T.",[No title available],1974,"Justice: Its Determinants in Social Interaction",,,Scopus
"Watson R.T., Brancheau J.C.","Key issues in information systems management. An international perspective",1991,"Information and Management","https://www.scopus.com/inward/record.uri?eid=2-s2.0-50749133711&doi=10.1016%2f0378-7206%2891%2990056-8&partnerID=40&md5=898e674a389e836bed499d36aaa042c7",Article,Scopus
"Huff C., Martin C.D.","Computing Consequences: A Framework for Teaching Ethical Computing",1995,"Communications of the ACM","https://www.scopus.com/inward/record.uri?eid=2-s2.0-84976674130&doi=10.1145%2f219663.219687&partnerID=40&md5=d7d3603b71cbbf6541f1965afefb99a6",Article,Scopus
"Stevens G.","Business ethics and social responsibility: The response of present and future managers",1984,"Akron Business and Economic Review",,,Scopus
"Kreie J., Cronan T.P.","How Men and Women View Ethics",1998,"Communications of the ACM","https://www.scopus.com/inward/record.uri?eid=2-s2.0-0032155964&doi=10.1145%2f285070.285084&partnerID=40&md5=7f4e0265c9ba78cd565b698da65cf19d",Article,Scopus
"Joshi K.","An Investigation of Equity as a Determinant of User Information Satisfaction",1990,"Decision Sciences","https://www.scopus.com/inward/record.uri?eid=2-s2.0-84985854725&doi=10.1111%2fj.1540-5915.1990.tb01250.x&partnerID=40&md5=245c963fb37dec138971fb8c444a79c8",Article,Scopus
"Randall D.M.","Taking stock: Can the theory of reasoned action explain unethical conduct?",1989,"Journal of Business Ethics","https://www.scopus.com/inward/record.uri?eid=2-s2.0-0001502438&doi=10.1007%2fBF00384531&partnerID=40&md5=f238e38cae244ba7c52c56a95b586aff",Article,Scopus
