Authors,Title,Year,Source title,Link,References,Document Type,Source
"Gopal R.D., Sanders G.L.","Global Software Piracy: You Can’T Get Blood Out of a Turnip",2000,"Communications of the ACM","https://www.scopus.com/inward/record.uri?eid=2-s2.0-0002481588&doi=10.1145%2f348941.349002&partnerID=40&md5=af5b40c16fe4c02d9b87c9575b57bb15","(1998) San Jose Mercury News., , Broadside fired at Mexican software piracy. (July 2); www.sjmercury.com/business/center/mexpir070598.htm; Dewan, S., Kraemer, K.L., International dimensions of the productivity paradox. (1998) Commun. ACM41, 8, pp. 56-62. , (Aug.); (1999), Distribution of Worldwide Software Revenues Vary Dramatically. International Data Corp. press release. Feb. 10,; www.idcresearch.com/Press/default.htm; Gopal, R.D., Sanders, G.L., An examination of preventive and deterrent controls for software piracy. (1997) J. Manage. Info. Syst., 13 (4), pp. 29-47. , (Spr.); Gopal, R.D., Sanders, G.L., International software piracy: Analysis of key issues and impacts. (1998) Info. Syst. Research, 9 (4), pp. 380-397. , (Dec.); Meurer, M.J., Price discrimination, personal use and piracy: Copyright protection of digital works. (1997) Buffalo Law Rev., 45 (3), pp. 845-898. , (Fall); Shapiro, C., Varian, H.R., (1999) Information Rules, , Harvard Business School Press, Boston, MA; (1997), Software pirates pile up profits in afflicted Asia. Christian Sci. Monitor (Dec 29, ); (1999) The Economist, , The politics of piracy. (Feb. 20); (1998), SPA’s Report on Global Software Piracy. Software Publishers Association www.spa.org/piracy/98report.htm; Varian, H.R., (1992) Microeconomic Analysis, 3rd Edition, , W. W. Norton, New York, NY; (1999), Worldwide Package Software Market Grew 13.6 Percent in 1998. International Data Corp. press release Jan. 12); www.idcresearch.com/Press/default.htm",Article,Scopus
"Moores T., Dhillon G.","Software piracy: A view from Hong Kong",2000,"Communications of the ACM","https://www.scopus.com/inward/record.uri?eid=2-s2.0-0042223455&doi=10.1145%2f355112.355129&partnerID=40&md5=b7e31653a7207716e22f401f93c48cf5","Al-Jabri, I., Abdul-Gader, A., Software copyright infringements: An exploratory study of the effect of individual and peer beliefs (1997) Omega, 25 (3), pp. 335-344; Banerjee, D., Cronan, T.P., Jones, T.W., Modeling it ethics: A study in situational ethics (1998) MIS Q., 22 (1), pp. 31-60; Cheng, H.K., Sims, R.R., Teegen, H., To purchase or to pirate software: An empirical study (1997) J. MIS, 13 (4), pp. 49-60; Conner, K.R., Rumelt, R.P., Software piracy: An analysis of protection strategies (1991) Man. Sci., 37 (2), pp. 125-139; Gopal, R.D., Sanders, G.L., Preventative and deterrent controls for software piracy (1997) J. MIS, 13 (4), pp. 29-47; Jones, T.M., Ethical decision making by individuals in organizations: An issue-contingent model (1991) Academy of Man. Rev., 16 (2), pp. 366-395; Kreie, J., Cronan, T.P., How men and women view ethics (1998) Commun. ACM, 41 (9), pp. 70-76; Logsdon, J.M., Thompson, J.K., Reid, R.A., Software piracy: Is it related to level of moral judgment? (1994) J. Bus. Ethics, 13, pp. 849-857; Sims, R.R., Cheng, H.K., Teegen, H., Toward a profile of student softwate piraters (1996) J. Bus. Ethics, 15, pp. 839-849; (1999) SIIA's Report in Global Software Piracy, , www.siia.net-piracy/news/gpr.pdf; Weber, J., Scenarios in business ethics research: Review, critical assessment and recommendations (1992) Bus. Ethics Q., 2, pp. 137-159",Article,Scopus
"Mackenzie E., Goldman K.","Computer abuse, information technologies and judicial affairs",2000,"Proceedings ACM SIGUCCS User Services Conference","https://www.scopus.com/inward/record.uri?eid=2-s2.0-0034442232&doi=10.1145%2f354908.354947&partnerID=40&md5=c056b7ae7c8e25775a14779e91d67d2c",,Conference Paper,Scopus
"Lending Diane, Slaughter Sandra A.","Understanding differences in ethical beliefs and behaviors toward software copying: The effects of organization culture",1999,"Proceedings of the ACM SIGCPR Conference","https://www.scopus.com/inward/record.uri?eid=2-s2.0-0032688505&partnerID=40&md5=3dda6f41e3b03fc7ffcea805a0d3afdc",,Article,Scopus
"Thong J.Y.L., Yap C.-S.","Testing an ethical decision-making theory: The case of softlifting",1998,"Journal of Management Information Systems","https://www.scopus.com/inward/record.uri?eid=2-s2.0-0032223746&doi=10.1080%2f07421222.1998.11518203&partnerID=40&md5=bee9a5eece92feb034a012b3393ff224","Anderson, R.E., Johnson, D.G., Gotterbarn, D., Perrolle, J., Using the new ACM code of ethics in decision making (1993) Communication of the ACM, 36 (2), pp. 98-107; Athey, T., Zmud, R.W., (1987) Computers and Information Systems, , Glenview, IL: Scott, Foresman and Company; Baroudi, J., Igbaria, M., An examination of gender effects on career success of information systems employees (1995) Journal of Management Information Systems, 1 (3), pp. 181-201; Beauchamp, T.L., Bowie, N.E., (1979) Ethical Theory and Business, , Englewood Cliffs, NJ: Prentice-Hall; Belsley, D.A., Kuh, E., Welsch, R.E., (1980) Regression Diagnostics: Identifying Influential Data and Sources of Collinearity, , New York: John Wiley; Bequai, A., (1987) Technocrimes, , Lexington, MA: Lexington Books; Christensen, A.L., Eining, M.M., Factors influencing software piracy: Implications for accountants (1991) Journal of Information Systems, 5, pp. 67-80. , Spring; Collins, R., Miller, K.W., Paramedic ethics for computer professionals (1992) Journal of System Software, 17, pp. 23-28. , January; Couger, J.D., Preparing IS students to deal with ethical issues (1989) MIS Quarterly, 13 (2), pp. 211-218; Eining, M.M., Christensen, A.L., A psycho-social model of software piracy: The development and test of a model (1991) Ethical Issues in Information Systems Use, pp. 182-188. , R. Dejoie, G. Fowler, and D. Paradice (eds.), Boston: Boyd and Fraser; Ferrell, O.C., Gresham, L.G., A contingency framework for understanding ethical decision making in marketing (1985) Journal of Marketing, 49, pp. 87-96. , Summer; Ferrell, O.C., Gresham, L.G., Fraedrich, J., A synthesis of ethical decision models of marketing (1989) Journal of Macromarketing, 9 (2), pp. 55-64; Fishbein, M., Ajzen, I., (1975) Belief, Attitude, Intention and Behavior: An Introduction to Theory and Research, , Boston: Addison-Wesley; Ford, R.C., Richardson, W.D., Ethical decision making: A review of the empirical literature (1994) Journal of Business Ethics, 13 (2), pp. 205-221; Forester, T.G., Morrison, P., (1994) Computer Ethics: Cautionary Tales and Ethical Dilemmas in Computing, 2d Ed., , Cambridge, MA: MIT Press; Frankena, W., (1963) Ethics, , Englewood Cliffs, NJ: Prentice-Hall; Freeman, R.E., Gilbert Jr., D.R., Hartman, E., Values and foundations of strategic management (1988) Journal of Business Ethics, 7, pp. 821-834; Gabella, G., Picasso, M.D., PC software industry lost $8.08 billion to pirates in 1994 (1995) Information and Management, 29 (5), pp. 285-288; Harrington, S.J., Why people copy software and create computer viruses: Individual characteristics or situational factors? (1989) Information Resources Management Journal, 2 (3), pp. 28-37; Harrington, S.J., The anomaly of other-directedness: When normally ethical IS personnel are unethical (1995) Computer Personnel, 16 (2), pp. 3-11; Hofstede, G., (1991) Cultures and Organizations: Software of the Mind, , London: McGraw-Hill; Huff, C., Martin, C.D., Computing consequences: A framework for teaching ethical computing (1995) Communication of the ACM, 38 (12), pp. 75-84; Hunt, S.D., Commentary on an empirical investigation of a general theory of marketing ethics (1990) Journal of the Academy of Marketing Science, 18 (2), pp. 173-177; Hunt, S.D., Vitell, S.J., A general theory of marketing ethics (1986) Journal of Macromarketing, 6, pp. 5-16. , Spring; Johnson, D.G., (1994) Computer Ethics, 2d Ed., , Englewood Cliffs, NJ: Prentice-Hall; Jones, T.M., Ethical decision making by individuals in organizations: An issue-contingent model (1991) Academy of Management Review, 16 (2), pp. 366-395; Kling, R., Beyond outlaws, hackers and pirates: Ethical issues in the work of information and computer science professionals (1996) Computerization and Controversy: Value Conflicts and Social Choices, 2d Ed., , San Diego: Academic Press; Laudon, K.C., Ethical concepts and information technology (1995) Communications of the ACM, 38 (12), pp. 33-39; Levy, M., Dubinsky, A.J., Identifying and addressing retail salespeople's ethical problems: A method and application (1983) Journal of Retailing, 59 (1), pp. 46-66; Loch, K.D., Conger, S., Evaluating ethical decision making and computer use (1996) Communications of the ACM, 39 (7), pp. 74-83; Luegenbiehl, H.C., Computer professionals: Moral autonomy and a code of ethics (1992) Journal of Systems Software, 17, pp. 61-68; Mason, R.O., Four ethical issues of the information age (1986) MIS Quarterly, 10 (1), pp. 5-12; Mason, R.O., Applying ethics to information technology issues (1995) Communications of the ACM, 38 (12), pp. 55-57; Mayo, M.A., Marks, L.J., An empirical investigation of a general theory of marketing ethics (1990) Journal of the Academy of Marketing Science, 18 (2), pp. 163-171; McFarlan, F.W., Editor's comments (1988) MIS Quarterly, 12 (1), pp. iii-vi; Murphy, P., Laczniak, G.R., Marketing ethics: A review with implications for managers, educators and researchers (1981) Review of Marketing, pp. 251-266. , B. Enis and K. Roering (eds.), Chicago: American Marketing Association; Nunnally, J.C., (1978) Psychometric Theory, , New York: McGraw-Hill; Oz, E., Ethical standards for information systems professionals: A case for a unified code (1992) MIS Quarterly, 10 (1), pp. 423-433; Parasuraman, S., Predicting turnover intentions and turnover behavior (1982) Journal of Vocational Behavior, 21, pp. 111-121; Parker, D., Swope, S., Baker, B., (1990) Ethical Conflicts in Information and Computer Science, Technology, and Business, , Wellesley, MA: QED Information Sciences; Randall, D.M., Taking stock: Can the theory of reasoned action explain unethical conduct? (1989) Journal of Business Ethics, 8, pp. 873-882; Randall, D.M., Gibson, A.M., Methodology in business ethics: A review and critical assessment (1990) Journal of Business Ethics, 9, pp. 457-471; Ross, W.D., (1930) The Right and the Good, , Oxford: Clarendon Press; Samuelson, P., Digital media and the law (1991) Communications of the ACM, 34 (10), pp. 23-28; Samuelson, P., Computer programs and copyright's fair use doctrine (1993) Communications of the ACM, 36 (9), pp. 19-25; Samuelson, P., Copyright's fair use doctrine and digital data (1994) Communications of the ACM, 37 (1), pp. 21-27; Sidgwick, H., (1907) The Methods of Ethics, , London: MacMillan; Simpson, P.M., Banerjee, D., Simpson, C.L., Softlifting: A model of motivating factors (1994) Journal of Business Ethics, 13 (6), pp. 431-438; Singhapakdi, A., Vitell, S., Research note: Selected factors influencing marketers' deontological norms (1991) Journal of the Academy of Marketing Science, 19 (1), pp. 37-42; Smith, N.C., Quelch, J.A., (1993) Ethics in Marketing, , Homewood, IL: Irwin; Straub, D.W., Collins, R.W., Key information liability issues facing managers: Software piracy, proprietary databases, and individual rights to privacy (1990) MIS Quarterly, 14 (2), pp. 143-156; Tabachnick, B.G., Fidell, L.S., (1989) Using Multivariate Statistics, 2d Ed., , New York: HarperCollins; Taylor, P.W., (1975) Principles of Ethics: An Introduction, , Encino, CA: Dickenson Publishing; Trevino, L.K., Ethical decision making in organizations: A person-situation interactionist model (1986) Academy of Management Review, 11 (3), pp. 601-617; Vitell, S.J., Davis, D.L., Ethical beliefs of MIS professionals: The frequency and opportunity for unethical behavior (1990) Journal of Business Ethics, 9 (1), pp. 67-70; Vitell, S.J., Hunt, S.D., The general theory of marketing ethics: A partial test of the model (1990) Research in Marketing, 10, pp. 237-265; Watson, R.T., Brancheau, J.C., Key issues in IS management (1991) Information and Management, 20, pp. 213-223; Watson, R.T., Pitt, L.F., Personal computing ethics: Beliefs and behaviour (1993) International Journal of Information Management, 13 (4), pp. 287-298; Watson, R.T., Pitt, L.F., Determinants of behavior towards ethical issues in personal computing (1993) OMEGA, 21 (4), pp. 457-470; Wood-Harper, A.T., Corder, S., Wood, J.R.G., Watson, H., How we profess: The ethical system analyst (1996) Communications of the ACM, 39 (3), pp. 69-77",Article,Scopus
"Cheng H.K., Sims R.R., Teegen H.","To purchase or to pirate software: An empirical study",1997,"Journal of Management Information Systems","https://www.scopus.com/inward/record.uri?eid=2-s2.0-0031288383&doi=10.1080%2f07421222.1997.11518142&partnerID=40&md5=22c45f848b3a8cc8d7c8a23206092f2f","Anthes, G.H., Study cites software industry growth, piracy problems (1993) Computerworld, p. 119. , March 29; (1995) 1994 Software Piracy Report, , Washington, DC: Business Software Alliance; Cheng, H.K., Hacking, computer viruses, and software piracy: The implications of modem computer fraud for corporations (1995) Corporate Misconduct: the Legal, Societal, and Management Issues, pp. 125-147. , M.P. Spencer and R.R. Sims (eds.), London: Quorum Books; Christensen, A.L., Eining, V., Factors influencing software piracy: Implications for accountants (1991) Journal of Information Systems, pp. 67-80. , Spring; Conner, K.R., Rumelt, R.P., Software piracy: An analysis of protection strategies (1991) Management Science, 37 (2), pp. 125-139; Cronbach, L.J., (1990) Essentials of Psychological Testing, 5th Ed., , New York: Harper and Row; Gwynne, P., Stalking Asian software pirates (1992) Technology Management, 95 (2), pp. 15-16; Levy, S., The rap on software piracy (1993) MacWorld, pp. 57-70. , January; Logsdon, J.M., Thompson, J.K., Reid, R.A., Software piracy: Is it related to level of moral judgment? (1994) Journal of Business Ethics, 13, pp. 849-857; Martin, J., Freeze, it's the cyber fuzz (1994) Fortune, p. 12. , May 2; Nascimento, F., Vanhonacker, W.R., Optimal strategic pricing of reproducible consumer products (1988) Management Science, 34 (8), pp. 921-937; Oz, E., The attitude of managers-to-be toward software piracy (1990) OR/MS Today, pp. 24-26. , August; Pallette, J., Software and the law (1986) PC Week, pp. 79-84. , October 7; Parry, J., Pirates in the dock (1991) International Management, 46 (4), pp. 56-59; Reid, R.A., Thompson, J.K., Logsdon, J.M., Knowledge and attitudes of management students toward software piracy (1992) Journal of Computer Information Systems, pp. 46-51. , Fall; Shim, J.P., Taylor, G.S., Business faculty members' perceptions of unauthorized software copying (1988) OR/MS Today, pp. 30-31. , October; Sims, R.R., Cheng, H.K., Teegen, H., Toward a profile of student software piraters (1996) Journal of Business Ethics, 15, pp. 839-849; Varian, H.R., (1984) Microeconomic Analysis, 2d Ed., , New York: W.W. Norton; Siwek, S.E., Furchtigott-Roth, H.W., (1993) The U.S. Software Industry: Economic Contribution in the U.S. and World Markets (A Report Prepared for Business Software Alliance), , Washington, DC: Economists Incorporated, Spring; Vitell, S.J., Davis, D.L., Ethical beliefs of MIS professionals: The frequency and opportunity for unethical behavior (1990) Journal of Business Ethics, pp. 63-70. , August; Willett, S., SPA investigates reports of rampant piracy on the Internet (1993) InfoWorld, p. 12. , March 22; Zagorsky, J., The upside of software piracy (1990) Computerworld, p. 21. , July 2",Article,Scopus
"Gopal R.D., Sanders G.L.","Preventive and deterrent controls for software piracy",1997,"Journal of Management Information Systems","https://www.scopus.com/inward/record.uri?eid=2-s2.0-0031288375&doi=10.1080%2f07421222.1997.11518141&partnerID=40&md5=0ddeca8a19f3f93a33f07672a6c42780","Antonoff, M., The decline of copy protection (1987) Personal Computing, 11 (5), pp. 155-1115. , May; Benham, H.C., Wagner, J.L., Software publishing and the economic impact of copying (1987) International Conference on Information Systems, pp. 149-159; Besen, S.M., Kirby, S.N., Private copying, appropriability, and optimal copying royalties (1989) Journal of Law and Economics, 32, pp. 255-280. , October; Blumstein, A., Cohen, J., Nagin, D., Introduction (1978) Deterrence and Incapacitation: Estimating the Effects of Criminal Sanctions on Crime Rates, , Washington, DC: National Academy of Sciences; Bommer, M., Gratto, C., Gravander, J., Tuttle, M., A behavioral model of ethical and unethical decision making (1991) Ethical Issues in Information Systems, pp. 6-26. , R. DeJoie, G. Fowler, and D. Paradice (eds.), South-Western Publishing; Buchanan, J.M., An economic theory of clubs (1965) Economica, pp. 1-14. , February; The patient pirates are finally walking the plank (1992) Business Week, pp. 125-127. , February 17; Carrol, P.B., On your honor: Software firms remove copy-protection devices (1986) Wall Street Journal, p. 37. , September 25; Conner, K.R., Rumelt, R.P., Software piracy: An analysis of protection strategies (1991) Management Science, 37 (2), pp. 125-139. , Febraury; DeJoie, R., Fowler, G., Paradice, D., (1991) Ethical Issues in Information Systems, , South-western Publishing; Ehrlich, L., Participation in illegitimate activities: A theoretical and empirical investigation (1973) Journal of Political Economy, 81, pp. 521-564; Eining, M.M., Christensen, A.L., A psycho-social model of software piracy: The development and test of a model (1991) Ethical Issues in Information Systems, pp. 182-189. , R. DeJoie, G. Fowler, and D. Paradice (eds.), South-Western Publishing; Elmer-Dewitt, P., Nabbing the pirates of the Cyberspace: Will the latest crackdowns make a dent in global problems of the legal software duplication? (1994) Time, 143 (24). , June 13; Fuentebella, C., Testing limits of software copyright (1989) Bank Systems and Equipment, 26 (2), pp. 42-46. , February; Givon, M., Mahajan, V., Muller, E., Software piracy: Estimation of lost sales and the impact on software diffusion (1995) Journal of Marketing, 59 (1), pp. 29-37. , January; SPA issues graphic warning (1991) InfoWorld, p. 104. , December 2; Jerry, S., Users must take responsibility to control the illegal copying of software (1987) Infoworld, 9 (40), p. 56. , October 5; Manski, C.F., Prospects for inference on deterrence through empirical analysis of individual criminal behavior (1978) Deterrence and Incapacitation: Estimating the Effects of Criminal Sanctions on Crime Rates, pp. 401-424. , Washington, DC: National Academy of Sciences; Mason, J., Crackdown on software pirates (1990) Computerworld, 24 (6), pp. 107-115. , February 5; Morgon, M.J., Ruskell, D.J., Software piracy - the problems (1987) Industrial Management and Data Systems, pp. 8-12. , UK March-April; Olson, M., (1965) The Logic of Collective Action: Public Goods and the Theory of Groups, , Cambridge, MA: Harvard University Press; Patemoster, R., Decisions to participate in and desist from four types of common delinquency: Deterrence and rational choice perspective (1989) Law and Society Review, 23 (1), pp. 7-40; Paolo, D.N., Vendors come together to form CAAST (1991) ComputerData, 16 (1), p. 11. , (Canada), January; Reilly, B.J., Kyj, M.J., Economics and ethics (1990) Journal of Business Ethics, pp. 691-698; Resnick, A.J., Curbing software pirates (1993) CA Magazine, 126 (5), pp. 50-54. , May; Richards, P., Tittle, C.R., Socioeconomic status and perceptions of personal arrest probabilities (1982) Criminology, 20, pp. 329-343; Sacco, V.F., Zureik, E., Correlates of computer misuse: Data from a self-reporting sample (1990) Behaviour and Information Technology, 9 (5), pp. 353-369; Schwartz, R.D., Orleans, S., On legal sanctions (1967) University of Chicago Law Review, 34, pp. 274-300; Shim, J.P., Taylor, G.S., A comparative study of unauthorized software copying: Information systems faculty members' vs. practicing managers' perceptions (1991) Ethical Issues in Information Systems, pp. 189-198. , R. DeJoie, G. Fowler, and D. Paradice (eds.), South-Western Publishing; Solomon, S.L., O'Brien, J.A., The effect of demographic factors on attitudes toward software piracy (1991) Ethical Issues in Information Systems, pp. 168-181. , R. DeJoie, G. Fowler, and D. Paradice (eds.), South-Western Publishing; Sorenson, J.R., Tschirhart, J.T., Whinston, A.B., Private goods clubs and the core (1978) Journal of Public Economics, 10, pp. 77-95; Straub, D.W., Effective IS security: An empirical study (1990) Information Systems Research, 1 (3), pp. 255-276; Swinyard, W.R., The morality of software piracy: A cross-cultural analysis (1990) Journal of Business Ethics, 9 (8), pp. 655-664. , August; Valigura, L., ADAPSO battles micro software pirates (1985) Mini-Micro Systems, p. 27. , April; Williams, K.R., Hawkins, R., Perceptual research on general deterrence: A critical review (1986) Law and Society, 20 (4), pp. 545-572; Wood, J.A., Longenecker, J.G., McKinney, J.A., Moore, C.W., Ethical attitudes of students and business professionals: A study of moral reasoning (1988) Journal of Business Ethics, pp. 249-257; Zagorsky, J., The upside of software piracy (1990) Computerworld, 24 (27), p. 21. , July 2",Article,Scopus
"Glass R.S., Wood W.A.","Situational determinants of software piracy: An equity theory perspective",1996,"Journal of Business Ethics","https://www.scopus.com/inward/record.uri?eid=2-s2.0-0030295452&doi=10.1007%2fBF00412817&partnerID=40&md5=dd83d67b561d2f28290d90eb2a1f45f1","Adams, J.S., Toward and understanding of inequity (1963) Journal of Abnormal and Social Psychology, 67 (5), pp. 422-436; Bequai, A., (1987) Technocrimes, , Lexington Books, Lexington, MA; Cohen, E., Cornwell, L., College students believe piracy is acceptable (1989) CIS Educators Forum, pp. 2-5; Conner, K.R., Rumelt, R.P., Software piracy: An analysis of protection strategies (1991) Management Science, 37 (2), pp. 125-139; Couger, J.D., Preparing IS students to deal with ethical issues (1989) MIS Quarterly, 13 (2); Deutsch, M., (1985) Distributive Justice: A Social-Psychology Perspective, , Yale University Press, New Haven, CT; Eckoff, T., (1974) Justice: Its Determinants in Social Interaction, , Rotterdam University Press, Rotterdam, Netherlands; Harrington, S., Why people copy software and create computer viruses: Individual characteristics or situational factors (1989) Information Resource Management Journal, pp. 28-37; Homans, G.C., (1961) Social Behavior: Its Elementary Forms, , Harcourt, New York; Im, J.H., Van Epps, P.D., Software piracy and software security in business schools: An ethical perspective (1991) Data Base, 22 (3), pp. 15-21; Im, J.H., Van Epps, P.D., Legal and ethical issues of software piracy (1992) IACIS, pp. 157-169. , New Orleans; Jones, T.M., Ethical decision making by individuals in organizations: An issue-contingent model (1991) Academy of Management Review, 16 (2), pp. 366-395; Joshi, K., The measurement of fairness or equity perceptions of management information systems users (1989) MIS Quarterly, pp. 343-358; Joshi, K., An investigation of equity as a determinant of user information satisfaction (1990) Decision Sciences, 21, pp. 786-807; Kabanoff, B., Equity, equality, power and conflict (1991) Academy of Management Review, 16 (2), pp. 416-441; Miles, E.W., Hatfield, J.D., Huseman, R.C., The equity sensitivity construct: Potential implications for worker performance (1989) Journal of Management, 15 (4), pp. 581-588; Oz, E., The attitude of managers-to-be toward software piracy (1990) OR/MS Today, 17 (4), pp. 24-26; Parker, D.B., Crime by Computer, , Charles Scribner and Sons, New York; Shim, J.P., Taylor, G.S., Practicing manager's perception/attitudes towards illegal software copying (1989) OR/MS Today, 16 (4), pp. 30-33; Solomon, S.L., O'Brien, J.A., The effect of demographic factors on attitudes toward software piracy (1990) The Journal of Computer Information Systems, pp. 45-45; Straub D.W., Jr., Webb Collins, R., Key information liability issues facing managers: Software piracy, proprietary databases and individual rights to privacy (1990) MIS Quarterly, pp. 143-156; Strikwerda, R.B., Ross, J.M., Software and ethical softness (1992) Collegiate Microcomputer, 10 (3), pp. 129-136; Walster, E., Berscheid, E., Walster, G.W., New directions in equity research (1973) Journal of Personality and Social Psychology, pp. 151-176; Wood, W.A., A view of computer ethics by managers and students (1992) The Journal of Computer Information Systems, pp. 7-10; Wood, W.A., Computer ethics and years of computer use (1993) Journal of Computer Information Systems, pp. 23-27",Article,Scopus
"Rife Richard C.","Software piracy",1995,"Northcon - Conference Record","https://www.scopus.com/inward/record.uri?eid=2-s2.0-0029212041&partnerID=40&md5=aa52c61546fba568a3ff74fc39d1bbcc",,Conference Paper,Scopus
