Authors,Title,Year,Source title,Link,References,Document Type,Source
"Manochehri N.-N., Al-Esmail R.A., Ashrafi R.","Examining the impact of information and communication technologies (ICT) on enterprise practices: A preliminary perspective from Qatar",2012,"Electronic Journal of Information Systems in Developing Countries","https://www.scopus.com/inward/record.uri?eid=2-s2.0-84860863265&doi=10.1002%2fj.1681-4835.2012.tb00360.x&partnerID=40&md5=a0508cd7137ecd0108738575823ac6ad","Abdallah, S., Al-Badri, F., A Perspective on ICT Diffusion in the Arab Region (2011) ICT Acceptance, Investment and Organization: Cultural Practices and Values in the Arab World, pp. 1-15. , Abdallah, S. and Ahmad, F.A. (Eds.), IGI Global, Chapter 1; Al-Assaf, Y., (1997) Computer-Based Information Systems in the Role of Information Technology Manager in Saudi Arabia, , Ph.D. Thesis, University of Manchester; Al-Shoaibi, A., (1998) The Impact of Information Technology on Organizations: The Case of Saudi Private, , Sector, Ph.D. Thesis, University of St Andrews.UK; Ashrafi, R., Murtaza, M., Use and Impact of ICT on SMEs in Oman (2008) The Electronic Journal of Information Systems Evaluation, 11 (3), pp. 125-138; Bayly, C.A., (2004) The Birth of the Modern World, 1780-1914, , Oxford: Blackwell; Bodla, M.A., Rashid, M.A., Technology Adoption in Islamic World, Problems and Prospects (2005) International Conference on Contemporary Issues in Information Technology in OIC Member States, , www.init.org.pk/papersandpublications/P4.pdf, organized by INNIT (Inter-Islamic Network of Information Technology) on July 26-27, at Marriot Islamabad - Pakistan; (2010) Fast, Lean, and Agile: How GCC Governments Can Make the Most of ICT Investments, , http://www.booz.com/media/uploads/Fast_Lean_and_Agile.pdf, Booz & Co; Bortolotti, B., D'Souza, J., Fantini, M., Megginson, W.L., Privatization and the Sources of Performance Improvement in the Global Telecommunications Industry (2002) Telecommunications Policy, 2 (6), pp. 243-268; Burke, K., The Impact of Internet and ICT Use among SMË Agribusiness Growers and Producers (2010) Journal of Small Business and Entrepreneurship, 23 (2), pp. 173-194; (2010) Business Monitor International Predicts 10% Growth Rate in Qatar's IT Spend, , http://www1.albawaba.com/en/news/businessmonitor-international-predicts-10-growth-rate-qatar%E2%80%99s-it-spend, Business Monitor International (BMI); Chibelushi, C., ICT Industry Challenges in Adopting ICT: A Case Study from the West Midlands, UK (2008) Proceedings of the 2008 International Conference on Information Resource Management, , 18-20 May, Niagara Falls, Canada; Clift, S., (2003) E-Democracy, E-Governance and Public Net-Work, , http://www.publicus.net/articles/edempublicnetwork.html; El-Shenawy, N., (2010) ICT Measurement: Egypt's Experience, , First Workshop of the Regional Project ""ICT Indicators and Capacity Building for ICT Measurement in Arab Region"", Amman, 25-27 Sept; (2010) An Integrated Industrial Policy for the Globalization Era Putting Competitiveness and Sustainability at Centre Stage, , http://ec.europa.eu/enterprise/policies/industrial-competitiveness/industrialpolicy/files/communication_on_industrial_policy_en.pdf, European Commission (EC); Gable, G.G., Integrating Case Study and Survey Research Methods: An Example in Information Systems (1994) European Journal of Information Systems, 3 (2), pp. 112-126; (2011) World Economic Forum and INSEAD, , http://www3.weforum.org/docs/WEF_GITR_Report_2011.pdf, Global Information Technology Report; Gonzalez, J.S., (1998) The 21st- Century Intranet, , Prentice-Hall, Inc, NJ; Hamade, S.N., Information and Communication Technology in Arab Countries: Problems and Solutions (2009) The proceedings of: New Generations, 6th Conference on Information Technology, pp. 1498-1503. , Las Vegas, NV, USA, 27-29 April; Hamilton, J., (2000) Institutions, Competition and the Performance of Telecommunications Infrastructure in Africa, , PURC working paper, University of Florida, Gainesville, USA; Harindranath, G., Dyerson, R., Barnes, D., ICT Adoption and Use in UK SMEs: A Failure of Initiatives? (2008) The Electronic Journal of Information Systems Evaluation, 11 (2), pp. 91-96; Heeks, R., Information Systems and Developing countries: Failure, Successes, and Local Improvisations (2002) The Information Society, 18 (2), pp. 101-112; (2009) Qatar's ICT Landscape: Assessment of Information and Communication Technology in Qatar, , http://www.ict.gov.qa/files/images/ICT_Qatar_LandscapePresentation_May17.pdf, ictQATAR. Doha, ictQatar; (2010), http://www.ictqatar.qa/en/news-events/news/ictqatar-releases-2010-annual-report, ictQATAR; (2010) International Telecommunications Union, , http://www.itu.int/en/pages/default.aspx, ITU; Jelassi, T., ICT in Tunisia: A Strategic Lever for Building a Knowledge-based Economy (2010) The Global Information Technology Report 2009-2010: ICT for Sustainability, pp. 153-164. , Soumitra Dutta and Irene Mia (Editors), World Economic Forum and INSEAD, March; Kapurubandara, M., A Framework to E-Transformation SMES in Developing Countries (2009) The Electronic Journal on Information Systems in Developing Countries, 39 (3), pp. 1-24; Limi, A., (2008) Effects of Improving Infrastructure Quality on Business Costs: Evidence from Firm-Level Data, , Policy Research Working Paper 4581, World Bank, Washington, DC; Mofleh, S., Wanous, M., Strachan, P., Developing Countries and ICT Initiatives: Lessons Learnt from Jordan's Experience (2008) The Electronic Journal on Information Systems in Developing Countries, 34 (5), pp. 1-17; Mohr, J.J., Shooshtari, N.H., Introduction to the Special Issue: Marketing of High Technology Products and Innovations (2003) Marketing Theory Practice, 11 (3), pp. 1-12; Nour, S.S.O.M., ICT Opportunities and Challenges for Development in the Arab Region (2006) The New Economy in Development: ICT Challenges and Opportunities, pp. 161-187. , D'Costa, A.P. (ed.); Nour, S., (2008) The Use and Economic Impacts of ICT at the Macro-Micro levels in the Arab Gulf Countries, , Paper prepared for the Fifth GLOBELICS Academy, TaSTI, University of Tampere, Tampere, Finland; Oliner, S.D., Sichel, D., The Resurgence of Growth in the Late 1990s: Is Information Technology the Story? (2004) Journal of Economic Perspectives, 14 (4), pp. 3-22; Papaioannou, S.K., (2004) FDI and ICT Innovation Effect on Productivity Growth: A Comparison between Developing and Developed Countries, , Athens University of Economics and business, Athens, Greece; Pettey, C., Tudor, B., (2011) Gartner Says Worldwide IT Spending to Grow 5.1 Percent in 2011, , http://www.gartner.com/it/page.jsp?id=1513614; Piatkowski, M., (2003) The Contribution of ICT Investment to Economic Growth and Labor Productivity in Poland 1995-2000, , http://ideas.repec.org/p/wpa/wuwpdc/0308002.html; Pisciotta, A.A., Global Trends in Privatisation and Liberalization (1997) Telecom Reform: Principles, Policies and Regulatory Practices, , W. Melody (ed.), Lyngby: Den private Ingenirrfond, Technical University of Denmark; Pritchard, S., How Can So Many Businesses Cope without Computers (2006) Financial Times, 1 (9), p. 19; Remenyi, D., Williams, B., Some Aspects of Methodology for Research in Information Systems (1995) Journal of Information Technology, 10 (3), pp. 191-201; Roeller, L., Waverman, L., Telecommunications Infrastructure and Economic Development: A Simultaneous Approach (2001) American Economic Review, 91 (4), pp. 909-923; Shih, E., Kraemer, K.L., Dedrick, J., IT Diffusion in Developing Countries (2008) Communications of the ACM, 51 (2), pp. 43-48; Shirazi, F., The Contribution of ICT to Freedom and Democracy: An Empirical Analysis of Archival Data on the Middle East (2008) The Electronic Journal on Information Systems in Developing Countries, 35 (6), pp. 1-24; (2006) Information and Communications for Development, , http://ppi.worldbank.org, The World Bank. Washington, D.C; Van Dijk, J., (2006) The Network Society, , 2nd Edition, London: SAGE; Wellenius, B., (1999) Mitigating Regulatory Risk in Telecommunications, , (Note No. 189), in Public Policy for the Private Sector. Washington, D.C; Yahia, M., (2011) Information and Communication Technologies on the Rise in the Gulf States, , www.nature.com/nmiddleeast/2011/110504/full/nmiddleeast.2011.53.html",Article,Scopus
"Davis C.A., Jr., Fonseca F.","Considerations from the development of a local spatial data infrastructure",2011,"Spatial Data Infrastructures in Context: North and South","https://www.scopus.com/inward/record.uri?eid=2-s2.0-85059380026&partnerID=40&md5=171c982690c19439e3e09a2ce888ce05","Bernard, L., Craglia, M., (2005) In SDI: From spatial data infrastructure to service driven infrastructure, , Paper presented at the Research Workshop on Cross-Learning between Spatial Data Infrastructures (SDI) and Information Infrastructures (II), Enschede, Holanda; Bernstein, R.J., (1983) Beyond Objectivisim and Relativism: Science, Hermeneutics, and Praxis., , Philadelphia: University of Pennsylvania Press; Borges, K.A.V., Davis, C.A., Jr., Laender, A.H.F., OMT-G: An object-oriented data model for geographic applications (2001) GeoInformatica, 5 (3), pp. 221-260; Braa, J., Monteiro, E., Sahay, S., Networks of Action: Sustainable Health Information Systems across Developing Countries (2004) MIS Quarterly, 28 (3), pp. 337-362; Davis, C.A., Jr., (1993) In Address base creation using raster-vector integration, 1, pp. 45-54. , Paper presented at the Urban and Regional Information Systems Association Annual Conference (URISA’93), Atlanta, Georgia; Davis, C.A., Jr., (1995) Interchange of geographical information (in Portuguese), , (Technical Report No. 01/1995). Belo Horizonte: PRODABEL; Davis, C.A., Jr., Geographical information interchange: The experience on standardization and cooperation in Minas Gerais state (in Portuguese) (2002) Geographic Data: Aspects and perspectives, pp. 43-54. , G.C. Pereira & M.C.F. Rocha (Eds.), Salvador (BA): Rede Baiana de Tecnologias da Informação Espacial (REBATE); Davis, C.A., Jr., Borges, K.A.V., (1994) In Object-oriented GIS in practice, 1, pp. 786-795. , Paper presented at the Urban and Regional Information Systems Association Annual Conference (URISA’94), Milwaukee, Wisconsin; Davis, C.A., Jr., Oliveira, P.A., Interoperable and distributed GIS for large local governments (in Portuguese) (2002) Informática Pública, 4 (1), pp. 121-141; Davis, C.A., Jr., Zuppo, C.A., (1995) In Updating urban geographic databases: Methodology and challenges, 1, pp. 269-276. , Paper presented at the Geographic Information Systems/Land Information Systems 1995 Annual Conference, Nashville, Tennessee; Fonseca, F.T., Davis, C.A., Jr., Using the Internet to access geographic information: An open GIS interface prototype (1999) Interoperating Geographic Information Systems., , M.E. Goodchild, M.J. Egenhofer, R. Fegeas & C. Kottman (Eds.), Kluwer Academic Publishers; Fonseca, F.T., Egenhofer, M.J., Davis, C.A., Jr., Borges, K.A.V., Ontologies and knowledge sharing in urban GIS (2000) Computers, Environment and Urban Systems, 24 (3), pp. 251-272; Fonseca, F.T., Egenhofer, M.J., Davis, C.A., Jr., Câmara, G., Semantic granularity in ontology-driven geographic information systems (2002) Annals of Mathematics and Artificial Intelligence, 36 (1-2), pp. 121-151; Fonseca, F.T., Zuppo, C.A., (1994) In School pre-registration and student allocation, 1, pp. 30-40. , Paper presented at the Urban and Regional Information Systems Association Annual Conference (URISA’94), Milwaukee, Wisconsin; Gadamer, H.-G., (1975) Truth and Method., , New York: Seabury Press; Georgiadou, Y., Sahay, S., Hanseth, O., (2004) Implementation of Spatial Data Infrastructures (SDI) in Transitional Economies (Technical Report)., , Omaha, NE: College of Information Science & Technology, University of Nebraska at Omaha; Habermas, J., (1971) Knowledge and Human Interests., , Boston: Beacon Press; Meinberg, F.F., Tools for the analysis of traffic accidents using GIS (in Portuguese) (2003) Informática Pública, 5 (1), pp. 79-99; Oliveira, M.P.G., (1997) Spatial decision support systems: Models for analyzing the densification of economic activities in urban space (in Portuguese)., , Unpublished Masters Dissertation, Fundação João Pinheiro, Belo Horizonte (MG); Oliveira, S.M., Sousa, R.P., Amaral, F.M., (1995) In A review of the limits of urban census sectors and other urban spatial reference units (in Portuguese), pp. 857-863. , Paper presented at the XVII Brazilian Cartographic Conference, Salvador (BA); Oliveira, S.M., Sousa, R.P., Davis, C.A., Jr., Amaral, F.M., GIS in the definition of spatial reference units for Belo Horizonte’s urban quality of living indicator (in Portuguese) (1996) EspaçoBH, 1, pp. 21-29; Peixoto, N.M.A., (2000) Methodology for the creation and compatibilization of a legalized parceling base map for the city of Belo Horizonte (in Portuguese)., , Unpublished Masters Dissertation, João Pinheiro Foundation, Belo Horizonte (MG); Pessanha, J.E.M., Carvalho, F.R., Creation of an information system based on methods standardization for zoonosis control in the city of Belo Horizonte (in Portuguese) (1999) Informática Pública, 1 (1), pp. 63-74; Pinto, M.V., School pre-registration: Democratization of the access to public education (in Portuguese) (1999) Informática Pública, 1 (2), pp. 139-156; Reed, A.M., (2000) Rethinking development as knowledge: Implications for human development (Technical Report), , Rome: United Nations Office for Project Services; Sagasti, F.R., (2004) Knowledge and Innovation for Development: The Sisyphus Challenge of the 21st Century., , Cheltenham, UK; Northhampton, MA: Edward Elgar; Silva, T.E.P.P., Ottoni, M.V., (1995) In The importance of cartography for the success of GIS deployment in the city of Belo Horizonte (in Portuguese), pp. 864-873. , Paper presented at the XVII Brazilian Cartographic Conference, Salvador (BA); Sousa, R.P., Bretas, N.L., (1994) In GIS in the surveillance of infant mortality of poor areas in a two-million-people city, 2, p. 1. , Paper presented at the Urban and Regional Information Systems Association Annual Conference (URISA’94), Milwaukee, Wisconsin; (1999) World Development Report-Knowledge for Development., , New York: Oxford University Press; Zuppo, C.A., Davis, C.A., Jr., Meirelles, A.C., (1996) In GIS in the transportation and traffic systems of Belo Horizonte (in Portuguese), pp. 376-387. , Paper presented at the GIS Brasil 96, Curitiba (PR)",Book Chapter,Scopus
