Authors,Title,Year,Source title,Link,References,Document Type,Source
"Miscione G.","Telemedicine in the upper Amazon: Interplay with local health care practices",2007,"MIS Quarterly: Management Information Systems","https://www.scopus.com/inward/record.uri?eid=2-s2.0-34249311315&doi=10.2307%2f25148797&partnerID=40&md5=8554af1d9184126a62850fa94d68daf6","Avgerou, C., (2000) Information Systems and Global Diversity, , Oxford University Press, Oxford; Avgerou, C., IT as an Institutional Actor in Developing Countries (2003) The Digital Challenge: Information Technology in the Development Context, pp. 46-62. , S. Krishna and S. Madon eds, Ashgate, Burlington, VT; Avgerou, C., Recognising Alternative Rationalities in the Deployment of Information Systems (2000) Electronic Journal of Information Systems in Developing Countries, 3 (7), pp. 1-15; Cernea, M., Social Organization and Development Anthropology (1996) Malinowski Award Lecture, , World Bank, Washington, DC; Ciborra, C., Braa, K., Cordella, A., Dahlbom, B., (2000) From Control to Drift: The Dynamics of Corporate Information Infrastructures, , Oxford University Press, Oxford; Ciminelli, M.L., Il concetto di salute nelle società tradizionali (2002) L'arco di Giano, 6, pp. 65-75; Coulon, A., (1995) Ethnomethodology, , Sage Publications, London; Czarniawska, B., (1997) Narrating the Organization: Dramas of Institutional Identity, , University of Chicago Press, Chicago; (1990) Innovative Approaches to Institution-Building: The Local Resource Management Project, National Economic and Development Authority, , Development Vision and Strategies Foundation, Inc, Manila; Foucault, M., (1975) The Birth of the Clinic: An Archaeology of Medical Perception, , Vintage, New York; Galaskiewcz, J., Making Corporate Actors Accountable: Institution-Building in Minneapolis-St.Paul (1991) The New Institutionalism in Organizational Analysis, pp. 293-310. , W. Powell and P. J. DiMaggio eds, The University of Chicago Press, Chicago; Garfinkel, H., (1967) Studies in Ethnometodology, , Blackwell Publishing, Oxford; Good, B.J., (1994) Medicine, Rationality, and Experience, , Cambridge University Press, New York; Heeks, R., (2004) eGovernment as a Carrier of Context, , Institute for Development Policy and Management University of Manchester, Precinct Centre, Manchester, England; Heeks, R., Mundy, D., Salazar, A., (1999) Why Health Care Information Systems Succeed or Fail, , Paper No. 9, Institute for Development Policy and Management University of Manchester, Precinct Centre, Manchester, England, June; Jepperson, R.L., Institutions, Institutional Effects, and Institutionalism (1991) The New Institutionalism in Organizational Analysis, pp. 143-163. , W. Powell and P. J. DiMaggio eds, The University of Chicago Press, Chicago; Manca, M.C., Medicina tradizionale e medicina allopatica: Per un nuovo modello di intervento medico in Chiapas, Messico (2003) L'arco di Giano, 37; (1998) Knowledge Societies: Information Technology for Sustainable Development, , Mansell, R, and Wehn, U, eds, United Nations Commission on Science and Technology for Development. Oxford, published for and on behalf of the United Nations by Oxford University Press, New York; Powell, W., DiMaggio, P.J., The Iron Cage Revisited: Institutional Isomorphism and Collective Rationality in Organizational Fields (1991) The New Institutionalism in Organizational Analysis, pp. 63-82. , W. Powell and P. J. DiMaggio eds, The University of Chicago Press, Chicago; Sosa-Iudicissa, M.C., (1995) Health, Information Society and Developing Countries, , IOS Press, Amsterdam; Suchman, L., Located Accountabilities in Technology Production (2002) Scandinavian Journal of Information Systems, 14 (2), pp. 91-105; Suchman, L., Technologies of Accountability: On Lizards and Airplanes (1993) Technology in Working Order, pp. 113-126. , G. Button ed, Routledge, London; (1982) Elements of Institution-Building for Institutes of Public Administration and Management, , United Nations Department of Technical Cooperation for Development, United Nations, New York; (2001) Human Development Report 2001, , UNDP, Making New Technologies Work for Human Development, United Nations Development Programme, Oxford University Press, New York; Walsham, G., Sahay, S., GIS for District Level Administration in India: Problems and Opportunities (1999) MS Quarterly, 23 (1), pp. 39-66. , March; (1999) World Development Report 1998/99: Knowledge for Development, , World Bank, Oxford University Press, Oxford, England; Zucker, L.G., The Role of Institutionalization in Cultural Persistence (1991) The New Institutionalism in Organizational Analysis, pp. 83-107. , W. Powell and P. J. DiMaggio eds, The University of Chicago Press, Chicago",Article,Scopus
"Zhu K., Kraemer K.L.","Post-adoption variations in usage and value of e-business by organizations: Cross-country evidence from the retail industry",2005,"Information Systems Research","https://www.scopus.com/inward/record.uri?eid=2-s2.0-18944378896&doi=10.1287%2fisre.1050.0045&partnerID=40&md5=bf3e6f01a97b03497b18a971105cbcf6","Amit, R., Zott, C., Value creation in e-business (2001) Strategic Management J., 22 (6-7), pp. 493-520; Austin, J.E., (1990) Managing in Developing Countries, , The Free Press, New York; Bakos, Y., The emerging role of electronic marketplaces on the Internet (1998) Comm. ACM, 41 (8), pp. 35-42; Barney, J.B., Firm resources and sustained competitive advantage (1991) J. Management, 17 (1), pp. 99-120; Baroudi, J.J., Orlikowski, W.J., The problem of statistical power in MIS research (1989) MIS Quart., 13 (1), pp. 87-106; Barua, A., Mukhopadhyay, T., Information technology and business performance: Past, present and future (2000) Framing the Domains of IT Management: Projecting the Future Through the Past, , R. W. Zmud, ed. Pinnaflex Education Resources, Inc., Cincinnati, OH; Barua, A., Kriebel, H.C., Mukhopadhyay, T., Information technology and business value: An analytic and empirical investigation (1995) Inform. Systems Res., 6 (1), pp. 3-23; Barua, A., Konana, P., Whinston, A.B., Yin, F., Driving e-business excellence (2001) Sloan Management Rev., 34 (1), pp. 36-44; Benbasat, I., Weber, R., Research commentary: Rethinking ""diversity"" in information systems research (1996) Inform. Systems Res., 7 (4), pp. 389-398; Bharadwaj, A., A resource-based perspective on IT capability and firm performance: An empirical investigation (2000) MIS Quart., 24 (1), pp. 169-196; Boes, D.C., Graybill, F.A., Mood, A.M., (1974) Introduction to the Theory of Statistics, 3rd Ed., , McGraw-Hill, New York; Brynjolfsson, E., Kahin, B., (2000) Understanding the Digital Economy, , MIT Press, Cambridge, MA; Carr, N.G., IT doesn't matter (2003) Harvard Bus. Rev., 81 (5), pp. 41-49; Caselli, F., Coleman II, W.J., Cross-country technology diffusion: The case of computers (2001) The Amer. Econom. Rev., 91 (2), pp. 328-335; Chatterjee, D., Grewal, R., Sambamurthy, V., Shaping up for e-commerce: Institutional enablers of the organizational assimilation of Web technologies (2002) MIS Quart., 26 (2), pp. 65-89; Chau, P.Y.K., Tam, K.Y., Factors affecting the adoption of open systems: An exploratory study (1997) MIS Quart., 21 (1), pp. 1-21; Chin, W.W., Issues and opinion on structure equation modeling (1998) MIS Quart., 22 (1), pp. vii-xvi; Clemons, E.K., Row, M.C., Sustaining IT advantage: The role of structural differences (1991) MIS Quart., 15 (3), pp. 275-292; Cooper, R.B., Zmud, R.W., Information technology implementation research: A technological diffusion approach (1990) Management Sci., 36 (2), pp. 123-139; Damanpour, F., Organizational size and innovation (1992) Organ. Stud., 13 (3), pp. 375-402; Damanpour, F., Organizational complexity and innovation: Developing and testing multiple contingency models (1996) Management Sci., 42 (5), pp. 693-716; Dasgupta, S., Agarwal, D., Ioannidis, A., Gopalakrishnan, S., Determinants of information technology adoption: An extension of existing models to firms in a developing country (1999) J. Global Inform. Management, 7 (3), pp. 41-49; Dedrick, J., Gurbaxani, V., Kraemer, K.L., Information technology and economic performance: A critical review of the empirical evidence (2003) ACM Comput. Surveys, 35 (1), pp. 1-28; Delone, W.H., McLean, E.R., Information systems success: The quest for the dependant variable (1992) Inform, Systems Res., 3 (1), pp. 60-95; Devaraj, S., Kohli, R., Performance impacts of information technology: Is actual usage the missing link? (2003) Management Sci., 49 (3), pp. 273-289; Dewan, S., Kraemer, K.L., Information technology and productivity: Evidence from country-level data (2000) Management Sci., 46 (4), pp. 548-562; Dewan, S., Michael, S., Min, C., Firm characteristics and investments in information technology: Scale and scope effects (1998) Inform. Systems Res., 9 (3), pp. 219-232; Dos Santos, B., Peffers, K., Competitor and vendor influence on the adoption of innovative applications in electronic commerce (1998) Inform. Management, 34 (3), pp. 175-184; Ernst, D.A.H., Digital information systems and global flagship networks (2003) The Industrial Dynamics of the New Digital Economy, , J. F. Christensen, ed., Edward Elgar, Cheltenham, UK; Fichman, R.G., The diffusion and assimilation of information technology innovations (2000) Framing the Domains of IT Management: Projecting the Future Through the Past, , R. Zmud, ed., Pinnaflex Publishing, Cincinnati, OH; Fichman, R.G., Kemerer, C., The assimilation of software process innovation: An organizational learning perspective (1997) Management Sci., 43 (10), pp. 1345-1363; Fornell, C., Larcker, D.F., Evaluating structural equation models with unobserved variables and measurement errors (1981) J. Marketing Res., 18 (1), pp. 39-50; Greenspan, A., (2002) Federal Reserve Board's Semiannual Monetary Policy Report to the Congress, , www.federalreserve.gov/boarddocs/hh/2002/march/testimony.htm; Grover, V., An empirically derived model for the adoption of customer-based interorganizational systems (1993) Decision Sci., 24 (3), pp. 603-640; Hart, P.J., Saunders, C.S., Emerging electronic partnerships: Antecedents and dimensions of EDI use from the supplier's perspective (1998) J. Management Inform. Systems, 14 (4), pp. 87-111; Hitt, L., Information technology and firm boundaries: Evidence from panel data (1999) Inform. Systems Res., 10 (2), pp. 134-149; Iacovou, C.L., Benbasat, I., Dexter, A.S., Electronic data interchange and small organizations: Adoption and impact of technology (1995) MIS Quart., 19 (4), pp. 465-485; (2002) Worldwide Black Book, , International Data Corporation, Framingham, MA; Jarvenpaa, S., Leidner, D., An information company in Mexico: Extending the resource-based view of the firm to a developing country context (1998) Inform. Systems Res., 9 (4), pp. 342-361; Johnson, B., Retail: The Wal-mart effect (2002) The McKinsey Quart., 1, pp. 40-43; Kaplan, D., Statistical power in structure equation modeling (1995) Structural Equation Modeling, Concepts, Issues, and Applications, pp. 100-117. , R. H. Hoyle, ed. Sage, Thousand Oaks, CA; Kraemer, K.L., Dedrick, J., Payoffs from investment in information technology: Lessons from the Asia-pacific region (1994) World Development, 22 (12), pp. 1921-1931; Kwon, T.H., Zmud, R.W., Unifying the fragmented models of information systems implementation (1987) Critical Issues in Information Systems Research, pp. 227-251. , R. J. Boland, R. A. Hirschheim, eds. John Wiley, New York; Lee, H., Padmanabhan, V., Whang, S., Information distortion in a supply chain: The bullwhip effect (1997) Management Sci., 43 (4), pp. 546-558; MacCallum, R.C., Browne, M.W., Sugawara, H.M., Power analysis and determination of sample size for covariance structure modeling (1996) Psych. Methods, 1 (2), pp. 130-149; Malone, T., Laubacher, R., The dawn of the e-lance economy (1998) Harvard Bus. Rev., 76 (5), pp. 145-152; Marsh, H., Hocevar, D., A new, more powerful approach to multitrait-multimethod analyses: Application of second-order confirmatory factor analysis (1985) J. Appl. Psych., 73 (1), pp. 107-117; Martinsons, M.G., Martinsons, V., Rethinking the value of IT, again (2002) Comm. ACM, 45 (7), pp. 25-26; Mata, F., Fuerst, W., Barney, J., Information technology and sustained competitive advantage: A resource-based analysis (1995) MIS Quart., 19 (4), pp. 487-505; (2002) U.S. Productivity Report: 1995-2000, , www.mckinsey.com/knowledge; Milgrom, P., Roberts, J., The economics of modern manufacturing: Technology, strategy, and organization (1990) Amer. Econom. Rev., 80 (3), pp. 511-528; Mukhopadhyay, T., Kekre, S., Kalathur, S., Business value of information technology: A study of electronic data interchange (1995) MIS Quart., 19 (2), pp. 137-156; Nord, W., Tucker, S., (1987) Implementing Routine and Radical Innovation, , Lexington Books, Lexington, MA; Oxley, J.E., Yeung, B., E-commerce readiness: Institutional environment and international competitiveness (2001) J. Internat. Bus. Stud., 32 (4), pp. 705-723; Peteraf, M.A., The cornerstones of competitive advantage: A resource-based view (1993) Strategic Management J., 14 (3), pp. 179-191; Podsakoff, P.M., MacKenzie, S., Lee, J.-Y., Podskoff, N., Common method biases in behavior research: A critical review of the literature and recommended remedies (2003) J. Appl. Psych., 88 (5), pp. 879-903; Pohjola, M., Information technology and economic growth: A cross-country analysis (2001) Information Technology and Economic Development, pp. 242-256. , M. Pohjola, ed. Oxford University Press, Oxford, UK; Porter, M., Strategy and the Internet (2001) Harvard Bus. Rev., 79, pp. 63-78; Porter, M., Millar, V., How information gives you competitive advantage (1985) Harvard Bus. Rev., 63 (4), pp. 149-160; Ramamurthy, K., Premkumar, G., Crum, M.R., Organizational and interorganizational determinants of EDI diffusion and organizational performance: A cause model (1999) J. Organ. Cornput. Electronic Commerce, 9 (4), pp. 253-285; Rogers, E.M., (1983) Diffusion of Innovations, 3rd Ed., , Free Press, New York; Rosenzweig, P.M., When can management science research be generalized internationally? (1994) Management Sci., 40 (1), pp. 28-39; Ross, J., Beath, C., Goodhue, D., Develop long-term competitiveness through IT assets (1996) Sloan Management Rev., 38 (1), pp. 31-42; Sethi, V., King, W.R., Development of measures to assess the extent to which an information technology application provides competitive advantage (1994) Management Sci, 40 (12), pp. 1601-1627; Shapiro, C., Varian, H., (1999) Information Rules: A Strategic Guide to the Network Economy, , Harvard Business School Press, Boston, MA; Shih, E., Dedrick, J., Kraemer, K.L., International diffusion of e-commerce: Impacts of rule of law and access cost (2005) Comm. ACM, , Forthcoming; Slaughter, S., Ang, S., Employment structures of information systems personnel: A comparative study of the U.S. and Singapore (1995) Inform. Tech. People, 8 (2), pp. 17-36; Soh, C., Markus, M.L., How IT creates business value: A process theory synthesis (1995) Proc. 16th Internat. Conf. Inform. Systems, , G. Ariav, C. Beath, J. DeGross, R. Hoyer, C. F. Kemerer, eds., Association for Information Systems, Amsterdam; Steinfield, C., Adelaar, T., Lai, Y., Integrating brick and mortar locations with e-commerce: Understanding synergy opportunities (2002) Proc. Hawaii Internat. Conf. System Sci., , Big Island, Hawaii; Steward, K.A., Segars, A.H., An empirical examination of the concern for information privacy instrument (2002) Inform. Systems Res., 13 (1), pp. 36-49; Straub, D., Validating instruments in MIS research (1989) MIS Quart., 13 (2), pp. 147-169; Straub, D., Hoffman, D., Weber, B., Steinfield, C., Toward new metrics for Net-enhanced organizations (2002) Inform. Systems Res., 13 (3), pp. 227-238; Swanson, E.B., Information systems innovation among organizations (1994) Management Sci., 40 (9), pp. 1069-1092; Teece, D.J., Economics of scope and the scope of the enterprise (1980) J. Econom. Behavior Organ., 1 (2), pp. 223-247; Teo, H.H., Wei, K.K., Benbasat, I., Predicting intention to adopt interorganizational linkages: An institutional perspective (2003) MIS Quart., 27 (1), pp. 19-49; Thong, J.Y.L., An integrated model of information systems adoption in small business (1999) J. Management Inform. Systems, 15 (4), pp. 187-214; Tornatzky, L.G., Fleischer, M., (1990) The Processes of Technological Innovation, , Lexington Books, Lexington, MA; Tornatzky, L.G., Klein, K., Innovation characteristics and innovation adoption-implementation: A meta-analysis of findings (1982) IEEE Trans. Engrg. Management, 29 (1), pp. 28-45; Treacy, M., Wiersema, F., Customer intimacy and other value disciplines (1993) Harvard Bus. Rev., 71 (1), pp. 84-93; Umanath, N.S., Campbell, T.L., Differential diffusion of information systems technology in multinational enterprises: A research model (1994) Inform. Resources Management J., 7 (1), pp. 6-18; Venkatraman, N., Zaheer, A., Electronic integration and strategic advantage: A quasi-experimental study in the insurance industry (1990) Inform. Systems Res., 1 (4), pp. 377-393; Weill, P., Broadbent, M., (1998) Leveraging the New Infrastructure: How Market Leaders Capitalize on Information Technology, , Harvard Business School Press, Cambridge, MA; Welty, B., Becerra-Fernandez, I., Managing trust and commitment in collaborative supply chain relationships (2001) Comm. ACM, 44 (6), pp. 67-73; Williamson, O.E., Organizational innovation: The transaction cost approach (1983) Entrepreneurship, pp. 101-133. , J. Ronen, ed. Lexington Books, Lexington, MA; Xu, S., Zhu, K., Gibbs, J., Global technology, local adoption: A cross-country investigation of Internet adoption by companies in the United States and China (2004) Electronic Markets, 14 (1), pp. 13-24; Zhu, K., Information transparency of business-to-business electronic markets: A game-theoretic analysis (2004) Management Sci., 50 (5), pp. 670-685; Zhu, K., The complementarity of information technology infrastructure and e-commerce capability: A resource-based assessment of their business value (2004) J. Management Inform. Systems, 21 (1), pp. 167-202; Zhu, K., Kraemer, K.L., E-commerce metrics for Net-enhanced organizations: Assessing the value of e-commerce to firm performance in the manufacturing sector (2002) Inform. Systems Res., 13 (3), pp. 275-295; Zhu, K., Kraemer, K.L., Xu, S., Electronic business adoption by European firms: A cross-country assessment of the facilitators and inhibitors (2003) Eur. J. Inform. Systems, 12 (4), pp. 251-268; Zhu, K., Kraemer, K.L., Xu, S., Dedrick, J., Information technology payoff in e-business environments: An international perspective on value creation of e-business in the financial services industry (2004) J. Management Inform. Systems, 21 (1), pp. 17-54",Review,Scopus
"He X.","The ERP challenge in China: A resource-based perspective",2004,"Information Systems Journal","https://www.scopus.com/inward/record.uri?eid=2-s2.0-2142722207&doi=10.1111%2fj.1365-2575.2004.00168.x&partnerID=40&md5=22422dfb49ea1d172a73ef1dd6d50d40","Akkermans, H., Helden, K., Vicious and virtuous cycles in ERP implementation: A case study of interrelations between critical success factors (2002) European Journal of Information Systems, 11, pp. 35-46; ERP losing favor as businesses re-evaluate what to target - SCM, CRM software now more in demand (2001) Electronic Buyers' News, , http://www.ebnonline.com, [WWW document], 4 June; Barney, J., Firm resources and sustained competitive advantage (1991) Journal of Management, 17, pp. 99-120; Bharadwaj, A., A resource-based perspective on information technology capability and firm performance: An empirical investigation (2000) MIS Quarterly, 24, pp. 169-196; Bingi, P., Sharma, M.K., Godla, J.K., Critical issues affecting an ERP implementation (1999) Information Systems Management, 16, pp. 7-14; Getting value from enterprise initiatives: A survey of executives (2000) BCG Report, , March; Capon, N., Glazer, R., Marketing and technology: A strategic coalignment (1987) Journal of Marketing, 51, pp. 1-14; 2000-2001 Enterprise commerce management application software market report (2001) CCID Report, , June; Cliffe, S., ERP implementation (1999) Harvard Business Review, 77, pp. 16-17; ERP trends (2001) Research Report 1292-01-RR, , 1 June 2001; Conner, K., A historical comparison of the resource-based theory and five schools of thought within industrial organization economics: Do I have a new theory of the firm? (1991) Journal of Management, 17, pp. 121-154; Copeland, D.G., McKenney, J.L., Airline reservation systems: Lessons from history (1988) MIS Quarterly, 12, pp. 353-370; Cronbach, L., Coefficient alpha and the internal structure of tests (1951) Psychometrika, 16, pp. 297-334; Davenport, T., Putting the enterprise into the enterprise system (1998) Harvard Business Review, 16, pp. 121-131; ERP's second wave: Maximizing the value of ERP-enabled processes (1999) Deloitte Consulting Report; Everdinggen, Y., Hillegersberg, J., Waarts, E., ERP adoption by European midsize companies (2000) Communications of the ACM, 43, pp. 27-31; Fan, M., Stalert, J., Whinston, A., The adoption and design methodologies of component-based enterprise systems (2000) European Journal of Information Systems, 9, pp. 25-35; Graver, V., Jeong, S., Kettinger, W., Teng, J., The implementation of business process reengineering (1995) Journal of Management Information Systems, 12, pp. 109-144; Hair, J., Anderson, R., Tatham, R., (1987) Multivariate Data Analysis with Readings, , Macmillan, New York; Hayes, D., Hunton, J., Reck, J., Market reaction to ERP implementation announcements (2001) Journal of Information Systems, 15, pp. 3-18; Holland, C., Light, B., A critical success factors model for ERP implementation (1999) IEEE Software, 16, pp. 30-36; ERP market trends in China (2001) IDC Research Report, CN380209H. , May; Kogut, B., Joint ventures: Theoretical and empirical perspectives (1988) Strategic Management Journal, 9, pp. 319-332; Liu, B., Zhou, Y., ERP and its application in Mainland China (2001) Proceedings of the 1st International Conference on Electronic Business, , CD-ROM; Mabert, V., Soni, A., Venkaramanan, M., Enterprise resource planning survey of U.S. manufacturing firms (2000) Production and Inventory Journal, 41, pp. 52-58; Mate, F.J., Fuerst, W.L., Barney, J.B., Information technology and sustained competitive advantage: A resource-based analysis (1995) MIS Quarterly, 19, pp. 487-505; Nah, F.F., Lau, J.L., Critical factors for successful implementation of enterprise systems (2001) Business Process Management Journal, 7, pp. 285-296; Norris, G., Hurley, J., Hartley, K., Dunleavy, J., Balls, J., (2000) E-business and ERP: Transforming the Enterprise, , John Wiley & Sons, New York, NY; Palaniswamy, R., Frank, T., Enhancing manufacturing performance with ERP systems (2000) Information Systems Management, 17, pp. 43-55; Peteraf, M., The cornerstones of competitive advantage: A resource-based view (1993) Strategic Management Journal, 14, pp. 179-191; Porter, M.E., (1980) Competitive Strategy: Techniques for Analyzing Industries and Competitors, , Free Press, New York, NY; Porter, M.E., (1985) Competitive Advantage: Creating and Sustaining Superior Performance, , Free Press, New York, NY; Porter, M.E., Millar, V.E., How information gives you competitive advantage (1985) Harvard Business Review, 63, pp. 149-160; Reed, R., DeFillippi, R.J., Casual ambiguity, barriers to limitation and sustainable competitive advantage (1990) Academy of Management Review, 15, pp. 88-102; Ricadela, A., Maselli, J., Big ERP vendors haven't done well in the midmarket. Can Microsoft do better? (2002) Informationweek, , May; Ross, J.W., Beath, C.M., Goodhue, D.L., Develop long-term competitiveness through IT assets (1996) Sloan Management Review, 38, pp. 31-45; Rumelt, R.P., Schendel, D., Teece, D.J., Strategic management and economics (1991) Strategic Management Journal, 12, pp. 5-29; Son, C., Kien, S., Tay-Yap, J., Cultural fits and misfits: Is ERP a universal solution (2000) Communications of the ACM, 43, pp. 47-51; Somers, T., Nelson, K., The impact of critical success factors across the stages of enterprise resource planning implementations (2001) Proceedings of the 34th Hawaii International Conference on Systems Sciences, , CD-ROM; Sprott, D., Componentizing the enterprise application packages (2000) Communications of the ACM, 43, pp. 63-69; Teece, D.J., Capturing value from knowledge assets: The new economy, markets for know-how, and intangible assets (1998) California Management Review, 40, pp. 55-79; Vergin, R.C., Qoronfleh, M.W., Corporate reputation and the stock market (1998) Business Horizons, 41, pp. 19-26; Weill, P., Broadbent, M., Butler, C., Exploring how firms view IT infrastructure (1996) Working Paper, , The University of Melbourne",Review,Scopus
