Authors,Title,Year,Source title,Link,References,Document Type,Source
"Sahay S., Monteiro E., Aanestad M.","Toward a political perspective of integration in information systems research: The case of health information systems in India",2009,"Information Technology for Development","https://www.scopus.com/inward/record.uri?eid=2-s2.0-67650269430&doi=10.1002%2fitdj.20119&partnerID=40&md5=a3e762c4d9a241e357bea1ed1c07bc05","Braa, J., Monteiro, E., Sahay, S., Networks of action: Sustainable health information systems across developing countries (2004) MIS Quarterly, 28 (3), pp. 337-362; Chari, K., Seshadri, S., Demystifying integration (2004) Communication of the ACM, 47 (7), pp. 59-63; Chilundo, B., Aanestad, M., Negotiating multiple rationalities in the process of integrating the information systems of disease-specific health programmes (2005) Electronic Journal of Information Systems in Developing Countries, 20 (2), pp. 1-28; Cox, B., Ghoneim, S., Strategic use of EDI in the public sector: The HSMO case study (1998) Journal of Strategic Information Systems, 7, pp. 37-51; de Laet, M., Mol, A., The Zimbabwe bush pump (2000) Social Studies of Science, 30 (2), pp. 225-263; Goodhue, D.L., Wybo, M.D., Kirsch, L.J., The impact of data integration on the costs and benefits of information systems (1992) MIS Quarterly, 16 (3), pp. 293-311; Grimson, J., Grimson, W., Hasselbring, W., TheSIchallengeinhealthcare (2000) Communications of the ACM, 43 (4), pp. 48-55; Hanseth, O., Ciborra, C., Braa, K., The control devolution. ERP and the side effects of globalization. The Data Base for Advances in Information Systems (2001) Special Issue: Critical Analysis of ERP Systems: The Macro Level, 32 (4), pp. 34-46. , Fall; Hanseth, O., Jacucci, E., Grisot, M., Aanestad, M., Reflexive standardization: Side effects and complexity in standard making (2006) MIS Quarterly, 30, pp. 563-581; Hasselbring, W., Information systems integration (2000) Communications of the ACM, 43 (4), pp. 32-38; Kallinikos, J., Deconstructing information packages: Organizational and behavioural implications of ERP systems (2004) Information Technology & People, 17 (1), pp. 8-30; Kumar, K., van Hillegersberg, J., ERP experiences and evolution (2000) Communications of the ACM, 43 (4), pp. 23-26; Latour, B., (1987) Science in Action, , Cambridge, MA: Harvard University Press; Markus, M.L., Viewpoint. Reflections on the systems integration enterprise (2001) Business Process Management Journal, 7 (3), pp. 171-180; McNurlin, B., Sprague, M., (2004) Information Systems Management in Practice, , (6th ed.). Upper Saddle River, NJ: Prentice Hall; Perrow, C., (1984) Normal accidents: Living with High-risk Technologies, , New York: Basic Books; Pollock, N., Cornford, J., ERP systems and the university as a unique organization (2004) Information Technology & People, 17 (1), pp. 17-32; Puri, S., Byrne, E., Nhampossa, J.L., Qureishi, Z., Contextuality of participation in IS design. A developing country perspective (2004) In Proceedings of the Participatory Design Conference, pp. 42-52. , Toronto, Canada; Rolland, K.H., (2006) The dynamics of Integrated Information Systems Implementation: Unintended Consequences Revisited, , Manuscript submitted for publication; Shidende, N., Challenges and approaches to the integration of HIS: Case studies from Tanzania (2005), http://www.duo.uio.no/publ/informatikk/2005/34905/IntegrationHISTanzania.pdf, Master'sthesis, Department of Informatics, University of Oslo. Available at; Silva, L.O., Outsourcing as an improvisation: A case study in Latin America (2002) Information Society, 18 (2), pp. 129-138; Singletary, L.A., Applications integration: Is it always desirable? (2004) Proceedings of The 37th Hawaii International Conference on Systems Sciences, IEEE; Spinardi, G., Graham, I., Williams, R., EDI in the Scottish Health Service: Inter-organisational systems and interorganisational change (1997) Journal of Strategic Information Systems, 6, pp. 251-263; Webster, J., Networks of collaboration or conflict? Electronic data interchange and power in the supply chain (1995) Journal of Strategic Information Systems, 4 (1), pp. 31-42; Zuboff, S., (1988) In the Age of the Smart Machine: The Future of Work and Power, , New York: Basic Books",Article,Scopus
"Madon S., Reinhard N., Roode D., Walsham G.","Digital inclusion projects in developing countries: Processes of institutionalization",2009,"Information Technology for Development","https://www.scopus.com/inward/record.uri?eid=2-s2.0-67650251262&doi=10.1002%2fitdj.20108&partnerID=40&md5=be49db5f226d95481aff9b02836abd8b","Avgerou, C., (2002) Information Systems and Global Diversity, , Oxford: Oxford University Press; Bada, A.O., Strategic and institutional response to the digital challenge: A perspective on how global IT trends are expressed in developing countries (2003) The Digital Challenge: Information Technology in the Development Context, pp. 279-294. , In S. Krishna & S. Madon (Eds.), Aldershot: Ashgate Publishing; Castells, M., (1998) End of Millennium, , Oxford: Blackwell; diMaggio, P.J., Powell, W.W., The iron cage revisited: Institutional isomorphism and collective rationality in organizational fields (1983) American Sociological Review, 48 (2), pp. 147-160; Greenwood, R., Hinings, C.R., Understanding radical organizational change: Bringing together the old and the new institutionalism (1996) Academy of Management Review, 21 (4), pp. 1022-1054; Harris, R.W., Kumar, A., Balaji, V., Sustainable telecentres? Two cases from India (2003) The Digital Challenge: Information Technology in the Development Context, pp. 124-135. , In S. Krishna & S. Madon (Eds.), Aldershot: Ashgate Publishing; Hunt, P., True stories: Telecentres in Latin America and the Caribbean (2001) Electronic Journal of Information Systems in Developing Countries, 4 (5), pp. 1-17; Kanungo, S., Information village: Bridging the digital divide in rural India (2003) The Digital Challenge: Information Technology in the Development Context, pp. 103-123. , In S. Krishna & S. Madon (Eds.), Aldershot: Ashgate Publishing; Macadar, M.A., (2004) Digital Inclusion in Brazil: The Telecentre Management Process, , Unpublished doctoral dissertation (in Portuguese), University of São Paulo, Brazil; Macadar, M.A., Reinhard, N., Governance and management in the São Paulo telecentre network (2006) Information Technology for Development, 12 (3), pp. 241-246; Madon, S., Evaluating the developmental impact of e-governance initiatives: An exploratory framework (2005) Electronic Journal of Information Systems in Developing Countries, 20 (5), pp. 1-13; Madon, S., Governance lessons from the experience of telecentres in Kerala (2005) European Journal of Information Systems, 14 (4), pp. 401-416; Meyer, J.W., Rowan, B., Institutionalized organizations: Formal structure as myth and ceremony (1977) American Journal of Sociology, 83 (2), pp. 340-363; Miscione, G., Telemedicine in the Upper Amazon: Interplay with local health care practices (2007) MIS Quarterly, 31 (2), pp. 403-425; Noir, C., Walsham, G., The great legitimizer: ICT as myth and ceremony in the Indian healthcare sector (2007) Information Technology and People, 20 (4), pp. 313-333; Oliver, C., The antecedents of deinstitutionalization (1992) Organization Studies, 13 (4), pp. 563-588; (2008) Community-driven Projects: Reflections on a Success Story-A case Study of Science Education and Information Technology in South Africa, , Phahlamohlaka, J., Braun, M, Romijn, H., & Roode, D., (Eds.), Pretoria, South Africa: Van Schaik; Roode, D., Speight, H., Pollock, M., Webber, R., It's not the digital divide, it's the socio-techno divide! (2004) In Proceedings of the 12th European Conference on Information Systems, , Turku, Finland; Reilly, K., Gómez, R., Comparing approaches: Telecentre evaluation experiences in Asia and Latin America (2001) Electronic Journal of Information Systems in Developing Countries, 4 (3), pp. 1-17; Sahay, S., Walsham, G., Scaling of health information systems in India: Challenges and approaches (2006) Information Technology for Development, 12 (3), pp. 185-200; Salvador, T., Sherry, J.W., Urrutia, A.E., Less cyber, more café: Enhancing existing small businesses across the digital divide with ICTs (2005) Information Technology for Development, 11 (1), pp. 77-95; Scott, R.W., (2001) Institutions and Organizations, , 2nd ed.). London: Sage; Silva, L., Figueroa, E.B., Institutional intervention and the expansion of ICTs in Latin America: The case of Chile (2002) Information Technology and People, 15 (1), pp. 8-25; (2006) Social Inclusion: Societal and Organizational Implications for Information Systems, , Trauth, E.M., Howcroft, D., Butler, T., Fitzgerald, B., & DeGross, J.I. (Eds.), New York: Springer; Walsham, G., Sahay, S., Research on information systems in developing countries: Current landscape and future prospects (2006) Information Technology for Development, 12 (1), pp. 7-24; Warschauer, M., (2003) Technology and Social Inclusion: Rethinking the Digital Divide, , Boston: MIT Press",Article,Scopus
"Igira F.T.","The situatedness of work practices and organizational culture: Implications for information systems innovation uptake",2008,"Journal of Information Technology","https://www.scopus.com/inward/record.uri?eid=2-s2.0-44349176935&doi=10.1057%2fpalgrave.jit.2000132&partnerID=40&md5=6957bc61cc4882f364fe4badbfc4ca81","Aunger, R., On Ethnography: Storytelling or science? (1995) Current Anthropology, 36 (1), pp. 97-130; Avison, D.E., Myers, M.D., Information Systems and Anthropology: An anthropological perspective on IT and organizational culture (1995) Information Technology and People, 8 (3), pp. 43-56; Bardram, J.E., Plans as Situated Action: An activity theory approach to workflow systems (1997) Proceedings of the Fifth European Conference on Computer Supported Cooperative Work, pp. 17-32. , Lancaster, UK, Dordrecht: Kluwer Academic Publisher; Barley, S.R., Technology as an Occasion for Structuring: Evidence from observations of CT scanners and the social order of radiology departments (1986) Administrative Science Quarterly, 31 (1), pp. 78-108; Bednar, P.M. and Welch, C. (2007). Contextual Analysis as Support for Successful Innovation in Complex Environments, in T. McMaster, D. Wastell, E. Fernely and J.I. DeGross (eds.) IFIP International Federation for Information Processing, 235, Organizational Dynamics of Technology-Based Innovation: Diversifying the Research Agenda, Boston: Springer, pp. 149-161; Blackler, F., Crump, N., McDonald, S., Organizing Processes in Complex Activity Networks (2000) Organization Science, 7 (2), pp. 277-300; Bødker, S., (1991) Through the Interface: A human activity approach to user interface design, , Mahwah, USA: Lawrence Erlbaum Associates; Braa, J., Hedberg, C., The Struggle for District-Based Health Information Systems in South Africa (2002) The Information Society, 18 (2), pp. 113-127; Braa, J., Muquinge, H., Building Collaborative Networks in Africa on Health Information Systems and Open Source Software Development - Experiences from the HISP/Beanish Network (2007) HELINA 2007 - eHealth in Africa, , http://www.sim.hcuge.ch/helina/50.pdf, Bamako, Mali, accessed 28th January 2008; Braa, J., Monteiro, E., Sahay, S., Networks of Action: Sustainable health information systems across developing countries (2004) MIS Quarterly, 28 (3), pp. 337-362; Bratteteig, T., Gregory, J., Human Action in Context: A discussion of theories for understanding use of IT (1999) Proceedings of the 22nd Information Systems Research Seminar in Scandinavia (IRIS 22): Enterprise architectures for virtual organizations, pp. 161-182. , T. Käkölä ed, Jyväskylä, Finland, Finland: University of Jyväskylä; Cabrera, A., Cabrera, E.F., Barajas, S., The Key Role of Organizational Culture in a Multi-System View of Technology-Driven Change (2001) International Journal of Information Management, 21 (3), pp. 245-261; Cho, S., Mathiassen, L., Robey, D., Dialectics of Resilience: A multilevel analysis of a telehealth innovation (2007) Journal of Information Technology, 22 (1), pp. 24-35; Clancey, W.J., Situated Action: A neuropsychological interpretation (Response to Vera and Simon) (1993) Cognitive Science, 17 (1), pp. 87-107; Crawford, K., Hasan, H., Demonstrations of the Activity Theory Framework for Research in Information Systems (2006) Australasian Journal of Information Systems, 13 (2), pp. 49-68; Doerry, E., Evaluating Distributed Environments Based on Communicative Efficacy (1995) Conference Companion on Human Factors in Computing Systems, CHI, pp. 47-48. , I. Katz, R. Mack and L. Marks (eds, 95 Denver CO, USA, New York: ACM; Dubé, L., Robey, D., Software Stories: Three cultural perspectives on the organizational practices of software development (1999) Accounting, Management and Information Technologies, 9 (4), pp. 223-259; Engeström, Y., (1987) Learning by Expanding: An activity theoretical approach to developmental research, , Helsinki: Orienta Konsultit; Engeström, Y., Communication, Discourse and Activity (1999) The Communication Review, 3 (1-2), pp. 165-185; Engeström, Y., Expansive Visibility of Work: An activity-theoretical perspective, computer supported cooperative work: Special issue on a web on the wind (1999) The Structure of Invisible Work, 8 (1-2), pp. 63-93; Giddens, A., (1993) Sociology, , Cambridge: Polity Press; Groeschl, S., Doherty, L., Conceptualizing Culture, Cross-Cultural Management (2000) An International Journal, 7 (4), pp. 12-17; Grudin, J., The Organizational Contexts of Development and Use (1996) Computing Surveys, 28 (1), pp. 169-171; Hardon, A., Boonmongkon, P., Streefland, P., Tan, M.L., Hongvivatana, T., Geest, S., Staa, A., Chowdhury, M., (2001) Applied Health Research-Manual: Anthropology of health and health care, , Amsterdam: Het Spinhuis Publishers; Hofstede, G., (1991) Cultures and Organizations: Software of the mind, , London: McGraw-Hill; Hofstede, G., Hofstede, G.J., (2005) Cultures and Organizations: Software for the mind, , New York: McGraw-Hill forthcoming; Iivari, J., Linger, H., Knowledge Work as Collaborative Work: A situated activity theory view (1999) Proceedings of the 32nd Hawaii International Conference on System Sciences, pp. 1-10. , Hawaii, USA, Washington DC: IEEE Computer Society; Iivari, N. (2005). The Role of Organizational Culture in Organizational Change - Identifying a realistic position for prospective IS research, in D. Bartmann, F. Rajola, J. Kallinikos, D. Avison, R. Winter, P. Ein-Dor, J. Becker, F. Bodendorf and C. Weinhardt (eds.) Proceedings of the 13th European Conference on Information Systems: Information systems in a rapidly changing economy (Regensburg, Germany, 2005); Germany: Institute for Management of Information Systems, University of Regensburg. 427-438; Kaptelinin, V., Human Computer Interaction in Context: The activity theory perspective (1992) Proceedings of the East-West International Workshop on Human - Computer Interaction, pp. 7-13. , J. Gornostaev (ed, St. Petersburg, Russia, Moscow: International Centre for Scientific and Technical Information ICSTI; Kaptelinin, V., Activity Theory: Implications for human - computer interaction (1996) Context and Consciousness: Activity theory and human - computer interaction, pp. 103-116. , B.A. Nardi ed, Cambridge, MA: MIT Press, pp; Kaptelinin, V., Nardi, B.A., (2006) Acting with Technology: Activity Theory and Interaction Design, , Cambridge MA: MIT Press; Kimaro, H.C., Nhampossa, J.L., Analyzing the Problem of Unsustainable Health Information Systems in Less-Developed Economies: Case studies from Tanzania and Mozambique (2005) Information Technology for Development, 11 (3), pp. 273-298; Korpela, M., Mursu, A., Soriyan, A., Eerola, A., Häkkinen, H. and Toivanen, M. (2004). Information Systems Research and Development by Activity Analysis and Development: Dead horse or the next wave?, in B. M. Kaplan, D.P.T. III, D. Wastell, A.T. Wood-Harper and J.I. DeGross (eds.) Information Systems Research: Relevant theory and informed practice, Proceedings of the IFIP TC8WG 8.2 International Conference (Manchester, United Kingdom, 2004); Boston: Kluwer Academic Publishers. 453-471; Korpela, M., Soriyan, H.A., Olufokunbi, K.C., Activity Analysis as a Method for Information Systems Development (2001) Scandinavian Journal of Information Systems, 12 (1-2), pp. 191-210; Kuutti, K., Activity Theory and its Applications to Information Systems Research and Development (1991) Information Systems Research: Contemporary approaches & emergent traditions, pp. 529-549. , H.-E. Nissen, H.K. Klein and R. Hirschheim eds, Holland: Elsevier Science Publishers, pp; Kuutti, K., Activity Theory as a Potential Framework for Human - Computer Interaction Research (1995) Context and Consciousness: Activity theory and human - computer interaction, pp. 17-44. , B.A. Nardi ed, Cambridge: MIT Press, pp; Kuutti, K., Arvonen, T., Identifying Potential CSCW Applications by Means of Activity Theory Concepts: A case example (1992) Proceedings of the 1992 ACM conference on Computer-supported cooperative work, pp. 233-240. , Toronto, Canada, New York: ACM Press; Laine, S., Social Networks and Organizational Structures During the Implementation Process of an Electronic Patient Record System (2003) 2003 European Computer Supported Cooperative Work Conference (ECSCW'03) Workshop on Social Networks, , http://projects.ischool.washington.edu/mcdonald/ecscw03/papers/laine-ecscw03-ws.pdf, in The, Helsinki, Finland, accessed 28th February 2008; Leont'ev, A.N., (1978) Activity, Consciousness, and Personality, , Prentice-Hall: Englewood Cliffs; Lungo, J.H., (2003) Data Flows in Health Information Systems: An action research study of reporting routine health delivery services and implementation of computer databases in health information systems, , Department of Informatics, University of Oslo, Oslo, Norway. Msc Thesis; Lungo, J.H. (2005). The Potential of District Health Information Software in Tanzania, in Proceedings of the 8th International Working Conference of IFIP WG 9.4: Enhancing Human Resource Development Through ICT (Abuja, Nigeria, 2005); Abuja: IFIPWG9.4. 518-529; Markus, M.L., Power, Politics, and MIS Implementation (1983) Communications of the ACM, 26 (6), pp. 430-444; Mukama, F., (2003) A Study of Health Information Systems at Local Levels in Tanzania and Mozambique: Improving the use and management of information in health districts, , Department of Informatics, University of Oslo, Oslo, Norway. Msc Thesis; Mursu, A., Luukkonen, I., Toivanen, M., Korpela, M., Activity Theory in Information Systems Research and Practice: Theoretical underpinnings for information systems development model (2007) Information Research, 12 (3), p. 311; Mwanza, D., Reflections on Methods for Applying Activity Theory to CSCW Research and Practice - the AODM Approach (2003) 8th European Conference of Computer-Supported Cooperative Work, , http://www.uku.fi/tike/actad/ecscw2003-at/mwanza.pdf, Helsinki, Finland, accessed 28th February 2008; Nardi, B.A., (1996) Context and Consciousness: Activity theory and human - computer interaction, , Cambridge, MA: MIT Press; Nardi, B.A., Studying Context: A comparison of activity theory, situated action models and distributed cognition (1996) Context and Consciousness: Activity theory and human - computer interaction, , B.A. Nardi ed, Cambridge, MA: MIT Press; Nicholson, B., Sahay, S., Some Political and Cultural Issues in the Globalization of Software Development: Case experience from Britain and India (2001) Information and Organization, 11 (1), pp. 25-44; Parker, M., (2000) Organizational Culture and Identity, , London: Sage Publications; Patton, M.Q., (2002) Qualitative Research and Evaluation Methods, , Thousand Oaks, CA: SAGE Publications; Robey, D., Azevedo, A., Cultural Analysis of the Organizational Consequences of Information Technology (1994) Accounting, Management and Information Technology, 4 (1), pp. 23-37; Rubona, J.J. (2001). Routine Health Information Systems That Operate in Tanzania, in The RHINO Workshop on Issues and Innovation in Routine Health Information in Developing Countries (The Bolger Center, Potomac, 2001); Arlington, VA: Measure Evaluation, JSI Research and Training Institute. 183-193; Schein, E.H., (1992) Organizational Culture and Leadership, , San Francisco, CA: Jossey-Bass; Suchman, L.A., (1987) Plans and Situated Actions: The problem of human - machine communication, , Cambridge, UK: Cambridge University Press; Suchman, L.A., Making Work Visible (1995) Communication of the ACM, 38 (9), pp. 56-64; Vygotsky, L.S., (1978) Mind and Society, , Cambridge, MA: Harvard University Press; Westrup, C., Liu, W., El-Sayed, H. and Jaghoub, S.A. (2002). Taking Culture Seriously: ICTs, cultures and development, in seventh International Working Conference of IFIP WG 9.4 (Bangalore, India, 2002); Bangalore: Indian Institute of Management Bangalore and IFIP. 13-28; (2002) WHO Country Cooperation Strategy: United Republic of Tanzania 2002-2005, , World Health Organization , Brazzaville: WHO Regional Office for Africa",Conference Paper,Scopus
"Abdel-Wahab A.G.","Modeling students' intention to adopt e-learning a case from Egypt",2008,"Turkish Online Journal of Distance Education","https://www.scopus.com/inward/record.uri?eid=2-s2.0-40249106574&partnerID=40&md5=cb4ed0ac97867daf7c4e015661244271","Abdel-Wahab, A., (2007) Management, , http://ahmed-abdel-wahab.blogspot.com, Available at; Azjen, I., Fishbein, M., (1980) Understanding attitudes and predicting social behavior, , Englewood Cliffs, NJ: Prentice Hall; Beckstrom, M., Croasdale, H., Riad, S.M., Kamel, M.M., (2004) Assessment of Egypt's E-learning Readiness, , http://www.ltssw.bris.ac.uk/events/egypt/ellen/readiness.doc, Available at; Conrad, K & TrainningLinks 2000, instruction design for web-based training. Amherst: HRD Press; Davis, F.D., (1985) A technology acceptance model for empirically testing new end-user information systems: Theory and results, doctoral, , dissertation, MIT Sloan School of Management, Cambridge, MA; Davis, F.D., Bagozzi, R.P., Warsaw, P.R., User acceptanceof computer technology: A comparison of two theoretical models (1989) Management Science, 35, pp. 982-1003; Fayek, M., E-Learning and its Application in Egypt (2004) a presentation made at Aachen, , University of Technology,Germany; Fishbein, M., Azjen, I., (1975) Belief, attitude, intentions, and behavior: An introduction to theory and research, , Reading, MA: Addison-Wesley; Garrison, R., Anderson, T., (2003) E-learning in the 21st century: A framework for research and practice, , London: Routledge Falmer; Govindasamy, T., Successful implementation of e-learning: Pedagogical considerations (2002) Internet and Higher Education, 4, pp. 287-299; Hill, T., Smith, N.D., Mann, M.F., Role of efficacy expectations in predicting the decision to use advanced technologies: A case of computers (1987) Journal of Applied Psychology, 72, pp. 307-318; Kamel, S., Wahba, K., (2003) The Use of a Hybrid Model in Web-Based Education: The Global Campus Project in Web-Based Education: Learning From Experience, pp. 331-346. , edited by Anil Aggarwal, Hershey: Information Science Publishing, pp; MacDonald, C 3, Stodel, E 3, Fames, L G, Breithaupt, K, Gabriel, M A. the demand-driven learning model: a framework for web-based learning. The Internet and Higher Education 4(2001); (2006), http://mansvu.mans.edu.eg/index.php, Mansoura University E learning unit, available at; Mathieson, K., Predicting user intention: Comparing the technology acceptance model with theory of planned behavior (1991) Information systems Research, 2, pp. 173-191; (2005) E-learning in tertiary education, , http;//www.oecd.org, available at; Parikh, M., Verma, S., Utilizing Internet technologies to support learning: An empirical analysis (2002) International Journal of Information Management, 22 (1), pp. 27-46; Pavri, F., An empirical investigation of the factors contributing to micro-computer usage (1988), dissertation, University of Western Ontario; Rosenberg, M.J., (2001) E-learning strategies for delivering knowledge in the digital age, , New York: McGraw-Hill; Sheppard, B.H., Hartwick, J., Warsaw, P.R., The Theory of reasoned action: A meta-analysis of past research with recommendation for modifications and future research (1988) Journal of Consumer Research, 15, pp. 325-343; Zemsky, R., Massy,W., Thwarted innovation: What happened to e-learning and why, The learning Alliance at the University of Pennsylvania. Retrieved from: http://www.irhe.upenn.edu/WeatherStation.html",Article,Scopus
